{"hash": -1695252555, "cobalt_strike_beacon": {"x86": {"beacon_type": "HTTPS", "jitter": 39, "dns-beacon.strategy_rotate_seconds": -1, "useragent_header": "Mozilla/5.0 (iPhone; CPU iPhone OS 12_0 like Mac OS X) AppleWebKit/605.1.15 (KHTML, like Gecko) Version/12.0", "http-post.client": ["Host: tcessolution.com", "Connection: close", "Content-Type: text/plain", "__session__id=", "Cookie"], "maxgetsize": 2797085, "process-inject.min_alloc": 13020, "post-ex.spawnto_x86": "%windir%\\syswow64\\WUAUCLT.exe", "port": 443, "sleeptime": 57025, "uses_cookies": 1, "proxy.behavior": "2 (Use IE settings)", "process-inject.execute": ["CreateThread", "RtlCreateUserThread", "CreateRemoteThread"], "process-inject.startrwx": 4, "post-ex.spawnto_x64": "%windir%\\sysnative\\WUAUCLT.exe", "process-inject.stub": "71f9c7b0a6c7ae0881d0884ecd78d667", "http-get.uri": "tcessolution.com,/dz.js", "watermark": 587247372, "dns-beacon.strategy_fail_seconds": -1, "server.publickey_md5": "1b21a0b09630347b8f563fe3cba54717", "dns-beacon.strategy_fail_x": -1, "stage.cleanup": 1, "http-post.verb": "POST", "http-post.uri": "/posting", "process-inject.userwx": 32, "http-get.verb": "GET", "http-get.client": ["Host: tcessolution.com", "Connection: close", "Accept: */*", "Accept-Language: fr-CH, fr;q=0.9, en;q=0.8, de;q=0.7, *;q=0.5", "LSID=", "Cookie", "operation=true"]}, "x64": {"beacon_type": "HTTPS", "jitter": 39, "dns-beacon.strategy_rotate_seconds": -1, "useragent_header": "Mozilla/5.0 (iPhone; CPU iPhone OS 12_0 like Mac OS X) AppleWebKit/605.1.15 (KHTML, like Gecko) Version/12.0", "http-post.client": ["Host: tcessolution.com", "Connection: close", "Content-Type: text/plain", "__session__id=", "Cookie"], "maxgetsize": 2797085, "process-inject.min_alloc": 13020, "post-ex.spawnto_x86": "%windir%\\syswow64\\WUAUCLT.exe", "port": 443, "sleeptime": 57025, "uses_cookies": 1, "proxy.behavior": "2 (Use IE settings)", "process-inject.execute": ["CreateThread", "RtlCreateUserThread", "CreateRemoteThread"], "process-inject.startrwx": 4, "post-ex.spawnto_x64": "%windir%\\sysnative\\WUAUCLT.exe", "process-inject.stub": "71f9c7b0a6c7ae0881d0884ecd78d667", "http-get.uri": "tcessolution.com,/fam_calendar.js", "watermark": 587247372, "dns-beacon.strategy_fail_seconds": -1, "server.publickey_md5": "1b21a0b09630347b8f563fe3cba54717", "dns-beacon.strategy_fail_x": -1, "stage.cleanup": 1, "http-post.verb": "POST", "http-post.uri": "/posting", "process-inject.userwx": 32, "http-get.verb": "GET", "http-get.client": ["Host: tcessolution.com", "Connection: close", "Accept: */*", "Accept-Language: fr-CH, fr;q=0.9, en;q=0.8, de;q=0.7, *;q=0.5", "LSID=", "Cookie", "operation=true"]}}, "product": "Cobalt Strike Beacon", "http": {"status": 404, "robots_hash": null, "redirects": [], "securitytxt": null, "title": null, "sitemap_hash": null, "robots": null, "server": "ESF", "headers_hash": 11853219, "host": "91.103.253.48", "html": "", "location": "/", "html_hash": 0, "sitemap": null, "securitytxt_hash": null}, "os": null, "asn": "AS28753", "timestamp": "2023-09-02T22:16:14.595459", "isp": "Leaseweb Deutschland GmbH", "transport": "tcp", "_shodan": {"region": "eu", "ptr": true, "module": "https", "id": "dd5b8e67-8ba3-46a7-b487-561917f92200", "options": {}, "crawler": "487814a778c983e2dcef234806292d88c5cbf3ec"}, "ssl": {"chain_sha256": ["28091f561013c56072437c89d8b613de57883354bf5c4b31fbd14a087dd40260"], "jarm": "2ad2ad16d2ad2ad00042d42d00042ddb04deffa1705e2edc44cae1ed24a4da", "chain": ["-----BEGIN CERTIFICATE-----\nMIIE7zCCA9egAwIBAgISA0IR+GHw825+hpBmq/MmnO2bMA0GCSqGSIb3DQEBCwUA\nMDIxCzAJBgNVBAYTAlVTMRYwFAYDVQQKEw1MZXQncyBFbmNyeXB0MQswCQYDVQQD\nEwJSMzAeFw0yMzA3MjQxMzU5MjNaFw0yMzEwMjIxMzU5MjJaMBsxGTAXBgNVBAMT\nEHRjZXNzb2x1dGlvbi5jb20wggEiMA0GCSqGSIb3DQEBAQUAA4IBDwAwggEKAoIB\nAQDF/qG3HQwOHa6lnE5a/b4HdWvtHSIyqfdNmSeQg1cXJ+4ndqHNIo1iF4wtLrlJ\ndESvW3WLbyiKuqP2SKYBXJ70gXXBovJNAeCeXqQwscLTQW6KSsF9IjC1fl5RDT2k\nVDaL3g1GX79z0H+wtv9Vx7voI/uZZx+9UIaxeNKEgsElHHNS0ju1znFFWjSBi9f/\nMSHVKuCtb3RC7OUyCqploSi/SFcdnTttkSfhhLB6Lmix4TKNw4rZUgQDRwAosCny\nxX8e7mDbVHPd2rt4TJDGjSaO60Ou28pynRecDad5wt0CivE4AzypUFxxjoQfOM12\nNKDqyN6yZzQXtGm9xAk87bs9AgMBAAGjggIUMIICEDAOBgNVHQ8BAf8EBAMCBaAw\nHQYDVR0lBBYwFAYIKwYBBQUHAwEGCCsGAQUFBwMCMAwGA1UdEwEB/wQCMAAwHQYD\nVR0OBBYEFHq+03bpSzx+f/V4YObHWfBKFMDZMB8GA1UdIwQYMBaAFBQusxe3WFbL\nrlAJQOYfr52LFMLGMFUGCCsGAQUFBwEBBEkwRzAhBggrBgEFBQcwAYYVaHR0cDov\nL3IzLm8ubGVuY3Iub3JnMCIGCCsGAQUFBzAChhZodHRwOi8vcjMuaS5sZW5jci5v\ncmcvMBsGA1UdEQQUMBKCEHRjZXNzb2x1dGlvbi5jb20wEwYDVR0gBAwwCjAIBgZn\ngQwBAgEwggEGBgorBgEEAdZ5AgQCBIH3BIH0APIAdwC3Pvsk35xNunXyOcW6WPRs\nXfxCz3qfNcSeHQmBJe20mQAAAYmIaYGoAAAEAwBIMEYCIQD9Idk8apFwBdQusilb\ncPoHTQiYrEhGePGVjpZU5/KueQIhAKhlMAxqx8nfmc96Pcxv4hDc0xHPcbmScrE6\njxh6zUFrAHcA6D7Q2j71BjUy51covIlryQPTy9ERa+zraeF3fW0GvW4AAAGJiGmB\npAAABAMASDBGAiEA0GcZlrkr8ZjGIePUnEVLJx7ddidi3YDDSlFujDHUTtoCIQD7\nX+QPWWrKb3irgcC86gdDCB3/gG1+3MDK5OuXN+iMnDANBgkqhkiG9w0BAQsFAAOC\nAQEAkeLaMR3BPaJZmwxnOCmyZyMfJFEpIv1HFtqQ/3hSHfcsShURj5WvBeLo1Rc0\n9xEJjCczGy9mW2Pssv/zguwIFk9GKsQbnXoDq3lZ6WwhnHvO5GpgoUULn6K47pJU\nDbMjxQsx4KzkHxcQrbXT56+/NhrZ45GobUC2x2YPxh6rSb+16K1ZjWXsZglR+DyX\nXR/VTtw7xnXMyLJO6GURyD+l/fezSF38gTBtfYJcuUEC5KPHdPaUeqIXG1nUIZxI\nyBccpFvp7yIoLr+BtBg4kNMaWHYQsf0GYLSktNAKfvmWeHEkM+hUHncH0RWnyxZc\nXAnE6F2400thtwOlQgEFkulbQA==\n-----END CERTIFICATE-----\n"], "dhparams": {"prime": "ffffffffffffffffc90fdaa22168c234c4c6628b80dc1cd129024e088a67cc74020bbea63b139b22514a08798e3404ddef9519b3cd3a431b302b0a6df25f14374fe1356d6d51c245e485b576625e7ec6f44c42e9a637ed6b0bff5cb6f406b7edee386bfb5a899fa5ae9f24117c4b1fe649286651ece65381ffffffffffffffff", "public_key": "96fdc1ab1caea975f4ac7f873602498c723840c79530a9f06fb478e58d322c5598b6007b6f70fade103d9dd72903e6a0b24f9204a3a61f83d9e0297e20f7b4b2fcd6ade5ed497e86890b9abe9454f0b789c6ba9754203aa0b7baf8be6df634158fc6026b91fad2340108796b8a284dca709f471904e8b5951de31375f3f24a63", "bits": 1024, "generator": 2, "fingerprint": "RFC2409/Oakley Group 2"}, "versions": ["-TLSv1", "-SSLv2", "-SSLv3", "-TLSv1.1", "TLSv1.2", "TLSv1.3"], "acceptable_cas": [], "tlsext": [{"id": 43, "name": "supported_versions"}, {"id": 51, "name": "key_share"}, {"id": 10, "name": "supported_groups"}], "ja3s": "f03a69cfa3944d6d51bc52febd87a1a8", "cert": {"sig_alg": "sha256WithRSAEncryption", "issued": "20230724135923Z", "expires": "20231022135922Z", "expired": false, "version": 2, "extensions": [{"critical": true, "data": "\\x03\\x02\\x05\\xa0", "name": "keyUsage"}, {"data": "0\\x14\\x06\\x08+\\x06\\x01\\x05\\x05\\x07\\x03\\x01\\x06\\x08+\\x06\\x01\\x05\\x05\\x07\\x03\\x02", "name": "extendedKeyUsage"}, {"critical": true, "data": "0\\x00", "name": "basicConstraints"}, {"data": "\\x04\\x14z\\xbe\\xd3v\\xe9K<~\\x7f\\xf5x`\\xe6\\xc7Y\\xf0J\\x14\\xc0\\xd9", "name": "subjectKeyIdentifier"}, {"data": "0\\x16\\x80\\x14\\x14.\\xb3\\x17\\xb7XV\\xcb\\xaeP\\t@\\xe6\\x1f\\xaf\\x9d\\x8b\\x14\\xc2\\xc6", "name": "authorityKeyIdentifier"}, {"data": "0G0!\\x06\\x08+\\x06\\x01\\x05\\x05\\x070\\x01\\x86\\x15http://r3.o.lencr.org0\"\\x06\\x08+\\x06\\x01\\x05\\x05\\x070\\x02\\x86\\x16http://r3.i.lencr.org/", "name": "authorityInfoAccess"}, {"data": "0\\x12\\x82\\x10tcessolution.com", "name": "subjectAltName"}, {"data": "0\\n0\\x08\\x06\\x06g\\x81\\x0c\\x01\\x02\\x01", "name": "certificatePolicies"}, {"data": "\\x04\\x81\\xf4\\x00\\xf2\\x00w\\x00\\xb7>\\xfb$\\xdf\\x9cM\\xbau\\xf29\\xc5\\xbaX\\xf4l]\\xfcB\\xcfz\\x9f5\\xc4\\x9e\\x1d\\t\\x81%\\xed\\xb4\\x99\\x00\\x00\\x01\\x89\\x88i\\x81\\xa8\\x00\\x00\\x04\\x03\\x00H0F\\x02!\\x00\\xfd!\\xd9<j\\x91p\\x05\\xd4.\\xb2)[p\\xfa\\x07M\\x08\\x98\\xacHFx\\xf1\\x95\\x8e\\x96T\\xe7\\xf2\\xaey\\x02!\\x00\\xa8e0\\x0cj\\xc7\\xc9\\xdf\\x99\\xcfz=\\xcco\\xe2\\x10\\xdc\\xd3\\x11\\xcfq\\xb9\\x92r\\xb1:\\x8f\\x18z\\xcdAk\\x00w\\x00\\xe8>\\xd0\\xda>\\xf5\\x0652\\xe7W(\\xbc\\x89k\\xc9\\x03\\xd3\\xcb\\xd1\\x11k\\xec\\xebi\\xe1w}m\\x06\\xbdn\\x00\\x00\\x01\\x89\\x88i\\x81\\xa4\\x00\\x00\\x04\\x03\\x00H0F\\x02!\\x00\\xd0g\\x19\\x96\\xb9+\\xf1\\x98\\xc6!\\xe3\\xd4\\x9cEK\\'\\x1e\\xddv\\'b\\xdd\\x80\\xc3JQn\\x8c1\\xd4N\\xda\\x02!\\x00\\xfb_\\xe4\\x0fYj\\xcaox\\xab\\x81\\xc0\\xbc\\xea\\x07C\\x08\\x1d\\xff\\x80m~\\xdc\\xc0\\xca\\xe4\\xeb\\x977\\xe8\\x8c\\x9c", "name": "ct_precert_scts"}], "fingerprint": {"sha256": "28091f561013c56072437c89d8b613de57883354bf5c4b31fbd14a087dd40260", "sha1": "fbb1738d47d83ef9eb27c3163b5c9e0394b992ed"}, "serial": 283819380564095767729908325227954639269275, "subject": {"CN": "tcessolution.com"}, "pubkey": {"type": "rsa", "bits": 2048}, "issuer": {"C": "US", "CN": "R3", "O": "Let's Encrypt"}}, "cipher": {"version": "TLSv1.3", "bits": 256, "name": "TLS_AES_256_GCM_SHA384"}, "trust": {"revoked": false, "browser": null}, "handshake_states": ["before SSL initialization", "SSLv3/TLS write client hello", "SSLv3/TLS read server hello", "TLSv1.3 read encrypted extensions", "SSLv3/TLS read server certificate", "TLSv1.3 read server certificate verify", "SSLv3/TLS read finished", "SSLv3/TLS write change cipher spec", "SSLv3/TLS write finished", "SSL negotiation finished successfully"], "alpn": [], "ocsp": {}}, "hostnames": ["tcessolution.com"], "location": {"city": "Frankfurt am Main", "region_code": "HE", "area_code": null, "longitude": 8.644, "latitude": 50.0837, "country_code": "DE", "country_name": "Germany"}, "ip": 1533541680, "domains": ["tcessolution.com"], "org": "GTELCOM LLC", "data": "HTTP/1.1 404 Not Found\r\nDate: Sat, 2 Sep 2023 22:16:14 GMT\r\nContent-Type: text/plain\r\nContent-Length: 0\r\nServer: ESF\r\n\r\n\nCobalt Strike Beacon:\n  x86:\n    beacon_type: HTTPS\n    dns-beacon.strategy_fail_seconds: -1\n    dns-beacon.strategy_fail_x: -1\n    dns-beacon.strategy_rotate_seconds: -1\n    http-get.client:\n      Host: tcessolution.com\n      Connection: close\n      Accept: */*\n      Accept-Language: fr-CH, fr;q=0.9, en;q=0.8, de;q=0.7, *;q=0.5\n      LSID=\n      Cookie\n      operation=true\n    http-get.uri: tcessolution.com,/dz.js\n    http-get.verb: GET\n    http-post.client:\n      Host: tcessolution.com\n      Connection: close\n      Content-Type: text/plain\n      __session__id=\n      Cookie\n    http-post.uri: /posting\n    http-post.verb: POST\n    jitter: 39\n    maxgetsize: 2797085\n    port: 443\n    post-ex.spawnto_x64: %windir%\\sysnative\\WUAUCLT.exe\n    post-ex.spawnto_x86: %windir%\\syswow64\\WUAUCLT.exe\n    process-inject.execute:\n      CreateThread\n      RtlCreateUserThread\n      CreateRemoteThread\n    process-inject.min_alloc: 13020\n    process-inject.startrwx: 4\n    process-inject.stub: 71f9c7b0a6c7ae0881d0884ecd78d667\n    process-inject.userwx: 32\n    proxy.behavior: 2 (Use IE settings)\n    server.publickey_md5: 1b21a0b09630347b8f563fe3cba54717\n    sleeptime: 57025\n    stage.cleanup: 1\n    useragent_header: Mozilla/5.0 (iPhone; CPU iPhone OS 12_0 like Mac OS X) AppleWebKit/605.1.15 (KHTML, like Gecko) Version/12.0\n    uses_cookies: 1\n    watermark: 587247372\n  x64:\n    beacon_type: HTTPS\n    dns-beacon.strategy_fail_seconds: -1\n    dns-beacon.strategy_fail_x: -1\n    dns-beacon.strategy_rotate_seconds: -1\n    http-get.client:\n      Host: tcessolution.com\n      Connection: close\n      Accept: */*\n      Accept-Language: fr-CH, fr;q=0.9, en;q=0.8, de;q=0.7, *;q=0.5\n      LSID=\n      Cookie\n      operation=true\n    http-get.uri: tcessolution.com,/fam_calendar.js\n    http-get.verb: GET\n    http-post.client:\n      Host: tcessolution.com\n      Connection: close\n      Content-Type: text/plain\n      __session__id=\n      Cookie\n    http-post.uri: /posting\n    http-post.verb: POST\n    jitter: 39\n    maxgetsize: 2797085\n    port: 443\n    post-ex.spawnto_x64: %windir%\\sysnative\\WUAUCLT.exe\n    post-ex.spawnto_x86: %windir%\\syswow64\\WUAUCLT.exe\n    process-inject.execute:\n      CreateThread\n      RtlCreateUserThread\n      CreateRemoteThread\n    process-inject.min_alloc: 13020\n    process-inject.startrwx: 4\n    process-inject.stub: 71f9c7b0a6c7ae0881d0884ecd78d667\n    process-inject.userwx: 32\n    proxy.behavior: 2 (Use IE settings)\n    server.publickey_md5: 1b21a0b09630347b8f563fe3cba54717\n    sleeptime: 57025\n    stage.cleanup: 1\n    useragent_header: Mozilla/5.0 (iPhone; CPU iPhone OS 12_0 like Mac OS X) AppleWebKit/605.1.15 (KHTML, like Gecko) Version/12.0\n    uses_cookies: 1\n    watermark: 587247372\n", "port": 443, "opts": {"vulns": [], "heartbleed": "2023/09/02 22:16:22 91.103.253.48:443 - SAFE\n"}, "ip_str": "91.103.253.48"}
{"hash": 1838379862, "cobalt_strike_beacon": {"x86": {"beacon_type": "HTTPS", "dns-beacon.strategy_rotate_seconds": -1, "useragent_header": "Mozilla/5.0 (compatible; MSIE 9.0; Windows NT 6.1; WOW64; Trident/5.0; Avant Browser)", "http-post.client": ["Content-Type: application/octet-stream", "id"], "maxgetsize": 1048576, "post-ex.spawnto_x86": "%windir%\\syswow64\\rundll32.exe", "port": 443, "sleeptime": 60000, "uses_cookies": 1, "proxy.behavior": "2 (Use IE settings)", "process-inject.execute": ["CreateThread", "SetThreadContext", "CreateRemoteThread", "RtlCreateUserThread"], "process-inject.startrwx": 64, "post-ex.spawnto_x64": "%windir%\\sysnative\\rundll32.exe", "process-inject.stub": "b50b86d735412685eb6044ad8d01781c", "http-get.uri": "www.microsoft-update.club,/ga.js", "watermark": 391144938, "dns-beacon.strategy_fail_seconds": -1, "host_header": "Host: www.microsoft-update.club\r\n", "server.publickey_md5": "690363362205465881ba4710c6104926", "dns-beacon.strategy_fail_x": -1, "http-post.verb": "POST", "http-post.uri": "/submit.php", "process-inject.userwx": 64, "http-get.verb": "GET", "http-get.client": ["Cookie"]}, "x64": {"beacon_type": "HTTPS", "dns-beacon.strategy_rotate_seconds": -1, "useragent_header": "Mozilla/5.0 (compatible; MSIE 9.0; Windows NT 6.0; Trident/5.0; BOIE9;ENUS)", "http-post.client": ["Content-Type: application/octet-stream", "id"], "maxgetsize": 1048576, "post-ex.spawnto_x86": "%windir%\\syswow64\\rundll32.exe", "port": 443, "sleeptime": 60000, "uses_cookies": 1, "proxy.behavior": "2 (Use IE settings)", "process-inject.execute": ["CreateThread", "SetThreadContext", "CreateRemoteThread", "RtlCreateUserThread"], "process-inject.startrwx": 64, "post-ex.spawnto_x64": "%windir%\\sysnative\\rundll32.exe", "process-inject.stub": "b50b86d735412685eb6044ad8d01781c", "http-get.uri": "www.microsoft-update.club,/en_US/all.js", "watermark": 391144938, "dns-beacon.strategy_fail_seconds": -1, "host_header": "Host: www.microsoft-update.club\r\n", "server.publickey_md5": "690363362205465881ba4710c6104926", "dns-beacon.strategy_fail_x": -1, "http-post.verb": "POST", "http-post.uri": "/submit.php", "process-inject.userwx": 64, "http-get.verb": "GET", "http-get.client": ["Cookie"]}}, "product": "Cobalt Strike Beacon", "http": {"status": 404, "robots_hash": null, "redirects": [], "securitytxt": null, "title": null, "sitemap_hash": null, "robots": null, "server": null, "headers_hash": 2129120964, "host": "124.220.10.78", "html": "", "location": "/", "html_hash": 0, "sitemap": null, "securitytxt_hash": null}, "os": null, "asn": "AS45090", "tags": ["self-signed"], "timestamp": "2023-09-02T15:21:25.055719", "isp": "Shenzhen Tencent Computer Systems Company Limited", "transport": "tcp", "_shodan": {"region": "eu", "ptr": true, "module": "https", "id": "a835e469-5193-4dab-bf79-8ae3107ac833", "options": {}, "crawler": "487814a778c983e2dcef234806292d88c5cbf3ec"}, "ssl": {"chain_sha256": ["87f2085c32b6a2cc709b365f55873e207a9caa10bffecf2fd16d3cf9d94d390c"], "jarm": "2ad2ad16d2ad2ad00042d42d00042ddb04deffa1705e2edc44cae1ed24a4da", "chain": ["-----BEGIN CERTIFICATE-----\nMIIDIzCCAgugAwIBAgIECLsA7jANBgkqhkiG9w0BAQsFADBCMQkwBwYDVQQGEwAx\nCTAHBgNVBAgTADEJMAcGA1UEBxMAMQkwBwYDVQQKEwAxCTAHBgNVBAsTADEJMAcG\nA1UEAxMAMB4XDTE1MDUyMDE4MjYyNFoXDTI1MDUxNzE4MjYyNFowQjEJMAcGA1UE\nBhMAMQkwBwYDVQQIEwAxCTAHBgNVBAcTADEJMAcGA1UEChMAMQkwBwYDVQQLEwAx\nCTAHBgNVBAMTADCCASIwDQYJKoZIhvcNAQEBBQADggEPADCCAQoCggEBAJjXGpNx\njm97YowJUxMyM/QBjGTnyUqMXt1IsXArVdop3F/fGdhsmWkExTt8AfjWm9TL2I3K\nCVKqBhQ9U8+W+l3JAPNaqLnOqRSfeQ+SQ0tmLuVn1AVQt1RKYZGo+o70G/yAXBNw\nCQ3mUisLe6Ln926E3seZM6gb8HesF/w+2sCcQ2UaqLY3hKVIDYvlenNaNMxtaw+8\nA/3udT+pIX1JyrlIlt0SDg5Ya2opwYTFJM64KbuyDKkK213A5Sz00Rh13PVRKWlp\nfVtgoh9BNupzJOG/GE/x0XmXCYAOIGrm8uujAtUWJ5nkbaczf2ldnITJBw+3iQrt\nE1LEM8aUJeKRCVkCAwEAAaMhMB8wHQYDVR0OBBYEFHNrXtvPyRkdW9AfjOOrVjgY\nnwJPMA0GCSqGSIb3DQEBCwUAA4IBAQBU9S+o9YRFBTzcCeZ4phipmwJ9PsIFKoid\ngkTekbt3EzyL+Q+nySQ/Gn4ZXdliFYxKNcRmxbSWCa9jX6qJb6t7gcLBP8Hp7kWL\nsNdbk19+iSDphVfO6UdL6ZVIbIy0vNO0/LgEKVi7tzE84elcaS45ZSPY+HnySF2s\nP3SF0n9iF/bWdzYOjLcPpgavsT66KLrileXkYjCWFOXufnZgpf11pGd3wTJEIenS\nabc90LQ4rAvBJPicY/AfhIth/g4GiDG+M1DmzlV+1F0nNr3KuNGjeghLVegKoRq/\nb5PF+0kpSK7HUwIdrgZsqz1ORsMToEyv8LvxIyL0DTCLBJSHmgJy\n-----END CERTIFICATE-----\n"], "dhparams": {"prime": "ffffffffffffffffc90fdaa22168c234c4c6628b80dc1cd129024e088a67cc74020bbea63b139b22514a08798e3404ddef9519b3cd3a431b302b0a6df25f14374fe1356d6d51c245e485b576625e7ec6f44c42e9a637ed6b0bff5cb6f406b7edee386bfb5a899fa5ae9f24117c4b1fe649286651ece65381ffffffffffffffff", "public_key": "c0abbf4e51ff1aff35cbca4ad9900767f814eb670098d2017e1305ae52846df6f8a8e2ca2bc007d6a0fa2414663ef1156c4ab579f1b4a7d3343830de37a85d277acb9d15c919909c68db2ff3ec9d8f072734d892bb40f4efea61d972bef59a7ee6434929c41285e54eedc468eb594d918628bee40762ab2152200b48890c287b", "bits": 1024, "generator": 2, "fingerprint": "RFC2409/Oakley Group 2"}, "versions": ["-TLSv1", "-SSLv2", "-SSLv3", "-TLSv1.1", "TLSv1.2"], "acceptable_cas": [], "tlsext": [{"id": 43, "name": "supported_versions"}, {"id": 51, "name": "key_share"}, {"id": 10, "name": "supported_groups"}], "ja3s": "f03a69cfa3944d6d51bc52febd87a1a8", "cert": {"sig_alg": "sha256WithRSAEncryption", "issued": "20150520182624Z", "expires": "20250517182624Z", "expired": false, "version": 2, "extensions": [{"data": "\\x04\\x14sk^\\xdb\\xcf\\xc9\\x19\\x1d[\\xd0\\x1f\\x8c\\xe3\\xabV8\\x18\\x9f\\x02O", "name": "subjectKeyIdentifier"}], "fingerprint": {"sha256": "87f2085c32b6a2cc709b365f55873e207a9caa10bffecf2fd16d3cf9d94d390c", "sha1": "6ece5ece4192683d2d84e25b0ba7e04f9cb7eb7c"}, "serial": 146473198, "subject": {"C": "", "CN": "", "L": "", "O": "", "ST": "", "OU": ""}, "pubkey": {"type": "rsa", "bits": 2048}, "issuer": {"C": "", "CN": "", "L": "", "O": "", "ST": "", "OU": ""}}, "cipher": {"version": "TLSv1.3", "bits": 256, "name": "TLS_AES_256_GCM_SHA384"}, "trust": {"revoked": false, "browser": null}, "handshake_states": ["before SSL initialization", "SSLv3/TLS write client hello", "SSLv3/TLS read server hello", "TLSv1.3 read encrypted extensions", "SSLv3/TLS read server certificate", "TLSv1.3 read server certificate verify", "SSLv3/TLS read finished", "SSLv3/TLS write change cipher spec", "SSLv3/TLS write finished", "SSL negotiation finished successfully"], "alpn": [], "ocsp": {}}, "hostnames": [], "location": {"city": "Beijing", "region_code": "BJ", "area_code": null, "longitude": 116.39723, "latitude": 39.9075, "country_code": "CN", "country_name": "China"}, "ip": 2094795342, "domains": [], "org": "Tencent cloud computing (Beijing) Co., Ltd.", "data": "HTTP/1.1 404 Not Found\r\nDate: Sat, 2 Sep 2023 15:21:24 GMT\r\nContent-Type: text/plain\r\nContent-Length: 0\r\n\r\n\nCobalt Strike Beacon:\n  x86:\n    beacon_type: HTTPS\n    dns-beacon.strategy_fail_seconds: -1\n    dns-beacon.strategy_fail_x: -1\n    dns-beacon.strategy_rotate_seconds: -1\n    host_header: Host: www.microsoft-update.club\r\n\n    http-get.client:\n      Cookie\n    http-get.uri: www.microsoft-update.club,/ga.js\n    http-get.verb: GET\n    http-post.client:\n      Content-Type: application/octet-stream\n      id\n    http-post.uri: /submit.php\n    http-post.verb: POST\n    maxgetsize: 1048576\n    port: 443\n    post-ex.spawnto_x64: %windir%\\sysnative\\rundll32.exe\n    post-ex.spawnto_x86: %windir%\\syswow64\\rundll32.exe\n    process-inject.execute:\n      CreateThread\n      SetThreadContext\n      CreateRemoteThread\n      RtlCreateUserThread\n    process-inject.startrwx: 64\n    process-inject.stub: b50b86d735412685eb6044ad8d01781c\n    process-inject.userwx: 64\n    proxy.behavior: 2 (Use IE settings)\n    server.publickey_md5: 690363362205465881ba4710c6104926\n    sleeptime: 60000\n    useragent_header: Mozilla/5.0 (compatible; MSIE 9.0; Windows NT 6.1; WOW64; Trident/5.0; Avant Browser)\n    uses_cookies: 1\n    watermark: 391144938\n  x64:\n    beacon_type: HTTPS\n    dns-beacon.strategy_fail_seconds: -1\n    dns-beacon.strategy_fail_x: -1\n    dns-beacon.strategy_rotate_seconds: -1\n    host_header: Host: www.microsoft-update.club\r\n\n    http-get.client:\n      Cookie\n    http-get.uri: www.microsoft-update.club,/en_US/all.js\n    http-get.verb: GET\n    http-post.client:\n      Content-Type: application/octet-stream\n      id\n    http-post.uri: /submit.php\n    http-post.verb: POST\n    maxgetsize: 1048576\n    port: 443\n    post-ex.spawnto_x64: %windir%\\sysnative\\rundll32.exe\n    post-ex.spawnto_x86: %windir%\\syswow64\\rundll32.exe\n    process-inject.execute:\n      CreateThread\n      SetThreadContext\n      CreateRemoteThread\n      RtlCreateUserThread\n    process-inject.startrwx: 64\n    process-inject.stub: b50b86d735412685eb6044ad8d01781c\n    process-inject.userwx: 64\n    proxy.behavior: 2 (Use IE settings)\n    server.publickey_md5: 690363362205465881ba4710c6104926\n    sleeptime: 60000\n    useragent_header: Mozilla/5.0 (compatible; MSIE 9.0; Windows NT 6.0; Trident/5.0; BOIE9;ENUS)\n    uses_cookies: 1\n    watermark: 391144938\n", "port": 8443, "opts": {"vulns": [], "heartbleed": "2023/09/02 15:21:53 124.220.10.78:8443 - SAFE\n"}, "ip_str": "124.220.10.78"}
{"hash": -2088729890, "cobalt_strike_beacon": {"x86": {"beacon_type": "HTTP", "dns-beacon.strategy_rotate_seconds": -1, "useragent_header": "Mozilla/5.0 (compatible; MSIE 9.0; Windows NT 6.1; Trident/5.0; NP07; NP07)", "http-post.client": ["Content-Type: application/octet-stream", "id"], "maxgetsize": 1048576, "post-ex.spawnto_x86": "%windir%\\syswow64\\rundll32.exe", "port": 80, "sleeptime": 60000, "uses_cookies": 1, "proxy.behavior": "2 (Use IE settings)", "process-inject.execute": ["CreateThread", "SetThreadContext", "CreateRemoteThread", "RtlCreateUserThread"], "process-inject.startrwx": 64, "post-ex.spawnto_x64": "%windir%\\sysnative\\rundll32.exe", "process-inject.stub": "e610fb275e433a354448e0a5b2daa09e", "http-get.uri": "121.196.235.124,/ca", "watermark": 6, "dns-beacon.strategy_fail_seconds": -1, "process-inject.userwx": 64, "dns-beacon.strategy_fail_x": -1, "http-post.verb": "POST", "http-post.uri": "/submit.php", "server.publickey_md5": "79fc2fa317ef651b469d6891844d6cfc", "http-get.verb": "GET", "http-get.client": ["Cookie"]}, "x64": {"beacon_type": "HTTP", "dns-beacon.strategy_rotate_seconds": -1, "useragent_header": "Mozilla/4.0 (compatible; MSIE 8.0; Windows NT 6.0; Trident/4.0)", "http-post.client": ["Content-Type: application/octet-stream", "id"], "maxgetsize": 1048576, "post-ex.spawnto_x86": "%windir%\\syswow64\\rundll32.exe", "port": 80, "sleeptime": 60000, "uses_cookies": 1, "proxy.behavior": "2 (Use IE settings)", "process-inject.execute": ["CreateThread", "SetThreadContext", "CreateRemoteThread", "RtlCreateUserThread"], "process-inject.startrwx": 64, "post-ex.spawnto_x64": "%windir%\\sysnative\\rundll32.exe", "process-inject.stub": "e610fb275e433a354448e0a5b2daa09e", "http-get.uri": "121.196.235.124,/pixel.gif", "watermark": 6, "dns-beacon.strategy_fail_seconds": -1, "process-inject.userwx": 64, "dns-beacon.strategy_fail_x": -1, "http-post.verb": "POST", "http-post.uri": "/submit.php", "server.publickey_md5": "79fc2fa317ef651b469d6891844d6cfc", "http-get.verb": "GET", "http-get.client": ["Cookie"]}}, "product": "Cobalt Strike Beacon", "http": {"status": 404, "robots_hash": null, "redirects": [], "securitytxt": null, "title": null, "sitemap_hash": null, "robots": null, "server": null, "headers_hash": 2129120964, "host": "121.196.235.124", "html": "", "location": "/", "html_hash": 0, "sitemap": null, "securitytxt_hash": null}, "os": null, "timestamp": "2023-09-02T11:25:32.483649", "isp": "Hangzhou Alibaba Advertising Co.,Ltd.", "transport": "tcp", "_shodan": {"region": "eu", "ptr": true, "module": "http", "id": "dc78de78-0295-4a18-b7bc-88a184bbe48a", "options": {}, "crawler": "487814a778c983e2dcef234806292d88c5cbf3ec"}, "asn": "AS37963", "hostnames": [], "location": {"city": "Hangzhou", "region_code": "ZJ", "area_code": null, "longitude": 120.16142, "latitude": 30.29365, "country_code": "CN", "country_name": "China"}, "ip": 2042948476, "domains": [], "org": "Aliyun Computing Co., LTD", "data": "HTTP/1.1 404 Not Found\r\nDate: Sat, 2 Sep 2023 11:25:32 GMT\r\nContent-Type: text/plain\r\nContent-Length: 0\r\n\r\n\nCobalt Strike Beacon:\n  x86:\n    beacon_type: HTTP\n    dns-beacon.strategy_fail_seconds: -1\n    dns-beacon.strategy_fail_x: -1\n    dns-beacon.strategy_rotate_seconds: -1\n    http-get.client:\n      Cookie\n    http-get.uri: 121.196.235.124,/ca\n    http-get.verb: GET\n    http-post.client:\n      Content-Type: application/octet-stream\n      id\n    http-post.uri: /submit.php\n    http-post.verb: POST\n    maxgetsize: 1048576\n    port: 80\n    post-ex.spawnto_x64: %windir%\\sysnative\\rundll32.exe\n    post-ex.spawnto_x86: %windir%\\syswow64\\rundll32.exe\n    process-inject.execute:\n      CreateThread\n      SetThreadContext\n      CreateRemoteThread\n      RtlCreateUserThread\n    process-inject.startrwx: 64\n    process-inject.stub: e610fb275e433a354448e0a5b2daa09e\n    process-inject.userwx: 64\n    proxy.behavior: 2 (Use IE settings)\n    server.publickey_md5: 79fc2fa317ef651b469d6891844d6cfc\n    sleeptime: 60000\n    useragent_header: Mozilla/5.0 (compatible; MSIE 9.0; Windows NT 6.1; Trident/5.0; NP07; NP07)\n    uses_cookies: 1\n    watermark: 6\n  x64:\n    beacon_type: HTTP\n    dns-beacon.strategy_fail_seconds: -1\n    dns-beacon.strategy_fail_x: -1\n    dns-beacon.strategy_rotate_seconds: -1\n    http-get.client:\n      Cookie\n    http-get.uri: 121.196.235.124,/pixel.gif\n    http-get.verb: GET\n    http-post.client:\n      Content-Type: application/octet-stream\n      id\n    http-post.uri: /submit.php\n    http-post.verb: POST\n    maxgetsize: 1048576\n    port: 80\n    post-ex.spawnto_x64: %windir%\\sysnative\\rundll32.exe\n    post-ex.spawnto_x86: %windir%\\syswow64\\rundll32.exe\n    process-inject.execute:\n      CreateThread\n      SetThreadContext\n      CreateRemoteThread\n      RtlCreateUserThread\n    process-inject.startrwx: 64\n    process-inject.stub: e610fb275e433a354448e0a5b2daa09e\n    process-inject.userwx: 64\n    proxy.behavior: 2 (Use IE settings)\n    server.publickey_md5: 79fc2fa317ef651b469d6891844d6cfc\n    sleeptime: 60000\n    useragent_header: Mozilla/4.0 (compatible; MSIE 8.0; Windows NT 6.0; Trident/4.0)\n    uses_cookies: 1\n    watermark: 6\n", "port": 80, "opts": {}, "ip_str": "121.196.235.124"}
{"hash": -1308207688, "cobalt_strike_beacon": {"x86": {"beacon_type": "HTTP", "useragent_header": "Mozilla/5.0 (Windows NT 6.1; Trident/7.0; rv:11.0) like Gecko", "http-post.client": ["Content-Type: application/octet-stream", "id"], "maxgetsize": 1048576, "post-ex.spawnto_x86": "%windir%\\syswow64\\rundll32.exe", "port": 80, "sleeptime": 60000, "uses_cookies": 1, "proxy.behavior": "2 (Use IE settings)", "process-inject.execute": ["CreateThread", "SetThreadContext", "CreateRemoteThread", "RtlCreateUserThread"], "process-inject.startrwx": 64, "post-ex.spawnto_x64": "%windir%\\sysnative\\rundll32.exe", "process-inject.stub": "a56c813864af878a4c10083ca1578e0a", "http-get.uri": "119.45.183.207,/dpixel", "watermark": 305419896, "process-inject.userwx": 64, "http-post.verb": "POST", "http-post.uri": "/submit.php", "dns-beacon.maxdns": 255, "server.publickey_md5": "5f2e36666dc6d4a8d4a898fa56c1c8cf", "http-get.verb": "GET", "http-get.client": ["Cookie"]}, "x64": {"beacon_type": "HTTP", "useragent_header": "Mozilla/5.0 (compatible; MSIE 9.0; Windows NT 6.0; Trident/5.0)", "http-post.client": ["Content-Type: application/octet-stream", "id"], "maxgetsize": 1048576, "post-ex.spawnto_x86": "%windir%\\syswow64\\rundll32.exe", "port": 80, "sleeptime": 60000, "uses_cookies": 1, "proxy.behavior": "2 (Use IE settings)", "process-inject.execute": ["CreateThread", "SetThreadContext", "CreateRemoteThread", "RtlCreateUserThread"], "process-inject.startrwx": 64, "post-ex.spawnto_x64": "%windir%\\sysnative\\rundll32.exe", "process-inject.stub": "a56c813864af878a4c10083ca1578e0a", "http-get.uri": "119.45.183.207,/fwlink", "watermark": 305419896, "process-inject.userwx": 64, "http-post.verb": "POST", "http-post.uri": "/submit.php", "dns-beacon.maxdns": 255, "server.publickey_md5": "5f2e36666dc6d4a8d4a898fa56c1c8cf", "http-get.verb": "GET", "http-get.client": ["Cookie"]}}, "product": "Cobalt Strike Beacon", "http": {"status": 404, "robots_hash": null, "redirects": [], "securitytxt": null, "title": null, "sitemap_hash": null, "robots": null, "server": null, "headers_hash": 2129120964, "host": "119.45.183.207", "html": "", "location": "/", "html_hash": 0, "sitemap": null, "securitytxt_hash": null}, "os": null, "timestamp": "2023-09-02T01:14:53.712348", "isp": "Shenzhen Tencent Computer Systems Company Limited", "transport": "tcp", "cpe": ["cpe:/a:helpsystems:cobalt_strike"], "_shodan": {"region": "na", "ptr": true, "module": "http", "id": "83673df8-60f9-49a9-9026-537862d8533b", "options": {}, "crawler": "21255b11b05f5ce2a4cf82d3f9ebb017a5a1fdd1"}, "asn": "AS45090", "hostnames": [], "location": {"city": "Shanghai", "region_code": "SH", "area_code": null, "longitude": 121.45806, "latitude": 31.22222, "country_code": "CN", "country_name": "China"}, "cpe23": ["cpe:2.3:a:helpsystems:cobalt_strike"], "ip": 1999484879, "domains": [], "org": "Tencent cloud computing (Beijing) Co., Ltd.", "data": "HTTP/1.1 404 Not Found\r\nDate: Sat, 2 Sep 2023 01:14:53 GMT\r\nContent-Type: text/plain\r\nContent-Length: 0\r\n\r\n\nCobalt Strike Beacon:\n  x86:\n    beacon_type: HTTP\n    dns-beacon.maxdns: 255\n    http-get.client:\n      Cookie\n    http-get.uri: 119.45.183.207,/dpixel\n    http-get.verb: GET\n    http-post.client:\n      Content-Type: application/octet-stream\n      id\n    http-post.uri: /submit.php\n    http-post.verb: POST\n    maxgetsize: 1048576\n    port: 80\n    post-ex.spawnto_x64: %windir%\\sysnative\\rundll32.exe\n    post-ex.spawnto_x86: %windir%\\syswow64\\rundll32.exe\n    process-inject.execute:\n      CreateThread\n      SetThreadContext\n      CreateRemoteThread\n      RtlCreateUserThread\n    process-inject.startrwx: 64\n    process-inject.stub: a56c813864af878a4c10083ca1578e0a\n    process-inject.userwx: 64\n    proxy.behavior: 2 (Use IE settings)\n    server.publickey_md5: 5f2e36666dc6d4a8d4a898fa56c1c8cf\n    sleeptime: 60000\n    useragent_header: Mozilla/5.0 (Windows NT 6.1; Trident/7.0; rv:11.0) like Gecko\n    uses_cookies: 1\n    watermark: 305419896\n  x64:\n    beacon_type: HTTP\n    dns-beacon.maxdns: 255\n    http-get.client:\n      Cookie\n    http-get.uri: 119.45.183.207,/fwlink\n    http-get.verb: GET\n    http-post.client:\n      Content-Type: application/octet-stream\n      id\n    http-post.uri: /submit.php\n    http-post.verb: POST\n    maxgetsize: 1048576\n    port: 80\n    post-ex.spawnto_x64: %windir%\\sysnative\\rundll32.exe\n    post-ex.spawnto_x86: %windir%\\syswow64\\rundll32.exe\n    process-inject.execute:\n      CreateThread\n      SetThreadContext\n      CreateRemoteThread\n      RtlCreateUserThread\n    process-inject.startrwx: 64\n    process-inject.stub: a56c813864af878a4c10083ca1578e0a\n    process-inject.userwx: 64\n    proxy.behavior: 2 (Use IE settings)\n    server.publickey_md5: 5f2e36666dc6d4a8d4a898fa56c1c8cf\n    sleeptime: 60000\n    useragent_header: Mozilla/5.0 (compatible; MSIE 9.0; Windows NT 6.0; Trident/5.0)\n    uses_cookies: 1\n    watermark: 305419896\n", "port": 80, "opts": {}, "ip_str": "119.45.183.207"}
{"hash": 183558618, "cobalt_strike_beacon": {"x86": {"beacon_type": "HTTP", "dns-beacon.strategy_rotate_seconds": -1, "useragent_header": "Mozilla/5.0 (compatible; MSIE 10.0; Windows NT 6.1; WOW64; Trident/6.0; MASP)", "http-post.client": ["Content-Type: application/octet-stream", "id"], "maxgetsize": 1048576, "post-ex.spawnto_x86": "%windir%\\syswow64\\rundll32.exe", "port": 8080, "sleeptime": 60000, "uses_cookies": 1, "proxy.behavior": "2 (Use IE settings)", "process-inject.execute": ["CreateThread", "SetThreadContext", "CreateRemoteThread", "RtlCreateUserThread"], "process-inject.startrwx": 64, "post-ex.spawnto_x64": "%windir%\\sysnative\\rundll32.exe", "process-inject.stub": "e43a1b63f09794f74d90a9889f7acb77", "http-get.uri": "23.94.239.95,/visit.js", "watermark": 987654321, "dns-beacon.strategy_fail_seconds": -1, "process-inject.userwx": 64, "dns-beacon.strategy_fail_x": -1, "http-post.verb": "POST", "http-post.uri": "/submit.php", "server.publickey_md5": "edbfd6b80dcd213bb833dc3efaf3633d", "http-get.verb": "GET", "http-get.client": ["Cookie"]}, "x64": {"beacon_type": "HTTP", "dns-beacon.strategy_rotate_seconds": -1, "useragent_header": "Mozilla/5.0 (compatible; MSIE 9.0; Windows NT 6.1; WOW64; Trident/5.0; MALC)", "http-post.client": ["Content-Type: application/octet-stream", "id"], "maxgetsize": 1048576, "post-ex.spawnto_x86": "%windir%\\syswow64\\rundll32.exe", "port": 8080, "sleeptime": 60000, "uses_cookies": 1, "proxy.behavior": "2 (Use IE settings)", "process-inject.execute": ["CreateThread", "SetThreadContext", "CreateRemoteThread", "RtlCreateUserThread"], "process-inject.startrwx": 64, "post-ex.spawnto_x64": "%windir%\\sysnative\\rundll32.exe", "process-inject.stub": "e43a1b63f09794f74d90a9889f7acb77", "http-get.uri": "23.94.239.95,/push", "watermark": 987654321, "dns-beacon.strategy_fail_seconds": -1, "process-inject.userwx": 64, "dns-beacon.strategy_fail_x": -1, "http-post.verb": "POST", "http-post.uri": "/submit.php", "server.publickey_md5": "edbfd6b80dcd213bb833dc3efaf3633d", "http-get.verb": "GET", "http-get.client": ["Cookie"]}}, "product": "Cobalt Strike Beacon", "http": {"status": 404, "robots_hash": null, "redirects": [], "securitytxt": null, "title": null, "sitemap_hash": null, "robots": null, "server": null, "headers_hash": 2129120964, "host": "23.94.239.95", "html": "", "location": "/", "html_hash": 0, "sitemap": null, "securitytxt_hash": null}, "os": null, "timestamp": "2023-09-01T23:42:47.885155", "isp": "ColoCrossing", "transport": "tcp", "_shodan": {"region": "eu", "ptr": true, "module": "http-simple-new", "id": "375456f8-92df-432e-b536-6026286ab5e3", "options": {}, "crawler": "487814a778c983e2dcef234806292d88c5cbf3ec"}, "asn": "AS36352", "hostnames": ["23-94-239-95-host.colocrossing.com"], "location": {"city": "Los Angeles", "region_code": "CA", "area_code": null, "longitude": -118.24368, "latitude": 34.05223, "country_code": "US", "country_name": "United States"}, "ip": 392097631, "domains": ["colocrossing.com"], "org": "ColoCrossing", "data": "HTTP/1.1 404 Not Found\r\nDate: Fri, 1 Sep 2023 23:42:47 GMT\r\nContent-Type: text/plain\r\nContent-Length: 0\r\n\r\n\nCobalt Strike Beacon:\n  x86:\n    beacon_type: HTTP\n    dns-beacon.strategy_fail_seconds: -1\n    dns-beacon.strategy_fail_x: -1\n    dns-beacon.strategy_rotate_seconds: -1\n    http-get.client:\n      Cookie\n    http-get.uri: 23.94.239.95,/visit.js\n    http-get.verb: GET\n    http-post.client:\n      Content-Type: application/octet-stream\n      id\n    http-post.uri: /submit.php\n    http-post.verb: POST\n    maxgetsize: 1048576\n    port: 8080\n    post-ex.spawnto_x64: %windir%\\sysnative\\rundll32.exe\n    post-ex.spawnto_x86: %windir%\\syswow64\\rundll32.exe\n    process-inject.execute:\n      CreateThread\n      SetThreadContext\n      CreateRemoteThread\n      RtlCreateUserThread\n    process-inject.startrwx: 64\n    process-inject.stub: e43a1b63f09794f74d90a9889f7acb77\n    process-inject.userwx: 64\n    proxy.behavior: 2 (Use IE settings)\n    server.publickey_md5: edbfd6b80dcd213bb833dc3efaf3633d\n    sleeptime: 60000\n    useragent_header: Mozilla/5.0 (compatible; MSIE 10.0; Windows NT 6.1; WOW64; Trident/6.0; MASP)\n    uses_cookies: 1\n    watermark: 987654321\n  x64:\n    beacon_type: HTTP\n    dns-beacon.strategy_fail_seconds: -1\n    dns-beacon.strategy_fail_x: -1\n    dns-beacon.strategy_rotate_seconds: -1\n    http-get.client:\n      Cookie\n    http-get.uri: 23.94.239.95,/push\n    http-get.verb: GET\n    http-post.client:\n      Content-Type: application/octet-stream\n      id\n    http-post.uri: /submit.php\n    http-post.verb: POST\n    maxgetsize: 1048576\n    port: 8080\n    post-ex.spawnto_x64: %windir%\\sysnative\\rundll32.exe\n    post-ex.spawnto_x86: %windir%\\syswow64\\rundll32.exe\n    process-inject.execute:\n      CreateThread\n      SetThreadContext\n      CreateRemoteThread\n      RtlCreateUserThread\n    process-inject.startrwx: 64\n    process-inject.stub: e43a1b63f09794f74d90a9889f7acb77\n    process-inject.userwx: 64\n    proxy.behavior: 2 (Use IE settings)\n    server.publickey_md5: edbfd6b80dcd213bb833dc3efaf3633d\n    sleeptime: 60000\n    useragent_header: Mozilla/5.0 (compatible; MSIE 9.0; Windows NT 6.1; WOW64; Trident/5.0; MALC)\n    uses_cookies: 1\n    watermark: 987654321\n", "port": 8080, "opts": {}, "ip_str": "23.94.239.95"}
{"hash": -1291250533, "cobalt_strike_beacon": {"x86": {"beacon_type": "HTTP", "dns-beacon.strategy_rotate_seconds": -1, "useragent_header": "Mozilla/5.0 (compatible; MSIE 9.0; Windows NT 6.1; Win64; x64; Trident/5.0)", "http-post.client": ["Content-Type: application/octet-stream", "id"], "maxgetsize": 1048576, "post-ex.spawnto_x86": "%windir%\\syswow64\\rundll32.exe", "port": 80, "sleeptime": 60000, "uses_cookies": 1, "proxy.behavior": "2 (Use IE settings)", "process-inject.execute": ["CreateThread", "SetThreadContext", "CreateRemoteThread", "RtlCreateUserThread"], "process-inject.startrwx": 64, "post-ex.spawnto_x64": "%windir%\\sysnative\\rundll32.exe", "process-inject.stub": "30c0eee4f63e95d41b02a2c1da5d509c", "http-get.uri": "82.157.138.249,/cx", "watermark": 1234567890, "dns-beacon.strategy_fail_seconds": -1, "process-inject.userwx": 64, "dns-beacon.strategy_fail_x": -1, "http-post.verb": "POST", "http-post.uri": "/submit.php", "server.publickey_md5": "42c7d5134cff0fbbb292130c05aa74ad", "http-get.verb": "GET", "http-get.client": ["Cookie"]}, "x64": {"beacon_type": "HTTP", "dns-beacon.strategy_rotate_seconds": -1, "useragent_header": "Mozilla/4.0 (compatible; MSIE 7.0b; Windows NT 6.0)", "http-post.client": ["Content-Type: application/octet-stream", "id"], "maxgetsize": 1048576, "post-ex.spawnto_x86": "%windir%\\syswow64\\rundll32.exe", "port": 80, "sleeptime": 60000, "uses_cookies": 1, "proxy.behavior": "2 (Use IE settings)", "process-inject.execute": ["CreateThread", "SetThreadContext", "CreateRemoteThread", "RtlCreateUserThread"], "process-inject.startrwx": 64, "post-ex.spawnto_x64": "%windir%\\sysnative\\rundll32.exe", "process-inject.stub": "30c0eee4f63e95d41b02a2c1da5d509c", "http-get.uri": "82.157.138.249,/load", "watermark": 1234567890, "dns-beacon.strategy_fail_seconds": -1, "process-inject.userwx": 64, "dns-beacon.strategy_fail_x": -1, "http-post.verb": "POST", "http-post.uri": "/submit.php", "server.publickey_md5": "42c7d5134cff0fbbb292130c05aa74ad", "http-get.verb": "GET", "http-get.client": ["Cookie"]}}, "product": "Cobalt Strike Beacon", "http": {"status": 404, "robots_hash": null, "redirects": [], "securitytxt": null, "title": null, "sitemap_hash": null, "robots": null, "server": null, "headers_hash": 2129120964, "host": "82.157.138.249", "html": "", "location": "/", "html_hash": 0, "sitemap": null, "securitytxt_hash": null}, "os": null, "tags": ["cloud"], "timestamp": "2023-09-01T23:32:29.873182", "isp": "Shenzhen Tencent Computer Systems Company Limited", "transport": "tcp", "_shodan": {"region": "eu", "ptr": true, "module": "http", "id": "1446f2bc-3f61-4704-a905-d8ccda95f992", "options": {}, "crawler": "487814a778c983e2dcef234806292d88c5cbf3ec"}, "asn": "AS45090", "cloud": {"region": null, "service": null, "provider": "Tencent Cloud"}, "hostnames": [], "location": {"city": "Beijing", "region_code": "BJ", "area_code": null, "longitude": 116.39723, "latitude": 39.9075, "country_code": "CN", "country_name": "China"}, "ip": 1386056441, "domains": [], "org": "Tencent Cloud Computing (Beijing) Co., Ltd", "data": "HTTP/1.1 404 Not Found\r\nDate: Fri, 1 Sep 2023 23:32:29 GMT\r\nContent-Type: text/plain\r\nContent-Length: 0\r\n\r\n\nCobalt Strike Beacon:\n  x86:\n    beacon_type: HTTP\n    dns-beacon.strategy_fail_seconds: -1\n    dns-beacon.strategy_fail_x: -1\n    dns-beacon.strategy_rotate_seconds: -1\n    http-get.client:\n      Cookie\n    http-get.uri: 82.157.138.249,/cx\n    http-get.verb: GET\n    http-post.client:\n      Content-Type: application/octet-stream\n      id\n    http-post.uri: /submit.php\n    http-post.verb: POST\n    maxgetsize: 1048576\n    port: 80\n    post-ex.spawnto_x64: %windir%\\sysnative\\rundll32.exe\n    post-ex.spawnto_x86: %windir%\\syswow64\\rundll32.exe\n    process-inject.execute:\n      CreateThread\n      SetThreadContext\n      CreateRemoteThread\n      RtlCreateUserThread\n    process-inject.startrwx: 64\n    process-inject.stub: 30c0eee4f63e95d41b02a2c1da5d509c\n    process-inject.userwx: 64\n    proxy.behavior: 2 (Use IE settings)\n    server.publickey_md5: 42c7d5134cff0fbbb292130c05aa74ad\n    sleeptime: 60000\n    useragent_header: Mozilla/5.0 (compatible; MSIE 9.0; Windows NT 6.1; Win64; x64; Trident/5.0)\n    uses_cookies: 1\n    watermark: 1234567890\n  x64:\n    beacon_type: HTTP\n    dns-beacon.strategy_fail_seconds: -1\n    dns-beacon.strategy_fail_x: -1\n    dns-beacon.strategy_rotate_seconds: -1\n    http-get.client:\n      Cookie\n    http-get.uri: 82.157.138.249,/load\n    http-get.verb: GET\n    http-post.client:\n      Content-Type: application/octet-stream\n      id\n    http-post.uri: /submit.php\n    http-post.verb: POST\n    maxgetsize: 1048576\n    port: 80\n    post-ex.spawnto_x64: %windir%\\sysnative\\rundll32.exe\n    post-ex.spawnto_x86: %windir%\\syswow64\\rundll32.exe\n    process-inject.execute:\n      CreateThread\n      SetThreadContext\n      CreateRemoteThread\n      RtlCreateUserThread\n    process-inject.startrwx: 64\n    process-inject.stub: 30c0eee4f63e95d41b02a2c1da5d509c\n    process-inject.userwx: 64\n    proxy.behavior: 2 (Use IE settings)\n    server.publickey_md5: 42c7d5134cff0fbbb292130c05aa74ad\n    sleeptime: 60000\n    useragent_header: Mozilla/4.0 (compatible; MSIE 7.0b; Windows NT 6.0)\n    uses_cookies: 1\n    watermark: 1234567890\n", "port": 80, "opts": {}, "ip_str": "82.157.138.249"}
{"cobalt_strike_beacon": {"x86": {"beacon_type": "HTTP", "jitter": 37, "dns-beacon.strategy_rotate_seconds": -1, "useragent_header": "Mozilla/5.0 (Windows NT 6.3; Trident/7.0; rv:11.0) like Gecko", "http-post.client": ["Accept: text/html,application/xhtml+xml,application/xml;q=0.9,*/*;q=0.8", "Referer: http://code.jquery.com/", "Accept-Encoding: gzip, deflate", "__cfduid"], "maxgetsize": 1403644, "process-inject.min_alloc": 17500, "post-ex.spawnto_x86": "%windir%\\syswow64\\dllhost.exe", "port": 80, "sleeptime": 1000, "uses_cookies": 1, "proxy.behavior": "2 (Use IE settings)", "process-inject.execute": ["ntdll:RtlUserThreadStart", "CreateThread", "NtQueueApcThread-s", "CreateRemoteThread", "RtlCreateUserThread"], "process-inject.startrwx": 4, "post-ex.spawnto_x64": "%windir%\\sysnative\\dllhost.exe", "process-inject.stub": "32cd41edf0810c5b5f498edf4731cc6d", "http-get.uri": "43.142.12.13,/jquery-3.3.1.min.js", "dns-beacon.strategy_fail_seconds": -1, "process-inject.userwx": 32, "dns-beacon.strategy_fail_x": -1, "stage.cleanup": 1, "http-post.verb": "POST", "http-post.uri": "/jquery-3.3.2.min.js", "server.publickey_md5": "e9ae865f5ce035176457188409f6020a", "process-inject.allocator": 1, "http-get.verb": "GET", "http-get.client": ["Accept: text/html,application/xhtml+xml,application/xml;q=0.9,*/*;q=0.8", "Referer: http://code.jquery.com/", "Accept-Encoding: gzip, deflate", "__cfduid=", "Cookie"]}, "x64": {"beacon_type": "HTTP", "jitter": 37, "dns-beacon.strategy_rotate_seconds": -1, "useragent_header": "Mozilla/5.0 (Windows NT 6.3; Trident/7.0; rv:11.0) like Gecko", "http-post.client": ["Accept: text/html,application/xhtml+xml,application/xml;q=0.9,*/*;q=0.8", "Referer: http://code.jquery.com/", "Accept-Encoding: gzip, deflate", "__cfduid"], "maxgetsize": 1403644, "process-inject.min_alloc": 17500, "post-ex.spawnto_x86": "%windir%\\syswow64\\dllhost.exe", "port": 80, "sleeptime": 1000, "uses_cookies": 1, "proxy.behavior": "2 (Use IE settings)", "process-inject.execute": ["ntdll:RtlUserThreadStart", "CreateThread", "NtQueueApcThread-s", "CreateRemoteThread", "RtlCreateUserThread"], "process-inject.startrwx": 4, "post-ex.spawnto_x64": "%windir%\\sysnative\\dllhost.exe", "process-inject.stub": "32cd41edf0810c5b5f498edf4731cc6d", "http-get.uri": "43.142.12.13,/jquery-3.3.1.min.js", "dns-beacon.strategy_fail_seconds": -1, "process-inject.userwx": 32, "dns-beacon.strategy_fail_x": -1, "stage.cleanup": 1, "http-post.verb": "POST", "http-post.uri": "/jquery-3.3.2.min.js", "server.publickey_md5": "e9ae865f5ce035176457188409f6020a", "process-inject.allocator": 1, "http-get.verb": "GET", "http-get.client": ["Accept: text/html,application/xhtml+xml,application/xml;q=0.9,*/*;q=0.8", "Referer: http://code.jquery.com/", "Accept-Encoding: gzip, deflate", "__cfduid=", "Cookie"]}}, "ip": 730729485, "http": {"status": 404, "robots_hash": null, "redirects": [], "securitytxt": null, "title": null, "sitemap_hash": null, "robots": null, "server": "Apache", "headers_hash": -1392026739, "host": "43.142.12.13", "html": "", "location": "/", "html_hash": 0, "sitemap": null, "securitytxt_hash": null}, "port": 80, "transport": "tcp", "cloud": {"region": null, "service": null, "provider": "Tencent Cloud"}, "location": {"city": "Beijing", "region_code": "BJ", "area_code": null, "longitude": 116.39723, "latitude": 39.9075, "country_code": "CN", "country_name": "China"}, "product": "Cobalt Strike Beacon", "hash": 552298226, "tags": ["cloud"], "timestamp": "2023-09-01T21:07:36.607158", "hostnames": [], "org": "Tencent Cloud Computing (Beijing) Co., Ltd", "data": "HTTP/1.1 404 Not Found\r\nDate: Fri, 1 Sep 2023 21:07:36 GMT\r\nServer: Apache\r\nContent-Length: 0\r\nKeep-Alive: timeout=10, max=100\r\nConnection: Keep-Alive\r\nContent-Type: text/plain\r\n\r\n\nCobalt Strike Beacon:\n  x86:\n    beacon_type: HTTP\n    dns-beacon.strategy_fail_seconds: -1\n    dns-beacon.strategy_fail_x: -1\n    dns-beacon.strategy_rotate_seconds: -1\n    http-get.client:\n      Accept: text/html,application/xhtml+xml,application/xml;q=0.9,*/*;q=0.8\n      Referer: http://code.jquery.com/\n      Accept-Encoding: gzip, deflate\n      __cfduid=\n      Cookie\n    http-get.uri: 43.142.12.13,/jquery-3.3.1.min.js\n    http-get.verb: GET\n    http-post.client:\n      Accept: text/html,application/xhtml+xml,application/xml;q=0.9,*/*;q=0.8\n      Referer: http://code.jquery.com/\n      Accept-Encoding: gzip, deflate\n      __cfduid\n    http-post.uri: /jquery-3.3.2.min.js\n    http-post.verb: POST\n    jitter: 37\n    maxgetsize: 1403644\n    port: 80\n    post-ex.spawnto_x64: %windir%\\sysnative\\dllhost.exe\n    post-ex.spawnto_x86: %windir%\\syswow64\\dllhost.exe\n    process-inject.allocator: 1\n    process-inject.execute:\n      ntdll:RtlUserThreadStart\n      CreateThread\n      NtQueueApcThread-s\n      CreateRemoteThread\n      RtlCreateUserThread\n    process-inject.min_alloc: 17500\n    process-inject.startrwx: 4\n    process-inject.stub: 32cd41edf0810c5b5f498edf4731cc6d\n    process-inject.userwx: 32\n    proxy.behavior: 2 (Use IE settings)\n    server.publickey_md5: e9ae865f5ce035176457188409f6020a\n    sleeptime: 1000\n    stage.cleanup: 1\n    useragent_header: Mozilla/5.0 (Windows NT 6.3; Trident/7.0; rv:11.0) like Gecko\n    uses_cookies: 1\n  x64:\n    beacon_type: HTTP\n    dns-beacon.strategy_fail_seconds: -1\n    dns-beacon.strategy_fail_x: -1\n    dns-beacon.strategy_rotate_seconds: -1\n    http-get.client:\n      Accept: text/html,application/xhtml+xml,application/xml;q=0.9,*/*;q=0.8\n      Referer: http://code.jquery.com/\n      Accept-Encoding: gzip, deflate\n      __cfduid=\n      Cookie\n    http-get.uri: 43.142.12.13,/jquery-3.3.1.min.js\n    http-get.verb: GET\n    http-post.client:\n      Accept: text/html,application/xhtml+xml,application/xml;q=0.9,*/*;q=0.8\n      Referer: http://code.jquery.com/\n      Accept-Encoding: gzip, deflate\n      __cfduid\n    http-post.uri: /jquery-3.3.2.min.js\n    http-post.verb: POST\n    jitter: 37\n    maxgetsize: 1403644\n    port: 80\n    post-ex.spawnto_x64: %windir%\\sysnative\\dllhost.exe\n    post-ex.spawnto_x86: %windir%\\syswow64\\dllhost.exe\n    process-inject.allocator: 1\n    process-inject.execute:\n      ntdll:RtlUserThreadStart\n      CreateThread\n      NtQueueApcThread-s\n      CreateRemoteThread\n      RtlCreateUserThread\n    process-inject.min_alloc: 17500\n    process-inject.startrwx: 4\n    process-inject.stub: 32cd41edf0810c5b5f498edf4731cc6d\n    process-inject.userwx: 32\n    proxy.behavior: 2 (Use IE settings)\n    server.publickey_md5: e9ae865f5ce035176457188409f6020a\n    sleeptime: 1000\n    stage.cleanup: 1\n    useragent_header: Mozilla/5.0 (Windows NT 6.3; Trident/7.0; rv:11.0) like Gecko\n    uses_cookies: 1\n", "asn": "AS45090", "cpe23": ["cpe:2.3:a:helpsystems:cobalt_strike"], "isp": "Shenzhen Tencent Computer Systems Company Limited", "cpe": ["cpe:/a:helpsystems:cobalt_strike"], "domains": [], "ip_str": "43.142.12.13", "os": null, "_shodan": {"region": "na", "ptr": true, "module": "http", "id": "19529281-36f3-43a2-85df-4029f75efe53", "options": {}, "crawler": "21255b11b05f5ce2a4cf82d3f9ebb017a5a1fdd1"}, "opts": {}}
{"hash": -1641630623, "cobalt_strike_beacon": {"x86": {"beacon_type": "HTTPS", "dns-beacon.strategy_rotate_seconds": -1, "useragent_header": "Mozilla/4.0 (compatible; MSIE 8.0; Windows NT 6.1)", "http-post.client": ["Content-Type: application/octet-stream", "id"], "maxgetsize": 1048576, "post-ex.spawnto_x86": "%windir%\\syswow64\\rundll32.exe", "port": 2083, "sleeptime": 60000, "uses_cookies": 1, "proxy.behavior": "2 (Use IE settings)", "process-inject.execute": ["CreateThread", "SetThreadContext", "CreateRemoteThread", "RtlCreateUserThread"], "process-inject.startrwx": 64, "post-ex.spawnto_x64": "%windir%\\sysnative\\rundll32.exe", "process-inject.stub": "6b759d51108550819660f6d4231430f0", "http-get.uri": "cs45up230823s.iqiyia.com,/pixel.gif", "watermark": 100000, "dns-beacon.strategy_fail_seconds": -1, "process-inject.userwx": 64, "dns-beacon.strategy_fail_x": -1, "http-post.verb": "POST", "http-post.uri": "/submit.php", "server.publickey_md5": "b50c26d704d02da8030fc789e142fe74", "http-get.verb": "GET", "http-get.client": ["Cookie"]}, "x64": {"beacon_type": "HTTPS", "dns-beacon.strategy_rotate_seconds": -1, "useragent_header": "Mozilla/4.0 (compatible; MSIE 8.0; Windows NT 5.1; Trident/4.0)", "http-post.client": ["Content-Type: application/octet-stream", "id"], "maxgetsize": 1048576, "post-ex.spawnto_x86": "%windir%\\syswow64\\rundll32.exe", "port": 2083, "sleeptime": 60000, "uses_cookies": 1, "proxy.behavior": "2 (Use IE settings)", "process-inject.execute": ["CreateThread", "SetThreadContext", "CreateRemoteThread", "RtlCreateUserThread"], "process-inject.startrwx": 64, "post-ex.spawnto_x64": "%windir%\\sysnative\\rundll32.exe", "process-inject.stub": "6b759d51108550819660f6d4231430f0", "http-get.uri": "cs45up230823s.iqiyia.com,/dot.gif", "watermark": 100000, "dns-beacon.strategy_fail_seconds": -1, "process-inject.userwx": 64, "dns-beacon.strategy_fail_x": -1, "http-post.verb": "POST", "http-post.uri": "/submit.php", "server.publickey_md5": "b50c26d704d02da8030fc789e142fe74", "http-get.verb": "GET", "http-get.client": ["Cookie"]}}, "product": "Cobalt Strike Beacon", "http": {"status": 404, "robots_hash": null, "redirects": [], "securitytxt": null, "title": null, "sitemap_hash": null, "robots": null, "server": null, "headers_hash": 2129120964, "host": "208.70.74.144", "html": "", "location": "/", "html_hash": 0, "sitemap": null, "securitytxt_hash": null}, "os": null, "asn": "AS35916", "tags": ["self-signed"], "timestamp": "2023-09-01T16:19:55.505745", "isp": "MULTACOM CORPORATION", "transport": "tcp", "_shodan": {"region": "eu", "ptr": true, "module": "https-simple-new", "id": "35c3d7b5-4738-4935-9298-b94e945b402b", "options": {}, "crawler": "487814a778c983e2dcef234806292d88c5cbf3ec"}, "ssl": {"chain_sha256": ["87f2085c32b6a2cc709b365f55873e207a9caa10bffecf2fd16d3cf9d94d390c"], "jarm": "07d14d16d21d21d00042d41d00041d47e4e0ae17960b2a5b4fd6107fbb0926", "chain": ["-----BEGIN CERTIFICATE-----\nMIIDIzCCAgugAwIBAgIECLsA7jANBgkqhkiG9w0BAQsFADBCMQkwBwYDVQQGEwAx\nCTAHBgNVBAgTADEJMAcGA1UEBxMAMQkwBwYDVQQKEwAxCTAHBgNVBAsTADEJMAcG\nA1UEAxMAMB4XDTE1MDUyMDE4MjYyNFoXDTI1MDUxNzE4MjYyNFowQjEJMAcGA1UE\nBhMAMQkwBwYDVQQIEwAxCTAHBgNVBAcTADEJMAcGA1UEChMAMQkwBwYDVQQLEwAx\nCTAHBgNVBAMTADCCASIwDQYJKoZIhvcNAQEBBQADggEPADCCAQoCggEBAJjXGpNx\njm97YowJUxMyM/QBjGTnyUqMXt1IsXArVdop3F/fGdhsmWkExTt8AfjWm9TL2I3K\nCVKqBhQ9U8+W+l3JAPNaqLnOqRSfeQ+SQ0tmLuVn1AVQt1RKYZGo+o70G/yAXBNw\nCQ3mUisLe6Ln926E3seZM6gb8HesF/w+2sCcQ2UaqLY3hKVIDYvlenNaNMxtaw+8\nA/3udT+pIX1JyrlIlt0SDg5Ya2opwYTFJM64KbuyDKkK213A5Sz00Rh13PVRKWlp\nfVtgoh9BNupzJOG/GE/x0XmXCYAOIGrm8uujAtUWJ5nkbaczf2ldnITJBw+3iQrt\nE1LEM8aUJeKRCVkCAwEAAaMhMB8wHQYDVR0OBBYEFHNrXtvPyRkdW9AfjOOrVjgY\nnwJPMA0GCSqGSIb3DQEBCwUAA4IBAQBU9S+o9YRFBTzcCeZ4phipmwJ9PsIFKoid\ngkTekbt3EzyL+Q+nySQ/Gn4ZXdliFYxKNcRmxbSWCa9jX6qJb6t7gcLBP8Hp7kWL\nsNdbk19+iSDphVfO6UdL6ZVIbIy0vNO0/LgEKVi7tzE84elcaS45ZSPY+HnySF2s\nP3SF0n9iF/bWdzYOjLcPpgavsT66KLrileXkYjCWFOXufnZgpf11pGd3wTJEIenS\nabc90LQ4rAvBJPicY/AfhIth/g4GiDG+M1DmzlV+1F0nNr3KuNGjeghLVegKoRq/\nb5PF+0kpSK7HUwIdrgZsqz1ORsMToEyv8LvxIyL0DTCLBJSHmgJy\n-----END CERTIFICATE-----\n"], "dhparams": {"prime": "ffffffffffffffffc90fdaa22168c234c4c6628b80dc1cd129024e088a67cc74020bbea63b139b22514a08798e3404ddef9519b3cd3a431b302b0a6df25f14374fe1356d6d51c245e485b576625e7ec6f44c42e9a637ed6b0bff5cb6f406b7edee386bfb5a899fa5ae9f24117c4b1fe649286651ece65381ffffffffffffffff", "public_key": "1e4d2cfcb2c62704bb6d6ebd092b6ce434480aa73c025f21c9488eb8dc99a5f814f291c3b772997d72810d32cae426d901e3daebd6243bce74cc985fc1a934561a1fb22a0659e9541c0564c1b9dd5dea7bfaef894ac5544ae31d0b09bfd547139140998cb0a4acda3dda7cda17398728e27a2e5532f7f50eab40b46b3377fa75", "bits": 1024, "generator": 2, "fingerprint": "RFC2409/Oakley Group 2"}, "versions": ["-TLSv1", "-SSLv2", "-SSLv3", "-TLSv1.1", "TLSv1.2"], "acceptable_cas": [], "tlsext": [{"id": 43, "name": "supported_versions"}, {"id": 44, "name": "unknown"}, {"id": 51, "name": "key_share"}, {"id": 43, "name": "supported_versions"}, {"id": 51, "name": "key_share"}, {"id": 10, "name": "supported_groups"}], "ja3s": "fef5599f0a3662839aeb1f3c854eba06", "cert": {"sig_alg": "sha256WithRSAEncryption", "issued": "20150520182624Z", "expires": "20250517182624Z", "expired": false, "version": 2, "extensions": [{"data": "\\x04\\x14sk^\\xdb\\xcf\\xc9\\x19\\x1d[\\xd0\\x1f\\x8c\\xe3\\xabV8\\x18\\x9f\\x02O", "name": "subjectKeyIdentifier"}], "fingerprint": {"sha256": "87f2085c32b6a2cc709b365f55873e207a9caa10bffecf2fd16d3cf9d94d390c", "sha1": "6ece5ece4192683d2d84e25b0ba7e04f9cb7eb7c"}, "serial": 146473198, "subject": {"C": "", "CN": "", "L": "", "O": "", "ST": "", "OU": ""}, "pubkey": {"type": "rsa", "bits": 2048}, "issuer": {"C": "", "CN": "", "L": "", "O": "", "ST": "", "OU": ""}}, "cipher": {"version": "TLSv1.3", "bits": 256, "name": "TLS_AES_256_GCM_SHA384"}, "trust": {"revoked": false, "browser": null}, "handshake_states": ["before SSL initialization", "SSLv3/TLS write client hello", "SSLv3/TLS read server hello", "SSLv3/TLS write change cipher spec", "SSLv3/TLS write client hello", "SSLv3/TLS read server hello", "TLSv1.3 read encrypted extensions", "SSLv3/TLS read server certificate", "TLSv1.3 read server certificate verify", "SSLv3/TLS read finished", "SSLv3/TLS write finished", "SSL negotiation finished successfully"], "alpn": [], "ocsp": {}}, "hostnames": ["unassigned.calpop.com"], "location": {"city": "Los Angeles", "region_code": "CA", "area_code": null, "longitude": -118.24368, "latitude": 34.05223, "country_code": "US", "country_name": "United States"}, "ip": 3494267536, "domains": ["calpop.com"], "org": "MULTACOM CORPORATION", "data": "HTTP/1.1 404 Not Found\r\nDate: Fri, 1 Sep 2023 16:19:55 GMT\r\nContent-Type: text/plain\r\nContent-Length: 0\r\n\r\n\nCobalt Strike Beacon:\n  x86:\n    beacon_type: HTTPS\n    dns-beacon.strategy_fail_seconds: -1\n    dns-beacon.strategy_fail_x: -1\n    dns-beacon.strategy_rotate_seconds: -1\n    http-get.client:\n      Cookie\n    http-get.uri: cs45up230823s.iqiyia.com,/pixel.gif\n    http-get.verb: GET\n    http-post.client:\n      Content-Type: application/octet-stream\n      id\n    http-post.uri: /submit.php\n    http-post.verb: POST\n    maxgetsize: 1048576\n    port: 2083\n    post-ex.spawnto_x64: %windir%\\sysnative\\rundll32.exe\n    post-ex.spawnto_x86: %windir%\\syswow64\\rundll32.exe\n    process-inject.execute:\n      CreateThread\n      SetThreadContext\n      CreateRemoteThread\n      RtlCreateUserThread\n    process-inject.startrwx: 64\n    process-inject.stub: 6b759d51108550819660f6d4231430f0\n    process-inject.userwx: 64\n    proxy.behavior: 2 (Use IE settings)\n    server.publickey_md5: b50c26d704d02da8030fc789e142fe74\n    sleeptime: 60000\n    useragent_header: Mozilla/4.0 (compatible; MSIE 8.0; Windows NT 6.1)\n    uses_cookies: 1\n    watermark: 100000\n  x64:\n    beacon_type: HTTPS\n    dns-beacon.strategy_fail_seconds: -1\n    dns-beacon.strategy_fail_x: -1\n    dns-beacon.strategy_rotate_seconds: -1\n    http-get.client:\n      Cookie\n    http-get.uri: cs45up230823s.iqiyia.com,/dot.gif\n    http-get.verb: GET\n    http-post.client:\n      Content-Type: application/octet-stream\n      id\n    http-post.uri: /submit.php\n    http-post.verb: POST\n    maxgetsize: 1048576\n    port: 2083\n    post-ex.spawnto_x64: %windir%\\sysnative\\rundll32.exe\n    post-ex.spawnto_x86: %windir%\\syswow64\\rundll32.exe\n    process-inject.execute:\n      CreateThread\n      SetThreadContext\n      CreateRemoteThread\n      RtlCreateUserThread\n    process-inject.startrwx: 64\n    process-inject.stub: 6b759d51108550819660f6d4231430f0\n    process-inject.userwx: 64\n    proxy.behavior: 2 (Use IE settings)\n    server.publickey_md5: b50c26d704d02da8030fc789e142fe74\n    sleeptime: 60000\n    useragent_header: Mozilla/4.0 (compatible; MSIE 8.0; Windows NT 5.1; Trident/4.0)\n    uses_cookies: 1\n    watermark: 100000\n", "port": 2083, "opts": {"vulns": [], "heartbleed": "2023/09/01 16:20:13 208.70.74.144:2083 - SAFE\n"}, "ip_str": "208.70.74.144"}
{"hash": 1466004986, "cobalt_strike_beacon": {"x86": {"beacon_type": "HTTP", "jitter": 37, "dns-beacon.strategy_rotate_seconds": -1, "useragent_header": "Mozilla/5.0 (Windows NT 6.3; Trident/7.0; rv:11.0) like Gecko", "http-post.client": ["Accept: text/html,application/xhtml+xml,application/xml;q=0.9,*/*;q=0.8", "Referer: http://code.jquery.com/", "Accept-Encoding: gzip, deflate", "__cfduid"], "maxgetsize": 1403644, "process-inject.min_alloc": 17500, "post-ex.spawnto_x86": "%windir%\\syswow64\\dllhost.exe", "port": 8333, "sleeptime": 45000, "uses_cookies": 1, "proxy.behavior": "2 (Use IE settings)", "process-inject.execute": ["ntdll:RtlUserThreadStart", "CreateThread", "NtQueueApcThread-s", "CreateRemoteThread", "RtlCreateUserThread"], "process-inject.startrwx": 4, "post-ex.spawnto_x64": "%windir%\\sysnative\\dllhost.exe", "process-inject.stub": "222b8f27dbdfba8ddd559eeca27ea648", "http-get.uri": "202.95.15.23,/jquery-3.3.1.min.js", "watermark": 1234567890, "dns-beacon.strategy_fail_seconds": -1, "process-inject.userwx": 32, "dns-beacon.strategy_fail_x": -1, "stage.cleanup": 1, "http-post.verb": "POST", "http-post.uri": "/jquery-3.3.2.min.js", "server.publickey_md5": "11cdef5022ad6bdb515f89a4f437e740", "process-inject.allocator": 1, "http-get.verb": "GET", "http-get.client": ["Accept: text/html,application/xhtml+xml,application/xml;q=0.9,*/*;q=0.8", "Referer: http://code.jquery.com/", "Accept-Encoding: gzip, deflate", "__cfduid=", "Cookie"]}, "x64": {"beacon_type": "HTTP", "jitter": 37, "dns-beacon.strategy_rotate_seconds": -1, "useragent_header": "Mozilla/5.0 (Windows NT 6.3; Trident/7.0; rv:11.0) like Gecko", "http-post.client": ["Accept: text/html,application/xhtml+xml,application/xml;q=0.9,*/*;q=0.8", "Referer: http://code.jquery.com/", "Accept-Encoding: gzip, deflate", "__cfduid"], "maxgetsize": 1403644, "process-inject.min_alloc": 17500, "post-ex.spawnto_x86": "%windir%\\syswow64\\dllhost.exe", "port": 8333, "sleeptime": 45000, "uses_cookies": 1, "proxy.behavior": "2 (Use IE settings)", "process-inject.execute": ["ntdll:RtlUserThreadStart", "CreateThread", "NtQueueApcThread-s", "CreateRemoteThread", "RtlCreateUserThread"], "process-inject.startrwx": 4, "post-ex.spawnto_x64": "%windir%\\sysnative\\dllhost.exe", "process-inject.stub": "222b8f27dbdfba8ddd559eeca27ea648", "http-get.uri": "202.95.15.23,/jquery-3.3.1.min.js", "watermark": 1234567890, "dns-beacon.strategy_fail_seconds": -1, "process-inject.userwx": 32, "dns-beacon.strategy_fail_x": -1, "stage.cleanup": 1, "http-post.verb": "POST", "http-post.uri": "/jquery-3.3.2.min.js", "server.publickey_md5": "11cdef5022ad6bdb515f89a4f437e740", "process-inject.allocator": 1, "http-get.verb": "GET", "http-get.client": ["Accept: text/html,application/xhtml+xml,application/xml;q=0.9,*/*;q=0.8", "Referer: http://code.jquery.com/", "Accept-Encoding: gzip, deflate", "__cfduid=", "Cookie"]}}, "product": "Cobalt Strike Beacon", "http": {"status": 404, "robots_hash": null, "redirects": [], "securitytxt": null, "title": null, "sitemap_hash": null, "robots": null, "server": "Apache", "headers_hash": -1392026739, "host": "202.95.15.23", "html": "", "location": "/", "html_hash": 0, "sitemap": null, "securitytxt_hash": null}, "os": null, "timestamp": "2023-09-01T08:25:08.629085", "isp": "BGPNET Global ASN", "transport": "tcp", "_shodan": {"region": "eu", "ptr": true, "module": "auto", "id": "e8717b9b-1897-48ac-9f26-50c2a0888a5d", "options": {}, "crawler": "487814a778c983e2dcef234806292d88c5cbf3ec"}, "asn": "AS64050", "hostnames": [], "location": {"city": "Hong Kong", "region_code": "", "area_code": null, "longitude": 114.17469, "latitude": 22.27832, "country_code": "HK", "country_name": "Hong Kong"}, "ip": 3395227415, "domains": [], "org": "RACKIP CONSULTANCY PTE. LTD.", "data": "HTTP/1.1 404 Not Found\r\nDate: Fri, 1 Sep 2023 07:48:10 GMT\r\nServer: Apache\r\nContent-Length: 0\r\nKeep-Alive: timeout=10, max=100\r\nConnection: Keep-Alive\r\nContent-Type: text/plain\r\n\r\n\nCobalt Strike Beacon:\n  x86:\n    beacon_type: HTTP\n    dns-beacon.strategy_fail_seconds: -1\n    dns-beacon.strategy_fail_x: -1\n    dns-beacon.strategy_rotate_seconds: -1\n    http-get.client:\n      Accept: text/html,application/xhtml+xml,application/xml;q=0.9,*/*;q=0.8\n      Referer: http://code.jquery.com/\n      Accept-Encoding: gzip, deflate\n      __cfduid=\n      Cookie\n    http-get.uri: 202.95.15.23,/jquery-3.3.1.min.js\n    http-get.verb: GET\n    http-post.client:\n      Accept: text/html,application/xhtml+xml,application/xml;q=0.9,*/*;q=0.8\n      Referer: http://code.jquery.com/\n      Accept-Encoding: gzip, deflate\n      __cfduid\n    http-post.uri: /jquery-3.3.2.min.js\n    http-post.verb: POST\n    jitter: 37\n    maxgetsize: 1403644\n    port: 8333\n    post-ex.spawnto_x64: %windir%\\sysnative\\dllhost.exe\n    post-ex.spawnto_x86: %windir%\\syswow64\\dllhost.exe\n    process-inject.allocator: 1\n    process-inject.execute:\n      ntdll:RtlUserThreadStart\n      CreateThread\n      NtQueueApcThread-s\n      CreateRemoteThread\n      RtlCreateUserThread\n    process-inject.min_alloc: 17500\n    process-inject.startrwx: 4\n    process-inject.stub: 222b8f27dbdfba8ddd559eeca27ea648\n    process-inject.userwx: 32\n    proxy.behavior: 2 (Use IE settings)\n    server.publickey_md5: 11cdef5022ad6bdb515f89a4f437e740\n    sleeptime: 45000\n    stage.cleanup: 1\n    useragent_header: Mozilla/5.0 (Windows NT 6.3; Trident/7.0; rv:11.0) like Gecko\n    uses_cookies: 1\n    watermark: 1234567890\n  x64:\n    beacon_type: HTTP\n    dns-beacon.strategy_fail_seconds: -1\n    dns-beacon.strategy_fail_x: -1\n    dns-beacon.strategy_rotate_seconds: -1\n    http-get.client:\n      Accept: text/html,application/xhtml+xml,application/xml;q=0.9,*/*;q=0.8\n      Referer: http://code.jquery.com/\n      Accept-Encoding: gzip, deflate\n      __cfduid=\n      Cookie\n    http-get.uri: 202.95.15.23,/jquery-3.3.1.min.js\n    http-get.verb: GET\n    http-post.client:\n      Accept: text/html,application/xhtml+xml,application/xml;q=0.9,*/*;q=0.8\n      Referer: http://code.jquery.com/\n      Accept-Encoding: gzip, deflate\n      __cfduid\n    http-post.uri: /jquery-3.3.2.min.js\n    http-post.verb: POST\n    jitter: 37\n    maxgetsize: 1403644\n    port: 8333\n    post-ex.spawnto_x64: %windir%\\sysnative\\dllhost.exe\n    post-ex.spawnto_x86: %windir%\\syswow64\\dllhost.exe\n    process-inject.allocator: 1\n    process-inject.execute:\n      ntdll:RtlUserThreadStart\n      CreateThread\n      NtQueueApcThread-s\n      CreateRemoteThread\n      RtlCreateUserThread\n    process-inject.min_alloc: 17500\n    process-inject.startrwx: 4\n    process-inject.stub: 222b8f27dbdfba8ddd559eeca27ea648\n    process-inject.userwx: 32\n    proxy.behavior: 2 (Use IE settings)\n    server.publickey_md5: 11cdef5022ad6bdb515f89a4f437e740\n    sleeptime: 45000\n    stage.cleanup: 1\n    useragent_header: Mozilla/5.0 (Windows NT 6.3; Trident/7.0; rv:11.0) like Gecko\n    uses_cookies: 1\n    watermark: 1234567890\n", "port": 8333, "opts": {}, "ip_str": "202.95.15.23"}
{"hash": 1595548052, "cobalt_strike_beacon": {"x64": {"beacon_type": "HTTP", "dns-beacon.strategy_rotate_seconds": -1, "useragent_header": "Mozilla/5.0 (compatible; MSIE 9.0; Windows NT 6.1; WOW64; Trident/5.0; BOIE9;ENUS)", "http-post.client": ["Content-Type: application/octet-stream", "id"], "maxgetsize": 1048576, "post-ex.spawnto_x86": "%windir%\\syswow64\\rundll32.exe", "port": 8082, "sleeptime": 60000, "uses_cookies": 1, "proxy.behavior": "2 (Use IE settings)", "process-inject.execute": ["CreateThread", "SetThreadContext", "CreateRemoteThread", "RtlCreateUserThread"], "process-inject.startrwx": 64, "post-ex.spawnto_x64": "%windir%\\sysnative\\rundll32.exe", "process-inject.stub": "e43a1b63f09794f74d90a9889f7acb77", "http-get.uri": "1.14.32.41,/g.pixel", "watermark": 987654321, "dns-beacon.strategy_fail_seconds": -1, "process-inject.userwx": 64, "dns-beacon.strategy_fail_x": -1, "http-post.verb": "POST", "http-post.uri": "/submit.php", "server.publickey_md5": "86b404deaf690e9299c2ac0fb5a3810e", "http-get.verb": "GET", "http-get.client": ["Cookie"]}}, "product": "Cobalt Strike Beacon", "http": {"status": 404, "robots_hash": null, "redirects": [], "securitytxt": null, "title": null, "sitemap_hash": null, "robots": null, "server": null, "headers_hash": 2129120964, "host": "1.14.32.41", "html": "", "location": "/", "html_hash": 0, "sitemap": null, "securitytxt_hash": null}, "os": null, "timestamp": "2023-09-01T07:34:09.990511", "isp": "Shenzhen Tencent Computer Systems Company Limited", "transport": "tcp", "_shodan": {"region": "sea", "ptr": true, "module": "auto", "id": "01f29183-e1fa-4790-930f-09b1324698ed", "options": {}, "crawler": "9573c4993f64b6dad271a1522a3528ef8bace521"}, "asn": "AS45090", "hostnames": [], "location": {"city": "Beijing", "region_code": "BJ", "area_code": null, "longitude": 116.39723, "latitude": 39.9075, "country_code": "CN", "country_name": "China"}, "ip": 17702953, "domains": [], "org": "Tencent cloud computing (Beijing) Co., Ltd.", "data": "HTTP/1.1 404 Not Found\r\nDate: Fri, 1 Sep 2023 07:34:09 GMT\r\nContent-Type: text/plain\r\nContent-Length: 0\r\n\r\n\nCobalt Strike Beacon:\n  x64:\n    beacon_type: HTTP\n    dns-beacon.strategy_fail_seconds: -1\n    dns-beacon.strategy_fail_x: -1\n    dns-beacon.strategy_rotate_seconds: -1\n    http-get.client:\n      Cookie\n    http-get.uri: 1.14.32.41,/g.pixel\n    http-get.verb: GET\n    http-post.client:\n      Content-Type: application/octet-stream\n      id\n    http-post.uri: /submit.php\n    http-post.verb: POST\n    maxgetsize: 1048576\n    port: 8082\n    post-ex.spawnto_x64: %windir%\\sysnative\\rundll32.exe\n    post-ex.spawnto_x86: %windir%\\syswow64\\rundll32.exe\n    process-inject.execute:\n      CreateThread\n      SetThreadContext\n      CreateRemoteThread\n      RtlCreateUserThread\n    process-inject.startrwx: 64\n    process-inject.stub: e43a1b63f09794f74d90a9889f7acb77\n    process-inject.userwx: 64\n    proxy.behavior: 2 (Use IE settings)\n    server.publickey_md5: 86b404deaf690e9299c2ac0fb5a3810e\n    sleeptime: 60000\n    useragent_header: Mozilla/5.0 (compatible; MSIE 9.0; Windows NT 6.1; WOW64; Trident/5.0; BOIE9;ENUS)\n    uses_cookies: 1\n    watermark: 987654321\n", "port": 8082, "opts": {}, "ip_str": "1.14.32.41"}
{"hash": 560172021, "cobalt_strike_beacon": {"x86": {"beacon_type": "HTTPS", "http-post.uri": "/email/", "dns-beacon.maxdns": 255, "sleeptime": 60000, "useragent_header": "Mozilla/5.0 (compatible; MSIE 9.0; Windows NT 6.1; WOW64; Trident/5.0; BOIE9;ENUSMSE)", "proxy.behavior": "2 (Use IE settings)", "maxgetsize": 1398104, "process-inject.userwx": 64, "process-inject.execute": ["CreateThread", "SetThreadContext", "CreateRemoteThread", "RtlCreateUserThread"], "process-inject.startrwx": 64, "port": 6443, "server.publickey_md5": "52d7c7e394fe3ac001d91e81dbd15d10", "post-ex.spawnto_x64": "%windir%\\sysnative\\rundll32.exe", "http-get.verb": "GET", "http-get.client": ["Accept: text/html,application/xhtml+xml,application/xml;q=0.9,*/*l;q=0.8", "Referer: http://www.google.com", "Host: apex1.tk", "Pragma: no-cache", "Cache-Control: no-cache", ".jpg"], "post-ex.spawnto_x86": "%windir%\\syswow64\\rundll32.exe", "process-inject.stub": "187ab8f98098de95714613f8544c9613", "http-get.uri": "124.220.79.50,/image/", "http-post.client": ["Content-Type: application/octet-stream", "Referer: http://www.google.com", "Host: apex1.tk", "Pragma: no-cache", "Cache-Control: no-cache", ".png"], "http-post.verb": "POST"}, "x64": {"beacon_type": "HTTPS", "http-post.uri": "/email/", "dns-beacon.maxdns": 255, "sleeptime": 60000, "useragent_header": "Mozilla/4.0 (compatible; MSIE 8.0; Windows NT 5.1; Trident/4.0; LBBROWSER)", "proxy.behavior": "2 (Use IE settings)", "maxgetsize": 1398104, "process-inject.userwx": 64, "process-inject.execute": ["CreateThread", "SetThreadContext", "CreateRemoteThread", "RtlCreateUserThread"], "process-inject.startrwx": 64, "port": 6443, "server.publickey_md5": "52d7c7e394fe3ac001d91e81dbd15d10", "post-ex.spawnto_x64": "%windir%\\sysnative\\rundll32.exe", "http-get.verb": "GET", "http-get.client": ["Accept: text/html,application/xhtml+xml,application/xml;q=0.9,*/*l;q=0.8", "Referer: http://www.google.com", "Host: apex1.tk", "Pragma: no-cache", "Cache-Control: no-cache", ".jpg"], "post-ex.spawnto_x86": "%windir%\\syswow64\\rundll32.exe", "process-inject.stub": "187ab8f98098de95714613f8544c9613", "http-get.uri": "124.220.79.50,/image/", "http-post.client": ["Content-Type: application/octet-stream", "Referer: http://www.google.com", "Host: apex1.tk", "Pragma: no-cache", "Cache-Control: no-cache", ".png"], "http-post.verb": "POST"}}, "product": "Cobalt Strike Beacon", "http": {"status": 404, "robots_hash": null, "redirects": [], "securitytxt": null, "title": null, "sitemap_hash": null, "robots": null, "server": null, "headers_hash": 2129120964, "host": "124.220.79.50", "html": "", "location": "/", "html_hash": 0, "sitemap": null, "securitytxt_hash": null}, "os": null, "asn": "AS45090", "tags": ["self-signed"], "timestamp": "2023-09-01T05:36:25.009552", "isp": "Shenzhen Tencent Computer Systems Company Limited", "transport": "tcp", "_shodan": {"region": "eu", "ptr": true, "module": "https-simple-new", "id": "d47363bf-975e-41fd-a9ae-3df89aad3c76", "options": {}, "crawler": "bf213bc419cc8491376c12af31e32623c1b6f467"}, "ssl": {"chain_sha256": ["0c2f44f4e1fd5ff38a278a349b38e8591524e2509189fb021c94bc4f29f28728"], "jarm": "07d13d15d21d21d07c07d13d07d21dd7fc4c7c6ef19b77a4ca0787979cdc13", "chain": ["-----BEGIN CERTIFICATE-----\nMIIDnTCCAoWgAwIBAgIEc3NXDTANBgkqhkiG9w0BAQsFADB/MQswCQYDVQQGEwJV\nUzETMBEGA1UECBMKV2FzaGluZ3RvbjEQMA4GA1UEBxMHUmVkbW9uZDEeMBwGA1UE\nChMVTWljcm9zb2Z0IENvcnBvcmF0aW9uMQ0wCwYDVQQLEwRNT1BSMRowGAYDVQQD\nExFNaWNyb3NvZnQgV2luZG93czAeFw0yMzA4MjcwNjIyMTdaFw0yMzExMjUwNjIy\nMTdaMH8xCzAJBgNVBAYTAlVTMRMwEQYDVQQIEwpXYXNoaW5ndG9uMRAwDgYDVQQH\nEwdSZWRtb25kMR4wHAYDVQQKExVNaWNyb3NvZnQgQ29ycG9yYXRpb24xDTALBgNV\nBAsTBE1PUFIxGjAYBgNVBAMTEU1pY3Jvc29mdCBXaW5kb3dzMIIBIjANBgkqhkiG\n9w0BAQEFAAOCAQ8AMIIBCgKCAQEAqMoldPNUhxtVuDKkQIVSrW/czBmu+Cbe830z\n0QzqC9he/ByelIAg+9QDLs8mBU4jvjASrEU3iXfsmWJFOwLQf4q4b//qV4runFQL\npvMAANOeafENGVGYIW9LrvU7OGOVfns9lIk4Uj/fVj25EQ6BK8j6chKeSKldAZEe\nJBVBlN3O6MuvfgxHEmvhr9CiPYsYrhlxEN/W5MBPhCoA3QN2olaKlPD4hvqiOVZ4\nvswqtcNUFrFH6MTRUiLEjALFKALL+0zwc1415nmmFbX80A38fmaMMYyXMwEW8UCw\n4SmwKkY/VULfTGL9bSHBb+Fc9Sv9bv0aeeYfzK4N0ZdQiBiSoQIDAQABoyEwHzAd\nBgNVHQ4EFgQUmjdJHKAuVhqJRlHNNnm8tq6cT6QwDQYJKoZIhvcNAQELBQADggEB\nAJO3XqV49H7oE6SkbUKCxPEpjT5cb/l097k8soJ9q9pEZopnwLZXY0ufk2kEhH6V\nxo5Mpf5LmI9UxvfvhuoDRH8WIPDVX+SV/ELa083ZtX+7iPloPc1rTHNTZNQSx+fj\nluJcmOLcM2dJ5FqjwlzyqU7OjIKLI2I93m+vOOWx8e1b89n5QBSm9HuLKPCValNm\nfbjIE7CQ9oaR9B7L8PcRY5ljRte61zTlpolId9+R3FRZuqf06xYBqCMywrIYRW8S\norDElLwBlS2uFYNrM2XApcptz/lrEHEJc8wDOdhGo8+6m6E4POPi1rXzd3DrDCfR\nVNl41aBYFtB+Qc0veLrMpd0=\n-----END CERTIFICATE-----\n"], "dhparams": {"prime": "ffffffffffffffffc90fdaa22168c234c4c6628b80dc1cd129024e088a67cc74020bbea63b139b22514a08798e3404ddef9519b3cd3a431b302b0a6df25f14374fe1356d6d51c245e485b576625e7ec6f44c42e9a637ed6b0bff5cb6f406b7edee386bfb5a899fa5ae9f24117c4b1fe649286651ece65381ffffffffffffffff", "public_key": "4d2f2592a0bfa936bb555adc8cb1d6b368cc61577ec3a2fae4236ffc0850bb6d5153a3047ecffad6eb6ef4c5d1aa1776cb310a56033184cfa2119cdc0f78f5085d766ba2664cea61b43e39ad7ff1642e67f2c234e99155ae858b4633b61b4563f42b5b44b2a0bc8e19c5d805de04af532662502cbd42e67afea00b163c16dc3a", "bits": 1024, "generator": 2, "fingerprint": "RFC2409/Oakley Group 2"}, "versions": ["TLSv1", "-SSLv2", "-SSLv3", "TLSv1.1", "TLSv1.2"], "acceptable_cas": [], "tlsext": [{"id": 65281, "name": "renegotiation_info"}], "ja3s": "fbe78c619e7ea20046131294ad087f05", "cert": {"sig_alg": "sha256WithRSAEncryption", "issued": "20230827062217Z", "expires": "20231125062217Z", "expired": false, "version": 2, "extensions": [{"data": "\\x04\\x14\\x9a7I\\x1c\\xa0.V\\x1a\\x89FQ\\xcd6y\\xbc\\xb6\\xae\\x9cO\\xa4", "name": "subjectKeyIdentifier"}], "fingerprint": {"sha256": "0c2f44f4e1fd5ff38a278a349b38e8591524e2509189fb021c94bc4f29f28728", "sha1": "ac5aa0c9fb61e7be439d46845794dc41c87ab052"}, "serial": 1936938765, "subject": {"C": "US", "CN": "Microsoft Windows", "L": "Redmond", "O": "Microsoft Corporation", "ST": "Washington", "OU": "MOPR"}, "pubkey": {"type": "rsa", "bits": 2048}, "issuer": {"C": "US", "CN": "Microsoft Windows", "L": "Redmond", "O": "Microsoft Corporation", "ST": "Washington", "OU": "MOPR"}}, "cipher": {"version": "TLSv1.2", "bits": 128, "name": "ECDHE-RSA-AES128-GCM-SHA256"}, "trust": {"revoked": false, "browser": null}, "handshake_states": ["before SSL initialization", "SSLv3/TLS write client hello", "SSLv3/TLS read server hello", "SSLv3/TLS read server certificate", "SSLv3/TLS read server key exchange", "SSLv3/TLS read server done", "SSLv3/TLS write client key exchange", "SSLv3/TLS write change cipher spec", "SSLv3/TLS write finished", "SSLv3/TLS read change cipher spec", "SSLv3/TLS read finished", "SSL negotiation finished successfully"], "alpn": [], "ocsp": {}}, "hostnames": [], "location": {"city": "Beijing", "region_code": "BJ", "area_code": null, "longitude": 116.39723, "latitude": 39.9075, "country_code": "CN", "country_name": "China"}, "ip": 2094812978, "domains": [], "org": "Tencent cloud computing (Beijing) Co., Ltd.", "data": "HTTP/1.1 404 Not Found\r\nDate: Fri, 1 Sep 2023 05:36:25 GMT\r\nContent-Type: text/plain\r\nContent-Length: 0\r\n\r\n\nCobalt Strike Beacon:\n  x86:\n    beacon_type: HTTPS\n    dns-beacon.maxdns: 255\n    http-get.client:\n      Accept: text/html,application/xhtml+xml,application/xml;q=0.9,*/*l;q=0.8\n      Referer: http://www.google.com\n      Host: apex1.tk\n      Pragma: no-cache\n      Cache-Control: no-cache\n      .jpg\n    http-get.uri: 124.220.79.50,/image/\n    http-get.verb: GET\n    http-post.client:\n      Content-Type: application/octet-stream\n      Referer: http://www.google.com\n      Host: apex1.tk\n      Pragma: no-cache\n      Cache-Control: no-cache\n      .png\n    http-post.uri: /email/\n    http-post.verb: POST\n    maxgetsize: 1398104\n    port: 6443\n    post-ex.spawnto_x64: %windir%\\sysnative\\rundll32.exe\n    post-ex.spawnto_x86: %windir%\\syswow64\\rundll32.exe\n    process-inject.execute:\n      CreateThread\n      SetThreadContext\n      CreateRemoteThread\n      RtlCreateUserThread\n    process-inject.startrwx: 64\n    process-inject.stub: 187ab8f98098de95714613f8544c9613\n    process-inject.userwx: 64\n    proxy.behavior: 2 (Use IE settings)\n    server.publickey_md5: 52d7c7e394fe3ac001d91e81dbd15d10\n    sleeptime: 60000\n    useragent_header: Mozilla/5.0 (compatible; MSIE 9.0; Windows NT 6.1; WOW64; Trident/5.0; BOIE9;ENUSMSE)\n  x64:\n    beacon_type: HTTPS\n    dns-beacon.maxdns: 255\n    http-get.client:\n      Accept: text/html,application/xhtml+xml,application/xml;q=0.9,*/*l;q=0.8\n      Referer: http://www.google.com\n      Host: apex1.tk\n      Pragma: no-cache\n      Cache-Control: no-cache\n      .jpg\n    http-get.uri: 124.220.79.50,/image/\n    http-get.verb: GET\n    http-post.client:\n      Content-Type: application/octet-stream\n      Referer: http://www.google.com\n      Host: apex1.tk\n      Pragma: no-cache\n      Cache-Control: no-cache\n      .png\n    http-post.uri: /email/\n    http-post.verb: POST\n    maxgetsize: 1398104\n    port: 6443\n    post-ex.spawnto_x64: %windir%\\sysnative\\rundll32.exe\n    post-ex.spawnto_x86: %windir%\\syswow64\\rundll32.exe\n    process-inject.execute:\n      CreateThread\n      SetThreadContext\n      CreateRemoteThread\n      RtlCreateUserThread\n    process-inject.startrwx: 64\n    process-inject.stub: 187ab8f98098de95714613f8544c9613\n    process-inject.userwx: 64\n    proxy.behavior: 2 (Use IE settings)\n    server.publickey_md5: 52d7c7e394fe3ac001d91e81dbd15d10\n    sleeptime: 60000\n    useragent_header: Mozilla/4.0 (compatible; MSIE 8.0; Windows NT 5.1; Trident/4.0; LBBROWSER)\n", "port": 6443, "opts": {"vulns": [], "heartbleed": "2023/09/01 05:36:51 124.220.79.50:6443 - ERROR: heartbleed: timeout\n"}, "ip_str": "124.220.79.50"}
{"hash": -1633369428, "cobalt_strike_beacon": {"x86": {"beacon_type": "HTTP", "dns-beacon.strategy_rotate_seconds": -1, "useragent_header": "Mozilla/5.0 (compatible; MSIE 9.0; Windows NT 6.1; Win64; x64; Trident/5.0; MANM; MANM)", "http-post.client": ["Content-Type: application/octet-stream", "id"], "maxgetsize": 1048576, "post-ex.spawnto_x86": "%windir%\\syswow64\\rundll32.exe", "port": 6666, "sleeptime": 60000, "uses_cookies": 1, "proxy.behavior": "2 (Use IE settings)", "process-inject.execute": ["CreateThread", "SetThreadContext", "CreateRemoteThread", "RtlCreateUserThread"], "process-inject.startrwx": 64, "post-ex.spawnto_x64": "%windir%\\sysnative\\rundll32.exe", "process-inject.stub": "e43a1b63f09794f74d90a9889f7acb77", "http-get.uri": "43.138.0.70,/updates.rss", "watermark": 987654321, "dns-beacon.strategy_fail_seconds": -1, "process-inject.userwx": 64, "dns-beacon.strategy_fail_x": -1, "http-post.verb": "POST", "http-post.uri": "/submit.php", "server.publickey_md5": "334ee3ba599f104fa580e91bfd3fce2f", "http-get.verb": "GET", "http-get.client": ["Cookie"]}, "x64": {"beacon_type": "HTTP", "dns-beacon.strategy_rotate_seconds": -1, "useragent_header": "Mozilla/4.0 (compatible; MSIE 8.0; Windows NT 6.1; WOW64; Trident/4.0; SLCC2; .NET CLR 2.0.50727)", "http-post.client": ["Content-Type: application/octet-stream", "id"], "maxgetsize": 1048576, "post-ex.spawnto_x86": "%windir%\\syswow64\\rundll32.exe", "port": 6666, "sleeptime": 60000, "uses_cookies": 1, "proxy.behavior": "2 (Use IE settings)", "process-inject.execute": ["CreateThread", "SetThreadContext", "CreateRemoteThread", "RtlCreateUserThread"], "process-inject.startrwx": 64, "post-ex.spawnto_x64": "%windir%\\sysnative\\rundll32.exe", "process-inject.stub": "e43a1b63f09794f74d90a9889f7acb77", "http-get.uri": "43.138.0.70,/ptj", "watermark": 987654321, "dns-beacon.strategy_fail_seconds": -1, "process-inject.userwx": 64, "dns-beacon.strategy_fail_x": -1, "http-post.verb": "POST", "http-post.uri": "/submit.php", "server.publickey_md5": "334ee3ba599f104fa580e91bfd3fce2f", "http-get.verb": "GET", "http-get.client": ["Cookie"]}}, "product": "Cobalt Strike Beacon", "http": {"status": 404, "robots_hash": null, "redirects": [], "securitytxt": null, "title": null, "sitemap_hash": null, "robots": null, "server": null, "headers_hash": 2129120964, "host": "43.138.0.70", "html": "", "location": "/", "html_hash": 0, "sitemap": null, "securitytxt_hash": null}, "os": null, "tags": ["cloud"], "timestamp": "2023-09-01T04:00:16.852176", "isp": "Shenzhen Tencent Computer Systems Company Limited", "transport": "tcp", "_shodan": {"region": "eu", "ptr": true, "module": "auto", "id": "3e8355d8-a3d8-482b-bb2b-1bc7ed83c592", "options": {}, "crawler": "487814a778c983e2dcef234806292d88c5cbf3ec"}, "asn": "AS45090", "cloud": {"region": null, "service": null, "provider": "Tencent Cloud"}, "hostnames": [], "location": {"city": "Beijing", "region_code": "BJ", "area_code": null, "longitude": 116.39723, "latitude": 39.9075, "country_code": "CN", "country_name": "China"}, "ip": 730464326, "domains": [], "org": "Tencent Cloud Computing (Beijing) Co., Ltd", "data": "HTTP/1.1 404 Not Found\r\nDate: Fri, 1 Sep 2023 04:00:16 GMT\r\nContent-Type: text/plain\r\nContent-Length: 0\r\n\r\n\nCobalt Strike Beacon:\n  x86:\n    beacon_type: HTTP\n    dns-beacon.strategy_fail_seconds: -1\n    dns-beacon.strategy_fail_x: -1\n    dns-beacon.strategy_rotate_seconds: -1\n    http-get.client:\n      Cookie\n    http-get.uri: 43.138.0.70,/updates.rss\n    http-get.verb: GET\n    http-post.client:\n      Content-Type: application/octet-stream\n      id\n    http-post.uri: /submit.php\n    http-post.verb: POST\n    maxgetsize: 1048576\n    port: 6666\n    post-ex.spawnto_x64: %windir%\\sysnative\\rundll32.exe\n    post-ex.spawnto_x86: %windir%\\syswow64\\rundll32.exe\n    process-inject.execute:\n      CreateThread\n      SetThreadContext\n      CreateRemoteThread\n      RtlCreateUserThread\n    process-inject.startrwx: 64\n    process-inject.stub: e43a1b63f09794f74d90a9889f7acb77\n    process-inject.userwx: 64\n    proxy.behavior: 2 (Use IE settings)\n    server.publickey_md5: 334ee3ba599f104fa580e91bfd3fce2f\n    sleeptime: 60000\n    useragent_header: Mozilla/5.0 (compatible; MSIE 9.0; Windows NT 6.1; Win64; x64; Trident/5.0; MANM; MANM)\n    uses_cookies: 1\n    watermark: 987654321\n  x64:\n    beacon_type: HTTP\n    dns-beacon.strategy_fail_seconds: -1\n    dns-beacon.strategy_fail_x: -1\n    dns-beacon.strategy_rotate_seconds: -1\n    http-get.client:\n      Cookie\n    http-get.uri: 43.138.0.70,/ptj\n    http-get.verb: GET\n    http-post.client:\n      Content-Type: application/octet-stream\n      id\n    http-post.uri: /submit.php\n    http-post.verb: POST\n    maxgetsize: 1048576\n    port: 6666\n    post-ex.spawnto_x64: %windir%\\sysnative\\rundll32.exe\n    post-ex.spawnto_x86: %windir%\\syswow64\\rundll32.exe\n    process-inject.execute:\n      CreateThread\n      SetThreadContext\n      CreateRemoteThread\n      RtlCreateUserThread\n    process-inject.startrwx: 64\n    process-inject.stub: e43a1b63f09794f74d90a9889f7acb77\n    process-inject.userwx: 64\n    proxy.behavior: 2 (Use IE settings)\n    server.publickey_md5: 334ee3ba599f104fa580e91bfd3fce2f\n    sleeptime: 60000\n    useragent_header: Mozilla/4.0 (compatible; MSIE 8.0; Windows NT 6.1; WOW64; Trident/4.0; SLCC2; .NET CLR 2.0.50727)\n    uses_cookies: 1\n    watermark: 987654321\n", "port": 6666, "opts": {}, "ip_str": "43.138.0.70"}
{"cobalt_strike_beacon": {"x86": {"beacon_type": "HTTP", "useragent_header": "Mozilla/5.0 (Windows NT 10.0; Win64; x64) AppleWebKit/537.36 (KHTML, like Gecko) Chrome/96.0.4664.45 Safari/537.36", "http-post.client": ["Accept: */*", "Referer: https://www.bjt.beijing.gov.cn", "JSESSION=", "Cookie"], "maxgetsize": 2098660, "process-inject.min_alloc": 16384, "post-ex.spawnto_x86": "%windir%\\syswow64\\rundll32.exe", "port": 80, "sleeptime": 5000, "uses_cookies": 1, "proxy.behavior": "2 (Use IE settings)", "process-inject.execute": ["ntdll.dll:RtlUserThreadStart", "SetThreadContext", "RtlCreateUserThread"], "process-inject.startrwx": 64, "post-ex.spawnto_x64": "%windir%\\sysnative\\rundll32.exe", "process-inject.stub": "00000000000000000000000000000000", "http-get.uri": "81.70.3.30,/admin/login", "watermark": 305419896, "process-inject.userwx": 32, "http-post.verb": "POST", "http-post.uri": "/admin/user", "dns-beacon.maxdns": 255, "server.publickey_md5": "79b6e333634c506f6f710dde179796ed", "http-get.verb": "GET", "http-get.client": ["Accept: */*", "Referer: https://www.bjt.beijing.gov.cn", "SESSIONID=", "Cookie"]}, "x64": {"beacon_type": "HTTP", "useragent_header": "Mozilla/5.0 (Windows NT 10.0; Win64; x64) AppleWebKit/537.36 (KHTML, like Gecko) Chrome/96.0.4664.45 Safari/537.36", "http-post.client": ["Accept: */*", "Referer: https://www.bjt.beijing.gov.cn", "JSESSION=", "Cookie"], "maxgetsize": 2098660, "process-inject.min_alloc": 16384, "post-ex.spawnto_x86": "%windir%\\syswow64\\rundll32.exe", "port": 80, "sleeptime": 5000, "uses_cookies": 1, "proxy.behavior": "2 (Use IE settings)", "process-inject.execute": ["ntdll.dll:RtlUserThreadStart", "SetThreadContext", "RtlCreateUserThread"], "process-inject.startrwx": 64, "post-ex.spawnto_x64": "%windir%\\sysnative\\rundll32.exe", "process-inject.stub": "00000000000000000000000000000000", "http-get.uri": "81.70.3.30,/admin/login", "watermark": 305419896, "process-inject.userwx": 32, "http-post.verb": "POST", "http-post.uri": "/admin/user", "dns-beacon.maxdns": 255, "server.publickey_md5": "79b6e333634c506f6f710dde179796ed", "http-get.verb": "GET", "http-get.client": ["Accept: */*", "Referer: https://www.bjt.beijing.gov.cn", "SESSIONID=", "Cookie"]}}, "ip": 1363542814, "http": {"status": 404, "robots_hash": null, "redirects": [], "securitytxt": null, "title": null, "sitemap_hash": null, "robots": null, "server": null, "headers_hash": 2129120964, "host": "81.70.3.30", "html": "", "location": "/", "html_hash": 0, "sitemap": null, "securitytxt_hash": null}, "port": 80, "transport": "tcp", "cloud": {"region": null, "service": null, "provider": "Tencent Cloud"}, "location": {"city": "Beijing", "region_code": "BJ", "area_code": null, "longitude": 116.39723, "latitude": 39.9075, "country_code": "CN", "country_name": "China"}, "product": "Cobalt Strike Beacon", "hash": -1969769625, "tags": ["cloud"], "timestamp": "2023-08-31T20:52:54.291471", "hostnames": [], "org": "Tencent Cloud Computing (Beijing) Co., Ltd", "data": "HTTP/1.1 404 Not Found\r\nDate: Thu, 31 Aug 2023 20:52:54 GMT\r\nContent-Type: text/plain\r\nContent-Length: 0\r\n\r\n\nCobalt Strike Beacon:\n  x86:\n    beacon_type: HTTP\n    dns-beacon.maxdns: 255\n    http-get.client:\n      Accept: */*\n      Referer: https://www.bjt.beijing.gov.cn\n      SESSIONID=\n      Cookie\n    http-get.uri: 81.70.3.30,/admin/login\n    http-get.verb: GET\n    http-post.client:\n      Accept: */*\n      Referer: https://www.bjt.beijing.gov.cn\n      JSESSION=\n      Cookie\n    http-post.uri: /admin/user\n    http-post.verb: POST\n    maxgetsize: 2098660\n    port: 80\n    post-ex.spawnto_x64: %windir%\\sysnative\\rundll32.exe\n    post-ex.spawnto_x86: %windir%\\syswow64\\rundll32.exe\n    process-inject.execute:\n      ntdll.dll:RtlUserThreadStart\n      SetThreadContext\n      RtlCreateUserThread\n    process-inject.min_alloc: 16384\n    process-inject.startrwx: 64\n    process-inject.stub: 00000000000000000000000000000000\n    process-inject.userwx: 32\n    proxy.behavior: 2 (Use IE settings)\n    server.publickey_md5: 79b6e333634c506f6f710dde179796ed\n    sleeptime: 5000\n    useragent_header: Mozilla/5.0 (Windows NT 10.0; Win64; x64) AppleWebKit/537.36 (KHTML, like Gecko) Chrome/96.0.4664.45 Safari/537.36\n    uses_cookies: 1\n    watermark: 305419896\n  x64:\n    beacon_type: HTTP\n    dns-beacon.maxdns: 255\n    http-get.client:\n      Accept: */*\n      Referer: https://www.bjt.beijing.gov.cn\n      SESSIONID=\n      Cookie\n    http-get.uri: 81.70.3.30,/admin/login\n    http-get.verb: GET\n    http-post.client:\n      Accept: */*\n      Referer: https://www.bjt.beijing.gov.cn\n      JSESSION=\n      Cookie\n    http-post.uri: /admin/user\n    http-post.verb: POST\n    maxgetsize: 2098660\n    port: 80\n    post-ex.spawnto_x64: %windir%\\sysnative\\rundll32.exe\n    post-ex.spawnto_x86: %windir%\\syswow64\\rundll32.exe\n    process-inject.execute:\n      ntdll.dll:RtlUserThreadStart\n      SetThreadContext\n      RtlCreateUserThread\n    process-inject.min_alloc: 16384\n    process-inject.startrwx: 64\n    process-inject.stub: 00000000000000000000000000000000\n    process-inject.userwx: 32\n    proxy.behavior: 2 (Use IE settings)\n    server.publickey_md5: 79b6e333634c506f6f710dde179796ed\n    sleeptime: 5000\n    useragent_header: Mozilla/5.0 (Windows NT 10.0; Win64; x64) AppleWebKit/537.36 (KHTML, like Gecko) Chrome/96.0.4664.45 Safari/537.36\n    uses_cookies: 1\n    watermark: 305419896\n", "asn": "AS45090", "cpe23": ["cpe:2.3:a:helpsystems:cobalt_strike"], "isp": "Shenzhen Tencent Computer Systems Company Limited", "cpe": ["cpe:/a:helpsystems:cobalt_strike"], "domains": [], "ip_str": "81.70.3.30", "os": null, "_shodan": {"region": "na", "ptr": true, "module": "http", "id": "27dd9a1c-a681-4fe8-9a97-36d2fb200d53", "options": {}, "crawler": "21255b11b05f5ce2a4cf82d3f9ebb017a5a1fdd1"}, "opts": {}}
{"cobalt_strike_beacon": {"x86": {"beacon_type": "HTTPS", "jitter": 35, "dns-beacon.strategy_rotate_seconds": -1, "useragent_header": "Mozilla/5.0 (Windows NT 10.0; Win64; x64) AppleWebKit/537.36 (KHTML, like Gecko) Chrome/110.0.0.0 Safari/537.36", "http-post.client": ["Accept: text/html,application/xhtml+xml,application/xml;q=0.9,*/*;q=0.8", "Referer: http://code.jquery.com/", "Accept-Encoding: gzip, deflate", "__cfduid"], "maxgetsize": 1403644, "process-inject.min_alloc": 17500, "post-ex.spawnto_x86": "%windir%\\syswow64\\dllhost.exe", "port": 443, "sleeptime": 5000, "uses_cookies": 1, "proxy.behavior": "2 (Use IE settings)", "process-inject.execute": ["ntdll:RtlUserThreadStart", "CreateThread", "NtQueueApcThread-s", "CreateRemoteThread", "RtlCreateUserThread"], "process-inject.startrwx": 4, "post-ex.spawnto_x64": "%windir%\\sysnative\\dllhost.exe", "process-inject.stub": "b50b86d735412685eb6044ad8d01781c", "http-get.uri": "110.40.135.135,/jquery-3.3.1.min.js", "watermark": 391144938, "dns-beacon.strategy_fail_seconds": -1, "process-inject.userwx": 32, "dns-beacon.strategy_fail_x": -1, "stage.cleanup": 1, "http-post.verb": "POST", "http-post.uri": "/jquery-3.3.2.min.js", "server.publickey_md5": "29d65948df40e6584707a4628514e5e5", "process-inject.allocator": 1, "http-get.verb": "GET", "http-get.client": ["Accept: text/html,application/xhtml+xml,application/xml;q=0.9,*/*;q=0.8", "Referer: http://code.jquery.com/", "Accept-Encoding: gzip, deflate", "__cfduid=", "Cookie"]}, "x64": {"beacon_type": "HTTPS", "jitter": 35, "dns-beacon.strategy_rotate_seconds": -1, "useragent_header": "Mozilla/5.0 (Windows NT 10.0; Win64; x64) AppleWebKit/537.36 (KHTML, like Gecko) Chrome/110.0.0.0 Safari/537.36", "http-post.client": ["Accept: text/html,application/xhtml+xml,application/xml;q=0.9,*/*;q=0.8", "Referer: http://code.jquery.com/", "Accept-Encoding: gzip, deflate", "__cfduid"], "maxgetsize": 1403644, "process-inject.min_alloc": 17500, "post-ex.spawnto_x86": "%windir%\\syswow64\\dllhost.exe", "port": 443, "sleeptime": 5000, "uses_cookies": 1, "proxy.behavior": "2 (Use IE settings)", "process-inject.execute": ["ntdll:RtlUserThreadStart", "CreateThread", "NtQueueApcThread-s", "CreateRemoteThread", "RtlCreateUserThread"], "process-inject.startrwx": 4, "post-ex.spawnto_x64": "%windir%\\sysnative\\dllhost.exe", "process-inject.stub": "b50b86d735412685eb6044ad8d01781c", "http-get.uri": "110.40.135.135,/jquery-3.3.1.min.js", "watermark": 391144938, "dns-beacon.strategy_fail_seconds": -1, "process-inject.userwx": 32, "dns-beacon.strategy_fail_x": -1, "stage.cleanup": 1, "http-post.verb": "POST", "http-post.uri": "/jquery-3.3.2.min.js", "server.publickey_md5": "29d65948df40e6584707a4628514e5e5", "process-inject.allocator": 1, "http-get.verb": "GET", "http-get.client": ["Accept: text/html,application/xhtml+xml,application/xml;q=0.9,*/*;q=0.8", "Referer: http://code.jquery.com/", "Accept-Encoding: gzip, deflate", "__cfduid=", "Cookie"]}}, "ip": 1848149895, "http": {"status": 404, "robots_hash": null, "redirects": [], "securitytxt": null, "title": null, "sitemap_hash": null, "robots": null, "server": "Apache", "headers_hash": -1392026739, "host": "110.40.135.135", "html": "", "location": "/", "html_hash": 0, "sitemap": null, "securitytxt_hash": null}, "port": 443, "transport": "tcp", "location": {"city": "Shanghai", "region_code": "SH", "area_code": null, "longitude": 121.45806, "latitude": 31.22222, "country_code": "CN", "country_name": "China"}, "product": "Cobalt Strike Beacon", "hash": -137563100, "tags": ["self-signed"], "timestamp": "2023-08-31T19:45:51.305664", "ssl": {"chain_sha256": ["b89430f6b35876decc5967e3e82aaa67c3011cc49d1d1af76279f2fa6200fdb6"], "jarm": "2ad2ad16d2ad2ad00042d42d00042ddb04deffa1705e2edc44cae1ed24a4da", "chain": ["-----BEGIN CERTIFICATE-----\nMIIDcTCCAlmgAwIBAgIEQEinujANBgkqhkiG9w0BAQsFADBpMQswCQYDVQQGEwJV\nUzEJMAcGA1UECBMAMQkwBwYDVQQHEwAxDzANBgNVBAoTBmpRdWVyeTEeMBwGA1UE\nCxMVQ2VydGlmaWNhdGUgQXV0aG9yaXR5MRMwEQYDVQQDEwpqcXVlcnkuY29tMB4X\nDTIzMDgzMTA1MTE1NVoXDTI0MDgzMDA1MTE1NVowaTELMAkGA1UEBhMCVVMxCTAH\nBgNVBAgTADEJMAcGA1UEBxMAMQ8wDQYDVQQKEwZqUXVlcnkxHjAcBgNVBAsTFUNl\ncnRpZmljYXRlIEF1dGhvcml0eTETMBEGA1UEAxMKanF1ZXJ5LmNvbTCCASIwDQYJ\nKoZIhvcNAQEBBQADggEPADCCAQoCggEBANVHOADKvSw5nnPpSmLCjt2Z/sJFuCyy\nJObWXfmK33pz3Ei6gcJOkh+AePXG8fAhdHuuNpShCEbybB7wYu29WHXv+H85nilr\nBJp8RH0PzRR2gEzldj28xPOtEgLZ6BY/99NCPcQWezF+aKX/26bf8XZJNGRZTKkF\nh3Jwapyix6JaxKpGDYjDaGATlmxj5RfNJljg2iIun2kzsDstj5gJ3MkLIHI1ARA9\nJWbvEQRCm/eTuH5S9fH8azch7hyQb7LKUvWV3GPRl3L9miL5Nei9EyeW882yeTue\nDDkjSkp531yHGpb0/7pK9Ag2OmfEnudQPAhLYGx29PVT43CtnJfi1bsCAwEAAaMh\nMB8wHQYDVR0OBBYEFCV2J+uT0KLCls9pZN8+CwvwsUkWMA0GCSqGSIb3DQEBCwUA\nA4IBAQCDSper8tdIVxWDMq16OT+sz2t63DlJ9/ryZV1Zk4Ti3196JhLxcZFkEq90\nEsgFqu2tHzw6fhJ1Dy1+MNxycyyAKq8rd/x+2H8iNXB6+jb/ojIR1mF+33HCWD4d\nzJJWTUKD3QSZx5K/knplY1VpAn+jlPYZG07zvLesxflTL3DmoUZs6slhOyTpE7x7\nkpnjY32VVXES+MuAAcHbdLGbPj16zdeTGtA3HKRy6M/vBYd7Pusk/xzTBKn+qFOz\nZhA1wBzU3mLKYS55AsGHc+W1dCGQCKfFscWdNWTThbc+tKz8uXgI7f9M42hTyY1J\nZcVtjZV52du9xuQumeHDU0QcstV7\n-----END CERTIFICATE-----\n"], "dhparams": {"prime": "ffffffffffffffffc90fdaa22168c234c4c6628b80dc1cd129024e088a67cc74020bbea63b139b22514a08798e3404ddef9519b3cd3a431b302b0a6df25f14374fe1356d6d51c245e485b576625e7ec6f44c42e9a637ed6b0bff5cb6f406b7edee386bfb5a899fa5ae9f24117c4b1fe649286651ece65381ffffffffffffffff", "public_key": "800138f710c7a5edecb2d226e4bcd2299c462dae9589f0f00544ea61a1cd2a95e45cf079384497618d1545e952284a4e1e2d856a607a8d5564052022b11b700de2e55034b1115d7012befbe44c0a8b6c49d363a72d5a205ad71e1b3e7b976eac7e84ecc87306af26e4cd2cb10e9ceb4563313aa6d2bc5e78a870e34c4b408b46", "bits": 1024, "generator": 2, "fingerprint": "RFC2409/Oakley Group 2"}, "versions": ["-TLSv1", "-SSLv2", "-SSLv3", "-TLSv1.1", "TLSv1.2", "TLSv1.3"], "acceptable_cas": [], "tlsext": [{"id": 43, "name": "supported_versions"}, {"id": 51, "name": "key_share"}, {"id": 10, "name": "supported_groups"}], "ja3s": "f03a69cfa3944d6d51bc52febd87a1a8", "cert": {"sig_alg": "sha256WithRSAEncryption", "issued": "20230831051155Z", "expires": "20240830051155Z", "expired": false, "version": 2, "extensions": [{"data": "\\x04\\x14%v\\'\\xeb\\x93\\xd0\\xa2\\xc2\\x96\\xcfid\\xdf>\\x0b\\x0b\\xf0\\xb1I\\x16", "name": "subjectKeyIdentifier"}], "fingerprint": {"sha256": "b89430f6b35876decc5967e3e82aaa67c3011cc49d1d1af76279f2fa6200fdb6", "sha1": "f0b7de8f970df0573957edc03a61268c405db6ea"}, "serial": 1078503354, "subject": {"C": "US", "CN": "jquery.com", "L": "", "O": "jQuery", "ST": "", "OU": "Certificate Authority"}, "pubkey": {"type": "rsa", "bits": 2048}, "issuer": {"C": "US", "CN": "jquery.com", "L": "", "O": "jQuery", "ST": "", "OU": "Certificate Authority"}}, "cipher": {"version": "TLSv1.3", "bits": 256, "name": "TLS_AES_256_GCM_SHA384"}, "trust": {"revoked": false, "browser": null}, "handshake_states": ["before SSL initialization", "SSLv3/TLS write client hello", "SSLv3/TLS read server hello", "TLSv1.3 read encrypted extensions", "SSLv3/TLS read server certificate", "TLSv1.3 read server certificate verify", "SSLv3/TLS read finished", "SSLv3/TLS write change cipher spec", "SSLv3/TLS write finished", "SSL negotiation finished successfully"], "alpn": [], "ocsp": {}}, "hostnames": [], "org": "Tencent cloud computing (Beijing) Co., Ltd.", "data": "HTTP/1.1 404 Not Found\r\nDate: Thu, 31 Aug 2023 19:45:51 GMT\r\nServer: Apache\r\nContent-Length: 0\r\nKeep-Alive: timeout=10, max=100\r\nConnection: Keep-Alive\r\nContent-Type: text/plain\r\n\r\n\nCobalt Strike Beacon:\n  x86:\n    beacon_type: HTTPS\n    dns-beacon.strategy_fail_seconds: -1\n    dns-beacon.strategy_fail_x: -1\n    dns-beacon.strategy_rotate_seconds: -1\n    http-get.client:\n      Accept: text/html,application/xhtml+xml,application/xml;q=0.9,*/*;q=0.8\n      Referer: http://code.jquery.com/\n      Accept-Encoding: gzip, deflate\n      __cfduid=\n      Cookie\n    http-get.uri: 110.40.135.135,/jquery-3.3.1.min.js\n    http-get.verb: GET\n    http-post.client:\n      Accept: text/html,application/xhtml+xml,application/xml;q=0.9,*/*;q=0.8\n      Referer: http://code.jquery.com/\n      Accept-Encoding: gzip, deflate\n      __cfduid\n    http-post.uri: /jquery-3.3.2.min.js\n    http-post.verb: POST\n    jitter: 35\n    maxgetsize: 1403644\n    port: 443\n    post-ex.spawnto_x64: %windir%\\sysnative\\dllhost.exe\n    post-ex.spawnto_x86: %windir%\\syswow64\\dllhost.exe\n    process-inject.allocator: 1\n    process-inject.execute:\n      ntdll:RtlUserThreadStart\n      CreateThread\n      NtQueueApcThread-s\n      CreateRemoteThread\n      RtlCreateUserThread\n    process-inject.min_alloc: 17500\n    process-inject.startrwx: 4\n    process-inject.stub: b50b86d735412685eb6044ad8d01781c\n    process-inject.userwx: 32\n    proxy.behavior: 2 (Use IE settings)\n    server.publickey_md5: 29d65948df40e6584707a4628514e5e5\n    sleeptime: 5000\n    stage.cleanup: 1\n    useragent_header: Mozilla/5.0 (Windows NT 10.0; Win64; x64) AppleWebKit/537.36 (KHTML, like Gecko) Chrome/110.0.0.0 Safari/537.36\n    uses_cookies: 1\n    watermark: 391144938\n  x64:\n    beacon_type: HTTPS\n    dns-beacon.strategy_fail_seconds: -1\n    dns-beacon.strategy_fail_x: -1\n    dns-beacon.strategy_rotate_seconds: -1\n    http-get.client:\n      Accept: text/html,application/xhtml+xml,application/xml;q=0.9,*/*;q=0.8\n      Referer: http://code.jquery.com/\n      Accept-Encoding: gzip, deflate\n      __cfduid=\n      Cookie\n    http-get.uri: 110.40.135.135,/jquery-3.3.1.min.js\n    http-get.verb: GET\n    http-post.client:\n      Accept: text/html,application/xhtml+xml,application/xml;q=0.9,*/*;q=0.8\n      Referer: http://code.jquery.com/\n      Accept-Encoding: gzip, deflate\n      __cfduid\n    http-post.uri: /jquery-3.3.2.min.js\n    http-post.verb: POST\n    jitter: 35\n    maxgetsize: 1403644\n    port: 443\n    post-ex.spawnto_x64: %windir%\\sysnative\\dllhost.exe\n    post-ex.spawnto_x86: %windir%\\syswow64\\dllhost.exe\n    process-inject.allocator: 1\n    process-inject.execute:\n      ntdll:RtlUserThreadStart\n      CreateThread\n      NtQueueApcThread-s\n      CreateRemoteThread\n      RtlCreateUserThread\n    process-inject.min_alloc: 17500\n    process-inject.startrwx: 4\n    process-inject.stub: b50b86d735412685eb6044ad8d01781c\n    process-inject.userwx: 32\n    proxy.behavior: 2 (Use IE settings)\n    server.publickey_md5: 29d65948df40e6584707a4628514e5e5\n    sleeptime: 5000\n    stage.cleanup: 1\n    useragent_header: Mozilla/5.0 (Windows NT 10.0; Win64; x64) AppleWebKit/537.36 (KHTML, like Gecko) Chrome/110.0.0.0 Safari/537.36\n    uses_cookies: 1\n    watermark: 391144938\n", "asn": "AS45090", "cpe23": ["cpe:2.3:a:helpsystems:cobalt_strike"], "isp": "Shenzhen Tencent Computer Systems Company Limited", "cpe": ["cpe:/a:helpsystems:cobalt_strike"], "domains": [], "ip_str": "110.40.135.135", "os": null, "_shodan": {"region": "na", "ptr": true, "module": "https", "id": "27954d9d-6f3f-4b2a-983f-64dc78f1b5b0", "options": {}, "crawler": "21255b11b05f5ce2a4cf82d3f9ebb017a5a1fdd1"}, "opts": {"vulns": [], "heartbleed": "2023/08/31 19:46:25 110.40.135.135:443 - SAFE\n"}}
{"cobalt_strike_beacon": {"x86": {"beacon_type": "HTTP", "jitter": 39, "dns-beacon.strategy_rotate_seconds": -1, "useragent_header": "Mozilla/5.0 (Linux; Android 8.0.0; SM-G960F Build/R16NW) AppleWebKit/537.36 (KHTML, like Gecko) Chrome/62.0.3202", "http-post.client": ["Host: netdevstudio.com", "Connection: close", "Content-Type: text/plain", "__session__id=", "Cookie"], "maxgetsize": 2797971, "process-inject.min_alloc": 18586, "post-ex.spawnto_x86": "%windir%\\syswow64\\runonce.exe", "port": 80, "sleeptime": 55120, "uses_cookies": 1, "proxy.behavior": "2 (Use IE settings)", "process-inject.execute": ["CreateThread", "RtlCreateUserThread", "CreateRemoteThread"], "process-inject.startrwx": 4, "post-ex.spawnto_x64": "%windir%\\sysnative\\runonce.exe", "process-inject.stub": "c54eed2fbdc9655c0c13550f04c72c28", "http-get.uri": "netdevstudio.com,/get.css", "watermark": 674054486, "dns-beacon.strategy_fail_seconds": -1, "server.publickey_md5": "c5ad03e8e566887b3f0c91f7fbfc0eab", "dns-beacon.strategy_fail_x": -1, "stage.cleanup": 1, "http-post.verb": "POST", "http-post.uri": "/rs", "process-inject.userwx": 32, "http-get.verb": "GET", "http-get.client": ["Host: netdevstudio.com", "Connection: close", "Accept-Language: en-US", "wordpress_ed1f617bbd6c004cc09e046f3c1b7148=", "Cookie"]}, "x64": {"beacon_type": "HTTP", "jitter": 39, "dns-beacon.strategy_rotate_seconds": -1, "useragent_header": "Mozilla/5.0 (Linux; Android 8.0.0; SM-G960F Build/R16NW) AppleWebKit/537.36 (KHTML, like Gecko) Chrome/62.0.3202", "http-post.client": ["Host: netdevstudio.com", "Connection: close", "Content-Type: text/plain", "__session__id=", "Cookie"], "maxgetsize": 2797971, "process-inject.min_alloc": 18586, "post-ex.spawnto_x86": "%windir%\\syswow64\\runonce.exe", "port": 80, "sleeptime": 55120, "uses_cookies": 1, "proxy.behavior": "2 (Use IE settings)", "process-inject.execute": ["CreateThread", "RtlCreateUserThread", "CreateRemoteThread"], "process-inject.startrwx": 4, "post-ex.spawnto_x64": "%windir%\\sysnative\\runonce.exe", "process-inject.stub": "c54eed2fbdc9655c0c13550f04c72c28", "http-get.uri": "netdevstudio.com,/es.css", "watermark": 674054486, "dns-beacon.strategy_fail_seconds": -1, "server.publickey_md5": "c5ad03e8e566887b3f0c91f7fbfc0eab", "dns-beacon.strategy_fail_x": -1, "stage.cleanup": 1, "http-post.verb": "POST", "http-post.uri": "/rs", "process-inject.userwx": 32, "http-get.verb": "GET", "http-get.client": ["Host: netdevstudio.com", "Connection: close", "Accept-Language: en-US", "wordpress_ed1f617bbd6c004cc09e046f3c1b7148=", "Cookie"]}}, "ip": 794265008, "http": {"status": 404, "robots_hash": null, "redirects": [], "securitytxt": null, "title": null, "sitemap_hash": null, "robots": null, "server": "Pagely Gateway/1.5.1", "headers_hash": 11853219, "host": "47.87.133.176", "html": "", "location": "/", "html_hash": 0, "sitemap": null, "securitytxt_hash": null}, "port": 80, "transport": "tcp", "cloud": {"region": null, "service": null, "provider": "Alibaba Cloud"}, "location": {"city": "Los Angeles", "region_code": "CA", "area_code": null, "longitude": -118.24368, "latitude": 34.05223, "country_code": "US", "country_name": "United States"}, "product": "Cobalt Strike Beacon", "hash": 232592555, "tags": ["cloud"], "timestamp": "2023-08-31T13:51:35.921994", "hostnames": [], "org": "Zenlayer Inc", "data": "HTTP/1.1 404 Not Found\r\nDate: Thu, 31 Aug 2023 13:51:35 GMT\r\nContent-Type: text/plain\r\nContent-Length: 0\r\nServer: Pagely Gateway/1.5.1\r\n\r\n\nCobalt Strike Beacon:\n  x86:\n    beacon_type: HTTP\n    dns-beacon.strategy_fail_seconds: -1\n    dns-beacon.strategy_fail_x: -1\n    dns-beacon.strategy_rotate_seconds: -1\n    http-get.client:\n      Host: netdevstudio.com\n      Connection: close\n      Accept-Language: en-US\n      wordpress_ed1f617bbd6c004cc09e046f3c1b7148=\n      Cookie\n    http-get.uri: netdevstudio.com,/get.css\n    http-get.verb: GET\n    http-post.client:\n      Host: netdevstudio.com\n      Connection: close\n      Content-Type: text/plain\n      __session__id=\n      Cookie\n    http-post.uri: /rs\n    http-post.verb: POST\n    jitter: 39\n    maxgetsize: 2797971\n    port: 80\n    post-ex.spawnto_x64: %windir%\\sysnative\\runonce.exe\n    post-ex.spawnto_x86: %windir%\\syswow64\\runonce.exe\n    process-inject.execute:\n      CreateThread\n      RtlCreateUserThread\n      CreateRemoteThread\n    process-inject.min_alloc: 18586\n    process-inject.startrwx: 4\n    process-inject.stub: c54eed2fbdc9655c0c13550f04c72c28\n    process-inject.userwx: 32\n    proxy.behavior: 2 (Use IE settings)\n    server.publickey_md5: c5ad03e8e566887b3f0c91f7fbfc0eab\n    sleeptime: 55120\n    stage.cleanup: 1\n    useragent_header: Mozilla/5.0 (Linux; Android 8.0.0; SM-G960F Build/R16NW) AppleWebKit/537.36 (KHTML, like Gecko) Chrome/62.0.3202\n    uses_cookies: 1\n    watermark: 674054486\n  x64:\n    beacon_type: HTTP\n    dns-beacon.strategy_fail_seconds: -1\n    dns-beacon.strategy_fail_x: -1\n    dns-beacon.strategy_rotate_seconds: -1\n    http-get.client:\n      Host: netdevstudio.com\n      Connection: close\n      Accept-Language: en-US\n      wordpress_ed1f617bbd6c004cc09e046f3c1b7148=\n      Cookie\n    http-get.uri: netdevstudio.com,/es.css\n    http-get.verb: GET\n    http-post.client:\n      Host: netdevstudio.com\n      Connection: close\n      Content-Type: text/plain\n      __session__id=\n      Cookie\n    http-post.uri: /rs\n    http-post.verb: POST\n    jitter: 39\n    maxgetsize: 2797971\n    port: 80\n    post-ex.spawnto_x64: %windir%\\sysnative\\runonce.exe\n    post-ex.spawnto_x86: %windir%\\syswow64\\runonce.exe\n    process-inject.execute:\n      CreateThread\n      RtlCreateUserThread\n      CreateRemoteThread\n    process-inject.min_alloc: 18586\n    process-inject.startrwx: 4\n    process-inject.stub: c54eed2fbdc9655c0c13550f04c72c28\n    process-inject.userwx: 32\n    proxy.behavior: 2 (Use IE settings)\n    server.publickey_md5: c5ad03e8e566887b3f0c91f7fbfc0eab\n    sleeptime: 55120\n    stage.cleanup: 1\n    useragent_header: Mozilla/5.0 (Linux; Android 8.0.0; SM-G960F Build/R16NW) AppleWebKit/537.36 (KHTML, like Gecko) Chrome/62.0.3202\n    uses_cookies: 1\n    watermark: 674054486\n", "asn": "AS8100", "cpe23": ["cpe:2.3:a:helpsystems:cobalt_strike"], "isp": "QuadraNet Enterprises LLC", "cpe": ["cpe:/a:helpsystems:cobalt_strike"], "domains": [], "ip_str": "47.87.133.176", "os": null, "_shodan": {"region": "na", "ptr": true, "module": "http", "id": "55dd3ba1-19cf-4a49-85d1-d3c495240cbe", "options": {}, "crawler": "21255b11b05f5ce2a4cf82d3f9ebb017a5a1fdd1"}, "opts": {}}
{"hash": 1966163451, "cobalt_strike_beacon": {"x86": {"beacon_type": "HTTP", "dns-beacon.strategy_rotate_seconds": -1, "useragent_header": "Mozilla/5.0 (compatible; MSIE 9.0; Windows NT 6.0; Trident/5.0)", "http-post.client": ["Content-Type: application/octet-stream", "id"], "maxgetsize": 1048576, "post-ex.spawnto_x86": "%windir%\\syswow64\\rundll32.exe", "port": 80, "sleeptime": 60000, "uses_cookies": 1, "proxy.behavior": "2 (Use IE settings)", "process-inject.execute": ["CreateThread", "SetThreadContext", "CreateRemoteThread", "RtlCreateUserThread"], "process-inject.startrwx": 64, "post-ex.spawnto_x64": "%windir%\\sysnative\\rundll32.exe", "process-inject.stub": "e43a1b63f09794f74d90a9889f7acb77", "http-get.uri": "47.109.19.188,/dpixel", "watermark": 987654321, "dns-beacon.strategy_fail_seconds": -1, "process-inject.userwx": 64, "dns-beacon.strategy_fail_x": -1, "http-post.verb": "POST", "http-post.uri": "/submit.php", "server.publickey_md5": "95baf99d16ba4230d3ff1751040df2db", "http-get.verb": "GET", "http-get.client": ["Cookie"]}, "x64": {"beacon_type": "HTTP", "dns-beacon.strategy_rotate_seconds": -1, "useragent_header": "Mozilla/5.0 (compatible; MSIE 9.0; Windows NT 6.1; WOW64; Trident/5.0; MANM)", "http-post.client": ["Content-Type: application/octet-stream", "id"], "maxgetsize": 1048576, "post-ex.spawnto_x86": "%windir%\\syswow64\\rundll32.exe", "port": 80, "sleeptime": 60000, "uses_cookies": 1, "proxy.behavior": "2 (Use IE settings)", "process-inject.execute": ["CreateThread", "SetThreadContext", "CreateRemoteThread", "RtlCreateUserThread"], "process-inject.startrwx": 64, "post-ex.spawnto_x64": "%windir%\\sysnative\\rundll32.exe", "process-inject.stub": "e43a1b63f09794f74d90a9889f7acb77", "http-get.uri": "47.109.19.188,/visit.js", "watermark": 987654321, "dns-beacon.strategy_fail_seconds": -1, "process-inject.userwx": 64, "dns-beacon.strategy_fail_x": -1, "http-post.verb": "POST", "http-post.uri": "/submit.php", "server.publickey_md5": "95baf99d16ba4230d3ff1751040df2db", "http-get.verb": "GET", "http-get.client": ["Cookie"]}}, "product": "Cobalt Strike Beacon", "http": {"status": 404, "robots_hash": null, "redirects": [], "securitytxt": null, "title": null, "sitemap_hash": null, "robots": null, "server": null, "headers_hash": 2129120964, "host": "47.109.19.188", "html": "", "location": "/", "html_hash": 0, "sitemap": null, "securitytxt_hash": null}, "os": null, "timestamp": "2023-08-31T13:38:30.897567", "isp": "Hangzhou Alibaba Advertising Co.,Ltd.", "transport": "tcp", "_shodan": {"region": "eu", "ptr": true, "module": "http", "id": "8d98931b-d5d3-4291-92f8-cac74257e9b7", "options": {}, "crawler": "487814a778c983e2dcef234806292d88c5cbf3ec"}, "asn": "AS37963", "hostnames": [], "location": {"city": "Chengdu", "region_code": "SC", "area_code": null, "longitude": 104.06667, "latitude": 30.66667, "country_code": "CN", "country_name": "China"}, "ip": 795677628, "domains": [], "org": "Aliyun Computing Co., LTD", "data": "HTTP/1.1 404 Not Found\r\nDate: Thu, 31 Aug 2023 13:38:30 GMT\r\nContent-Type: text/plain\r\nContent-Length: 0\r\n\r\n\nCobalt Strike Beacon:\n  x86:\n    beacon_type: HTTP\n    dns-beacon.strategy_fail_seconds: -1\n    dns-beacon.strategy_fail_x: -1\n    dns-beacon.strategy_rotate_seconds: -1\n    http-get.client:\n      Cookie\n    http-get.uri: 47.109.19.188,/dpixel\n    http-get.verb: GET\n    http-post.client:\n      Content-Type: application/octet-stream\n      id\n    http-post.uri: /submit.php\n    http-post.verb: POST\n    maxgetsize: 1048576\n    port: 80\n    post-ex.spawnto_x64: %windir%\\sysnative\\rundll32.exe\n    post-ex.spawnto_x86: %windir%\\syswow64\\rundll32.exe\n    process-inject.execute:\n      CreateThread\n      SetThreadContext\n      CreateRemoteThread\n      RtlCreateUserThread\n    process-inject.startrwx: 64\n    process-inject.stub: e43a1b63f09794f74d90a9889f7acb77\n    process-inject.userwx: 64\n    proxy.behavior: 2 (Use IE settings)\n    server.publickey_md5: 95baf99d16ba4230d3ff1751040df2db\n    sleeptime: 60000\n    useragent_header: Mozilla/5.0 (compatible; MSIE 9.0; Windows NT 6.0; Trident/5.0)\n    uses_cookies: 1\n    watermark: 987654321\n  x64:\n    beacon_type: HTTP\n    dns-beacon.strategy_fail_seconds: -1\n    dns-beacon.strategy_fail_x: -1\n    dns-beacon.strategy_rotate_seconds: -1\n    http-get.client:\n      Cookie\n    http-get.uri: 47.109.19.188,/visit.js\n    http-get.verb: GET\n    http-post.client:\n      Content-Type: application/octet-stream\n      id\n    http-post.uri: /submit.php\n    http-post.verb: POST\n    maxgetsize: 1048576\n    port: 80\n    post-ex.spawnto_x64: %windir%\\sysnative\\rundll32.exe\n    post-ex.spawnto_x86: %windir%\\syswow64\\rundll32.exe\n    process-inject.execute:\n      CreateThread\n      SetThreadContext\n      CreateRemoteThread\n      RtlCreateUserThread\n    process-inject.startrwx: 64\n    process-inject.stub: e43a1b63f09794f74d90a9889f7acb77\n    process-inject.userwx: 64\n    proxy.behavior: 2 (Use IE settings)\n    server.publickey_md5: 95baf99d16ba4230d3ff1751040df2db\n    sleeptime: 60000\n    useragent_header: Mozilla/5.0 (compatible; MSIE 9.0; Windows NT 6.1; WOW64; Trident/5.0; MANM)\n    uses_cookies: 1\n    watermark: 987654321\n", "port": 80, "opts": {}, "ip_str": "47.109.19.188"}
{"ip": 1848162551, "http": {"status": 404, "robots_hash": null, "redirects": [], "securitytxt": null, "title": null, "sitemap_hash": null, "robots": null, "server": null, "headers_hash": 2129120964, "host": "110.40.184.247", "html": "", "location": "/", "html_hash": 0, "sitemap": null, "securitytxt_hash": null}, "port": 443, "transport": "tcp", "location": {"city": "Shanghai", "region_code": "SH", "area_code": null, "longitude": 121.45806, "latitude": 31.22222, "country_code": "CN", "country_name": "China"}, "product": "Cobalt Strike Beacon", "hash": -106536195, "tags": ["self-signed"], "timestamp": "2023-08-31T01:47:48.907597", "ssl": {"chain_sha256": ["87f2085c32b6a2cc709b365f55873e207a9caa10bffecf2fd16d3cf9d94d390c"], "jarm": "07d14d16d21d21d00042d41d00041d47e4e0ae17960b2a5b4fd6107fbb0926", "chain": ["-----BEGIN CERTIFICATE-----\nMIIDIzCCAgugAwIBAgIECLsA7jANBgkqhkiG9w0BAQsFADBCMQkwBwYDVQQGEwAx\nCTAHBgNVBAgTADEJMAcGA1UEBxMAMQkwBwYDVQQKEwAxCTAHBgNVBAsTADEJMAcG\nA1UEAxMAMB4XDTE1MDUyMDE4MjYyNFoXDTI1MDUxNzE4MjYyNFowQjEJMAcGA1UE\nBhMAMQkwBwYDVQQIEwAxCTAHBgNVBAcTADEJMAcGA1UEChMAMQkwBwYDVQQLEwAx\nCTAHBgNVBAMTADCCASIwDQYJKoZIhvcNAQEBBQADggEPADCCAQoCggEBAJjXGpNx\njm97YowJUxMyM/QBjGTnyUqMXt1IsXArVdop3F/fGdhsmWkExTt8AfjWm9TL2I3K\nCVKqBhQ9U8+W+l3JAPNaqLnOqRSfeQ+SQ0tmLuVn1AVQt1RKYZGo+o70G/yAXBNw\nCQ3mUisLe6Ln926E3seZM6gb8HesF/w+2sCcQ2UaqLY3hKVIDYvlenNaNMxtaw+8\nA/3udT+pIX1JyrlIlt0SDg5Ya2opwYTFJM64KbuyDKkK213A5Sz00Rh13PVRKWlp\nfVtgoh9BNupzJOG/GE/x0XmXCYAOIGrm8uujAtUWJ5nkbaczf2ldnITJBw+3iQrt\nE1LEM8aUJeKRCVkCAwEAAaMhMB8wHQYDVR0OBBYEFHNrXtvPyRkdW9AfjOOrVjgY\nnwJPMA0GCSqGSIb3DQEBCwUAA4IBAQBU9S+o9YRFBTzcCeZ4phipmwJ9PsIFKoid\ngkTekbt3EzyL+Q+nySQ/Gn4ZXdliFYxKNcRmxbSWCa9jX6qJb6t7gcLBP8Hp7kWL\nsNdbk19+iSDphVfO6UdL6ZVIbIy0vNO0/LgEKVi7tzE84elcaS45ZSPY+HnySF2s\nP3SF0n9iF/bWdzYOjLcPpgavsT66KLrileXkYjCWFOXufnZgpf11pGd3wTJEIenS\nabc90LQ4rAvBJPicY/AfhIth/g4GiDG+M1DmzlV+1F0nNr3KuNGjeghLVegKoRq/\nb5PF+0kpSK7HUwIdrgZsqz1ORsMToEyv8LvxIyL0DTCLBJSHmgJy\n-----END CERTIFICATE-----\n"], "dhparams": {"prime": "ffffffffffffffffc90fdaa22168c234c4c6628b80dc1cd129024e088a67cc74020bbea63b139b22514a08798e3404ddef9519b3cd3a431b302b0a6df25f14374fe1356d6d51c245e485b576625e7ec6f44c42e9a637ed6b0bff5cb6f406b7edee386bfb5a899fa5ae9f24117c4b1fe649286651ece65381ffffffffffffffff", "public_key": "f2fc6fb2f435ee3cb104efc8e6851a8e9eeb46543371cb7aeafe092ab51da27f53269b300ed79602289fb3dbe212e35e9c0d52b706bc1b2e681d49d339f82cd64fa7f8c52a2dfc21dd65c5d71874dd17df3317b33f2a5ff90002ff7d3c7b37b51475aa2dc0b75e6e4134d62b1d15674f1548a890f62a8877ed1604fcc0e4a644", "bits": 1024, "generator": 2, "fingerprint": "RFC2409/Oakley Group 2"}, "versions": ["-TLSv1", "-SSLv2", "-SSLv3", "-TLSv1.1", "TLSv1.2", "TLSv1.3"], "acceptable_cas": [], "tlsext": [{"id": 43, "name": "supported_versions"}, {"id": 44, "name": "unknown"}, {"id": 51, "name": "key_share"}, {"id": 43, "name": "supported_versions"}, {"id": 51, "name": "key_share"}, {"id": 10, "name": "supported_groups"}], "ja3s": "fef5599f0a3662839aeb1f3c854eba06", "cert": {"sig_alg": "sha256WithRSAEncryption", "issued": "20150520182624Z", "expires": "20250517182624Z", "expired": false, "version": 2, "extensions": [{"data": "\\x04\\x14sk^\\xdb\\xcf\\xc9\\x19\\x1d[\\xd0\\x1f\\x8c\\xe3\\xabV8\\x18\\x9f\\x02O", "name": "subjectKeyIdentifier"}], "fingerprint": {"sha256": "87f2085c32b6a2cc709b365f55873e207a9caa10bffecf2fd16d3cf9d94d390c", "sha1": "6ece5ece4192683d2d84e25b0ba7e04f9cb7eb7c"}, "serial": 146473198, "subject": {"C": "", "CN": "", "L": "", "O": "", "ST": "", "OU": ""}, "pubkey": {"type": "rsa", "bits": 2048}, "issuer": {"C": "", "CN": "", "L": "", "O": "", "ST": "", "OU": ""}}, "cipher": {"version": "TLSv1.3", "bits": 256, "name": "TLS_AES_256_GCM_SHA384"}, "trust": {"revoked": false, "browser": null}, "handshake_states": ["before SSL initialization", "SSLv3/TLS write client hello", "SSLv3/TLS read server hello", "SSLv3/TLS write change cipher spec", "SSLv3/TLS write client hello", "SSLv3/TLS read server hello", "TLSv1.3 read encrypted extensions", "SSLv3/TLS read server certificate", "TLSv1.3 read server certificate verify", "SSLv3/TLS read finished", "SSLv3/TLS write finished", "SSL negotiation finished successfully"], "alpn": [], "ocsp": {}}, "hostnames": [], "org": "Tencent cloud computing (Beijing) Co., Ltd.", "data": "HTTP/1.1 404 Not Found\r\nDate: Thu, 31 Aug 2023 01:47:48 GMT\r\nContent-Type: text/plain\r\nContent-Length: 0\r\n\r\n", "asn": "AS45090", "cpe23": ["cpe:2.3:a:helpsystems:cobalt_strike"], "isp": "Shenzhen Tencent Computer Systems Company Limited", "cpe": ["cpe:/a:helpsystems:cobalt_strike"], "domains": [], "ip_str": "110.40.184.247", "os": null, "_shodan": {"region": "na", "ptr": true, "module": "https", "id": "c39dd149-9d3b-4559-afec-f75f28b85c1b", "options": {}, "crawler": "21255b11b05f5ce2a4cf82d3f9ebb017a5a1fdd1"}, "opts": {"vulns": [], "heartbleed": "2023/08/31 01:48:21 110.40.184.247:443 - SAFE\n"}}
{"hash": 396507045, "cobalt_strike_beacon": {"x86": {"beacon_type": "HTTP", "http-post.uri": "/submit.php", "dns-beacon.maxdns": 255, "sleeptime": 60000, "useragent_header": "Mozilla/5.0 (compatible; MSIE 10.0; Windows NT 6.2; WOW64; Trident/6.0; ASU2JS)", "proxy.behavior": "2 (Use IE settings)", "maxgetsize": 1048576, "process-inject.userwx": 64, "process-inject.execute": ["CreateThread", "SetThreadContext", "CreateRemoteThread", "RtlCreateUserThread"], "process-inject.startrwx": 64, "port": 8888, "uses_cookies": 1, "server.publickey_md5": "c13527c58c75c6133849b783828c657b", "post-ex.spawnto_x64": "%windir%\\sysnative\\rundll32.exe", "http-get.verb": "GET", "http-get.client": ["Cookie"], "post-ex.spawnto_x86": "%windir%\\syswow64\\rundll32.exe", "process-inject.stub": "187ab8f98098de95714613f8544c9613", "http-get.uri": "47.110.149.136,/pixel", "http-post.client": ["Content-Type: application/octet-stream", "id"], "http-post.verb": "POST"}, "x64": {"beacon_type": "HTTP", "http-post.uri": "/submit.php", "dns-beacon.maxdns": 255, "sleeptime": 60000, "useragent_header": "Mozilla/5.0 (compatible; MSIE 9.0; Windows NT 6.1; WOW64; Trident/5.0; BOIE9;ENUSSEM)", "proxy.behavior": "2 (Use IE settings)", "maxgetsize": 1048576, "process-inject.userwx": 64, "process-inject.execute": ["CreateThread", "SetThreadContext", "CreateRemoteThread", "RtlCreateUserThread"], "process-inject.startrwx": 64, "port": 8888, "uses_cookies": 1, "server.publickey_md5": "c13527c58c75c6133849b783828c657b", "post-ex.spawnto_x64": "%windir%\\sysnative\\rundll32.exe", "http-get.verb": "GET", "http-get.client": ["Cookie"], "post-ex.spawnto_x86": "%windir%\\syswow64\\rundll32.exe", "process-inject.stub": "187ab8f98098de95714613f8544c9613", "http-get.uri": "47.110.149.136,/push", "http-post.client": ["Content-Type: application/octet-stream", "id"], "http-post.verb": "POST"}}, "product": "Cobalt Strike Beacon", "http": {"status": 404, "robots_hash": null, "redirects": [], "securitytxt": null, "title": null, "sitemap_hash": null, "robots": null, "server": null, "headers_hash": 2129120964, "host": "47.110.149.136", "html": "", "location": "/", "html_hash": 0, "sitemap": null, "securitytxt_hash": null}, "os": null, "timestamp": "2023-08-31T00:54:00.309737", "isp": "Hangzhou Alibaba Advertising Co.,Ltd.", "transport": "tcp", "_shodan": {"region": "eu", "ptr": true, "module": "http-simple-new", "id": "d8ed21e4-437c-4d22-8075-88524aba2366", "options": {}, "crawler": "487814a778c983e2dcef234806292d88c5cbf3ec"}, "asn": "AS37963", "hostnames": [], "location": {"city": "Hangzhou", "region_code": "ZJ", "area_code": null, "longitude": 120.16142, "latitude": 30.29365, "country_code": "CN", "country_name": "China"}, "ip": 795776392, "domains": [], "org": "Aliyun Computing Co., LTD", "data": "HTTP/1.1 404 Not Found\r\nDate: Thu, 31 Aug 2023 00:54:00 GMT\r\nContent-Type: text/plain\r\nContent-Length: 0\r\n\r\n\nCobalt Strike Beacon:\n  x86:\n    beacon_type: HTTP\n    dns-beacon.maxdns: 255\n    http-get.client:\n      Cookie\n    http-get.uri: 47.110.149.136,/pixel\n    http-get.verb: GET\n    http-post.client:\n      Content-Type: application/octet-stream\n      id\n    http-post.uri: /submit.php\n    http-post.verb: POST\n    maxgetsize: 1048576\n    port: 8888\n    post-ex.spawnto_x64: %windir%\\sysnative\\rundll32.exe\n    post-ex.spawnto_x86: %windir%\\syswow64\\rundll32.exe\n    process-inject.execute:\n      CreateThread\n      SetThreadContext\n      CreateRemoteThread\n      RtlCreateUserThread\n    process-inject.startrwx: 64\n    process-inject.stub: 187ab8f98098de95714613f8544c9613\n    process-inject.userwx: 64\n    proxy.behavior: 2 (Use IE settings)\n    server.publickey_md5: c13527c58c75c6133849b783828c657b\n    sleeptime: 60000\n    useragent_header: Mozilla/5.0 (compatible; MSIE 10.0; Windows NT 6.2; WOW64; Trident/6.0; ASU2JS)\n    uses_cookies: 1\n  x64:\n    beacon_type: HTTP\n    dns-beacon.maxdns: 255\n    http-get.client:\n      Cookie\n    http-get.uri: 47.110.149.136,/push\n    http-get.verb: GET\n    http-post.client:\n      Content-Type: application/octet-stream\n      id\n    http-post.uri: /submit.php\n    http-post.verb: POST\n    maxgetsize: 1048576\n    port: 8888\n    post-ex.spawnto_x64: %windir%\\sysnative\\rundll32.exe\n    post-ex.spawnto_x86: %windir%\\syswow64\\rundll32.exe\n    process-inject.execute:\n      CreateThread\n      SetThreadContext\n      CreateRemoteThread\n      RtlCreateUserThread\n    process-inject.startrwx: 64\n    process-inject.stub: 187ab8f98098de95714613f8544c9613\n    process-inject.userwx: 64\n    proxy.behavior: 2 (Use IE settings)\n    server.publickey_md5: c13527c58c75c6133849b783828c657b\n    sleeptime: 60000\n    useragent_header: Mozilla/5.0 (compatible; MSIE 9.0; Windows NT 6.1; WOW64; Trident/5.0; BOIE9;ENUSSEM)\n    uses_cookies: 1\n", "port": 8888, "opts": {}, "ip_str": "47.110.149.136"}
{"hash": -570528930, "cobalt_strike_beacon": {"x86": {"beacon_type": "HTTP", "useragent_header": "Mozilla/5.0 (compatible; MSIE 9.0; Windows NT 6.0; WOW64; Trident/5.0)", "http-post.client": ["Content-Type: application/octet-stream", "id"], "maxgetsize": 1048576, "post-ex.spawnto_x86": "%windir%\\syswow64\\rundll32.exe", "port": 81, "sleeptime": 60000, "uses_cookies": 1, "proxy.behavior": "2 (Use IE settings)", "process-inject.execute": ["CreateThread", "SetThreadContext", "CreateRemoteThread", "RtlCreateUserThread"], "process-inject.startrwx": 64, "post-ex.spawnto_x64": "%windir%\\sysnative\\rundll32.exe", "process-inject.stub": "a56c813864af878a4c10083ca1578e0a", "http-get.uri": "8.136.201.3,/ga.js", "watermark": 305419896, "process-inject.userwx": 64, "http-post.verb": "POST", "http-post.uri": "/submit.php", "dns-beacon.maxdns": 255, "server.publickey_md5": "59c85c77adc8f37bf8d5c5eb5f675bfd", "http-get.verb": "GET", "http-get.client": ["Cookie"]}, "x64": {"beacon_type": "HTTP", "useragent_header": "Mozilla/5.0 (compatible; MSIE 9.0; Windows NT 6.1; WOW64; Trident/5.0; yie9)", "http-post.client": ["Content-Type: application/octet-stream", "id"], "maxgetsize": 1048576, "post-ex.spawnto_x86": "%windir%\\syswow64\\rundll32.exe", "port": 81, "sleeptime": 60000, "uses_cookies": 1, "proxy.behavior": "2 (Use IE settings)", "process-inject.execute": ["CreateThread", "SetThreadContext", "CreateRemoteThread", "RtlCreateUserThread"], "process-inject.startrwx": 64, "post-ex.spawnto_x64": "%windir%\\sysnative\\rundll32.exe", "process-inject.stub": "a56c813864af878a4c10083ca1578e0a", "http-get.uri": "8.136.201.3,/ga.js", "watermark": 305419896, "process-inject.userwx": 64, "http-post.verb": "POST", "http-post.uri": "/submit.php", "dns-beacon.maxdns": 255, "server.publickey_md5": "59c85c77adc8f37bf8d5c5eb5f675bfd", "http-get.verb": "GET", "http-get.client": ["Cookie"]}}, "product": "Cobalt Strike Beacon", "http": {"status": 404, "robots_hash": null, "redirects": [], "securitytxt": null, "title": null, "sitemap_hash": null, "robots": null, "server": null, "headers_hash": 2129120964, "host": "8.136.201.3", "html": "", "location": "/", "html_hash": 0, "sitemap": null, "securitytxt_hash": null}, "os": null, "tags": ["cloud"], "timestamp": "2023-08-30T17:56:33.446351", "isp": "Hangzhou Alibaba Advertising Co.,Ltd.", "transport": "tcp", "_shodan": {"region": "eu", "ptr": true, "module": "http-simple-new", "id": "8c5c1b92-bb9c-4312-b29b-6ec40fc710da", "options": {}, "crawler": "487814a778c983e2dcef234806292d88c5cbf3ec"}, "asn": "AS37963", "cloud": {"region": null, "service": null, "provider": "Alibaba Cloud"}, "hostnames": [], "location": {"city": "Hangzhou", "region_code": "ZJ", "area_code": null, "longitude": 120.16142, "latitude": 30.29365, "country_code": "CN", "country_name": "China"}, "ip": 143182083, "domains": [], "org": "Aliyun Computing Co.LTD", "data": "HTTP/1.1 404 Not Found\r\nDate: Wed, 30 Aug 2023 17:56:33 GMT\r\nContent-Type: text/plain\r\nContent-Length: 0\r\n\r\n\nCobalt Strike Beacon:\n  x86:\n    beacon_type: HTTP\n    dns-beacon.maxdns: 255\n    http-get.client:\n      Cookie\n    http-get.uri: 8.136.201.3,/ga.js\n    http-get.verb: GET\n    http-post.client:\n      Content-Type: application/octet-stream\n      id\n    http-post.uri: /submit.php\n    http-post.verb: POST\n    maxgetsize: 1048576\n    port: 81\n    post-ex.spawnto_x64: %windir%\\sysnative\\rundll32.exe\n    post-ex.spawnto_x86: %windir%\\syswow64\\rundll32.exe\n    process-inject.execute:\n      CreateThread\n      SetThreadContext\n      CreateRemoteThread\n      RtlCreateUserThread\n    process-inject.startrwx: 64\n    process-inject.stub: a56c813864af878a4c10083ca1578e0a\n    process-inject.userwx: 64\n    proxy.behavior: 2 (Use IE settings)\n    server.publickey_md5: 59c85c77adc8f37bf8d5c5eb5f675bfd\n    sleeptime: 60000\n    useragent_header: Mozilla/5.0 (compatible; MSIE 9.0; Windows NT 6.0; WOW64; Trident/5.0)\n    uses_cookies: 1\n    watermark: 305419896\n  x64:\n    beacon_type: HTTP\n    dns-beacon.maxdns: 255\n    http-get.client:\n      Cookie\n    http-get.uri: 8.136.201.3,/ga.js\n    http-get.verb: GET\n    http-post.client:\n      Content-Type: application/octet-stream\n      id\n    http-post.uri: /submit.php\n    http-post.verb: POST\n    maxgetsize: 1048576\n    port: 81\n    post-ex.spawnto_x64: %windir%\\sysnative\\rundll32.exe\n    post-ex.spawnto_x86: %windir%\\syswow64\\rundll32.exe\n    process-inject.execute:\n      CreateThread\n      SetThreadContext\n      CreateRemoteThread\n      RtlCreateUserThread\n    process-inject.startrwx: 64\n    process-inject.stub: a56c813864af878a4c10083ca1578e0a\n    process-inject.userwx: 64\n    proxy.behavior: 2 (Use IE settings)\n    server.publickey_md5: 59c85c77adc8f37bf8d5c5eb5f675bfd\n    sleeptime: 60000\n    useragent_header: Mozilla/5.0 (compatible; MSIE 9.0; Windows NT 6.1; WOW64; Trident/5.0; yie9)\n    uses_cookies: 1\n    watermark: 305419896\n", "port": 81, "opts": {}, "ip_str": "8.136.201.3"}
{"cobalt_strike_beacon": {"x86": {"beacon_type": "HTTPS", "http-post.uri": "/submit.php", "dns-beacon.maxdns": 255, "sleeptime": 60000, "useragent_header": "Mozilla/5.0 (compatible; MSIE 9.0; Windows NT 6.1; Win64; x64; Trident/5.0)", "proxy.behavior": "2 (Use IE settings)", "maxgetsize": 1048576, "process-inject.userwx": 64, "process-inject.startrwx": 64, "port": 443, "server.publickey_md5": "ecdee22af5fb97a840f5eefdc8a8d39d", "post-ex.spawnto_x64": "%windir%\\sysnative\\rundll32.exe", "http-get.verb": "GET", "http-get.client": ["Cookie"], "post-ex.spawnto_x86": "%windir%\\syswow64\\rundll32.exe", "http-get.uri": "8.217.147.50,/en_US/all.js", "http-post.client": ["Content-Type: application/octet-stream", "id"], "http-post.verb": "POST"}}, "ip": 148476722, "http": {"status": 404, "robots_hash": null, "redirects": [], "securitytxt": null, "title": null, "sitemap_hash": null, "robots": null, "server": null, "headers_hash": 2129120964, "host": "8.217.147.50", "html": "", "location": "/", "html_hash": 0, "sitemap": null, "securitytxt_hash": null}, "port": 443, "transport": "tcp", "cloud": {"region": null, "service": null, "provider": "Alibaba Cloud"}, "location": {"city": "Hong Kong", "region_code": "", "area_code": null, "longitude": 114.17469, "latitude": 22.27832, "country_code": "HK", "country_name": "Hong Kong"}, "product": "Cobalt Strike Beacon", "hash": -31243565, "tags": ["cloud", "self-signed"], "timestamp": "2023-08-30T14:20:19.135827", "ssl": {"chain_sha256": ["87f2085c32b6a2cc709b365f55873e207a9caa10bffecf2fd16d3cf9d94d390c"], "jarm": "07d14d16d21d21d00042d43d00041de5fb3038104f457d92ba02e9311512c2", "chain": ["-----BEGIN CERTIFICATE-----\nMIIDIzCCAgugAwIBAgIECLsA7jANBgkqhkiG9w0BAQsFADBCMQkwBwYDVQQGEwAx\nCTAHBgNVBAgTADEJMAcGA1UEBxMAMQkwBwYDVQQKEwAxCTAHBgNVBAsTADEJMAcG\nA1UEAxMAMB4XDTE1MDUyMDE4MjYyNFoXDTI1MDUxNzE4MjYyNFowQjEJMAcGA1UE\nBhMAMQkwBwYDVQQIEwAxCTAHBgNVBAcTADEJMAcGA1UEChMAMQkwBwYDVQQLEwAx\nCTAHBgNVBAMTADCCASIwDQYJKoZIhvcNAQEBBQADggEPADCCAQoCggEBAJjXGpNx\njm97YowJUxMyM/QBjGTnyUqMXt1IsXArVdop3F/fGdhsmWkExTt8AfjWm9TL2I3K\nCVKqBhQ9U8+W+l3JAPNaqLnOqRSfeQ+SQ0tmLuVn1AVQt1RKYZGo+o70G/yAXBNw\nCQ3mUisLe6Ln926E3seZM6gb8HesF/w+2sCcQ2UaqLY3hKVIDYvlenNaNMxtaw+8\nA/3udT+pIX1JyrlIlt0SDg5Ya2opwYTFJM64KbuyDKkK213A5Sz00Rh13PVRKWlp\nfVtgoh9BNupzJOG/GE/x0XmXCYAOIGrm8uujAtUWJ5nkbaczf2ldnITJBw+3iQrt\nE1LEM8aUJeKRCVkCAwEAAaMhMB8wHQYDVR0OBBYEFHNrXtvPyRkdW9AfjOOrVjgY\nnwJPMA0GCSqGSIb3DQEBCwUAA4IBAQBU9S+o9YRFBTzcCeZ4phipmwJ9PsIFKoid\ngkTekbt3EzyL+Q+nySQ/Gn4ZXdliFYxKNcRmxbSWCa9jX6qJb6t7gcLBP8Hp7kWL\nsNdbk19+iSDphVfO6UdL6ZVIbIy0vNO0/LgEKVi7tzE84elcaS45ZSPY+HnySF2s\nP3SF0n9iF/bWdzYOjLcPpgavsT66KLrileXkYjCWFOXufnZgpf11pGd3wTJEIenS\nabc90LQ4rAvBJPicY/AfhIth/g4GiDG+M1DmzlV+1F0nNr3KuNGjeghLVegKoRq/\nb5PF+0kpSK7HUwIdrgZsqz1ORsMToEyv8LvxIyL0DTCLBJSHmgJy\n-----END CERTIFICATE-----\n"], "dhparams": {"prime": "ffffffffffffffffc90fdaa22168c234c4c6628b80dc1cd129024e088a67cc74020bbea63b139b22514a08798e3404ddef9519b3cd3a431b302b0a6df25f14374fe1356d6d51c245e485b576625e7ec6f44c42e9a637ed6b0bff5cb6f406b7edee386bfb5a899fa5ae9f24117c4b1fe649286651ece65381ffffffffffffffff", "public_key": "f717a400efccb2b7b091de7b89dccbd4a49378303f63aa8d1baccf9fb6958f25dd0e568a4076c4a5e86b01ecfe748470682fc6fb56753c90c7e9d9aaf1094ad26632ad5ae6ca438279624b7f0052a59b3a13e19d05746084a3ab75a7e7e85c2245688b0430ac78841ae473f6c5c63adb3803b192bb7d2db177a569e126075b94", "bits": 1024, "generator": 2, "fingerprint": "RFC2409/Oakley Group 2"}, "versions": ["-TLSv1", "-SSLv2", "-SSLv3", "-TLSv1.1", "TLSv1.2", "TLSv1.3"], "acceptable_cas": [], "tlsext": [{"id": 43, "name": "supported_versions"}, {"id": 51, "name": "key_share"}, {"id": 10, "name": "supported_groups"}], "ja3s": "f03a69cfa3944d6d51bc52febd87a1a8", "cert": {"sig_alg": "sha256WithRSAEncryption", "issued": "20150520182624Z", "expires": "20250517182624Z", "expired": false, "version": 2, "extensions": [{"data": "\\x04\\x14sk^\\xdb\\xcf\\xc9\\x19\\x1d[\\xd0\\x1f\\x8c\\xe3\\xabV8\\x18\\x9f\\x02O", "name": "subjectKeyIdentifier"}], "fingerprint": {"sha256": "87f2085c32b6a2cc709b365f55873e207a9caa10bffecf2fd16d3cf9d94d390c", "sha1": "6ece5ece4192683d2d84e25b0ba7e04f9cb7eb7c"}, "serial": 146473198, "subject": {"C": "", "CN": "", "L": "", "O": "", "ST": "", "OU": ""}, "pubkey": {"type": "rsa", "bits": 2048}, "issuer": {"C": "", "CN": "", "L": "", "O": "", "ST": "", "OU": ""}}, "cipher": {"version": "TLSv1.3", "bits": 256, "name": "TLS_AES_256_GCM_SHA384"}, "trust": {"revoked": false, "browser": null}, "handshake_states": ["before SSL initialization", "SSLv3/TLS write client hello", "SSLv3/TLS read server hello", "TLSv1.3 read encrypted extensions", "SSLv3/TLS read server certificate", "TLSv1.3 read server certificate verify", "SSLv3/TLS read finished", "SSLv3/TLS write change cipher spec", "SSLv3/TLS write finished", "SSL negotiation finished successfully"], "alpn": [], "ocsp": {}}, "hostnames": [], "org": "Alibaba.com Singapore E-Commerce Private Limited", "data": "HTTP/1.1 404 Not Found\r\nDate: Wed, 30 Aug 2023 14:20:19 GMT\r\nContent-Type: text/plain\r\nContent-Length: 0\r\n\r\n\nCobalt Strike Beacon:\n  x86:\n    beacon_type: HTTPS\n    dns-beacon.maxdns: 255\n    http-get.client:\n      Cookie\n    http-get.uri: 8.217.147.50,/en_US/all.js\n    http-get.verb: GET\n    http-post.client:\n      Content-Type: application/octet-stream\n      id\n    http-post.uri: /submit.php\n    http-post.verb: POST\n    maxgetsize: 1048576\n    port: 443\n    post-ex.spawnto_x64: %windir%\\sysnative\\rundll32.exe\n    post-ex.spawnto_x86: %windir%\\syswow64\\rundll32.exe\n    process-inject.startrwx: 64\n    process-inject.userwx: 64\n    proxy.behavior: 2 (Use IE settings)\n    server.publickey_md5: ecdee22af5fb97a840f5eefdc8a8d39d\n    sleeptime: 60000\n    useragent_header: Mozilla/5.0 (compatible; MSIE 9.0; Windows NT 6.1; Win64; x64; Trident/5.0)\n", "asn": "AS45102", "isp": "Alibaba (US) Technology Co., Ltd.", "domains": [], "ip_str": "8.217.147.50", "os": null, "_shodan": {"region": "eu", "ptr": true, "module": "https", "id": "b757d1b5-6d6c-4c3b-a489-36395386195b", "options": {}, "crawler": "487814a778c983e2dcef234806292d88c5cbf3ec"}, "opts": {"vulns": [], "heartbleed": "2023/08/30 14:20:38 8.217.147.50:443 - SAFE\n"}}
{"hash": 1499713583, "asn": "AS45090", "http": {"status": 404, "robots_hash": null, "redirects": [], "securitytxt": null, "title": null, "sitemap_hash": null, "robots": null, "server": null, "headers_hash": 2129120964, "host": "121.4.154.20", "html": "", "location": "/", "securitytxt_hash": null, "sitemap": null, "html_hash": 0}, "os": null, "timestamp": "2023-08-30T13:49:19.802630", "isp": "Shenzhen Tencent Computer Systems Company Limited", "transport": "tcp", "_shodan": {"region": "na", "crawler": "667c9d6cc4bbbf0594c20c6f1ba56a8147913fd0", "options": {}, "module": "http", "id": "efb7b5e4-0514-44a4-87ff-48a2f6bdd46e"}, "hostnames": [], "location": {"city": "Beijing", "region_code": "BJ", "area_code": null, "longitude": 116.39723, "latitude": 39.9075, "country_code": "CN", "country_name": "China"}, "ip": 2030344724, "domains": [], "org": "Tencent cloud computing (Beijing) Co., Ltd.", "data": "HTTP/1.1 404 Not Found\r\nDate: Wed, 30 Aug 2023 13:49:19 GMT\r\nContent-Type: text/plain\r\nContent-Length: 0\r\n\r\n", "port": 80, "opts": {}, "ip_str": "121.4.154.20"}
{"hash": -629776139, "cobalt_strike_beacon": {"x86": {"beacon_type": "HTTP", "dns-beacon.strategy_rotate_seconds": -1, "useragent_header": "Mozilla/4.0 (compatible; MSIE 8.0; Windows NT 6.0; Trident/4.0)", "http-post.client": ["Content-Type: application/octet-stream", "id"], "maxgetsize": 1048576, "post-ex.spawnto_x86": "%windir%\\syswow64\\rundll32.exe", "port": 60001, "sleeptime": 60000, "uses_cookies": 1, "proxy.behavior": "2 (Use IE settings)", "process-inject.execute": ["CreateThread", "SetThreadContext", "CreateRemoteThread", "RtlCreateUserThread"], "process-inject.startrwx": 64, "post-ex.spawnto_x64": "%windir%\\sysnative\\rundll32.exe", "process-inject.stub": "3168a134f2bc8f773f6274cb54f59efd", "http-get.uri": "47.106.117.218,/cm", "watermark": 987654321, "dns-beacon.strategy_fail_seconds": -1, "process-inject.userwx": 64, "dns-beacon.strategy_fail_x": -1, "http-post.verb": "POST", "http-post.uri": "/submit.php", "server.publickey_md5": "b8bfe705f22fc00db6a79c02a12d0ed2", "http-get.verb": "GET", "http-get.client": ["Cookie"]}, "x64": {"beacon_type": "HTTP", "dns-beacon.strategy_rotate_seconds": -1, "useragent_header": "Mozilla/5.0 (compatible; MSIE 9.0; Windows NT 6.1; WOW64; Trident/5.0; Avant Browser)", "http-post.client": ["Content-Type: application/octet-stream", "id"], "maxgetsize": 1048576, "post-ex.spawnto_x86": "%windir%\\syswow64\\rundll32.exe", "port": 60001, "sleeptime": 60000, "uses_cookies": 1, "proxy.behavior": "2 (Use IE settings)", "process-inject.execute": ["CreateThread", "SetThreadContext", "CreateRemoteThread", "RtlCreateUserThread"], "process-inject.startrwx": 64, "post-ex.spawnto_x64": "%windir%\\sysnative\\rundll32.exe", "process-inject.stub": "3168a134f2bc8f773f6274cb54f59efd", "http-get.uri": "47.106.117.218,/dot.gif", "watermark": 987654321, "dns-beacon.strategy_fail_seconds": -1, "process-inject.userwx": 64, "dns-beacon.strategy_fail_x": -1, "http-post.verb": "POST", "http-post.uri": "/submit.php", "server.publickey_md5": "b8bfe705f22fc00db6a79c02a12d0ed2", "http-get.verb": "GET", "http-get.client": ["Cookie"]}}, "product": "Cobalt Strike Beacon", "http": {"status": 404, "robots_hash": null, "redirects": [], "securitytxt": null, "title": null, "sitemap_hash": null, "robots": null, "server": null, "headers_hash": 2129120964, "host": "47.106.117.218", "html": "", "location": "/", "html_hash": 0, "sitemap": null, "securitytxt_hash": null}, "os": null, "timestamp": "2023-08-30T01:39:00.019263", "isp": "Hangzhou Alibaba Advertising Co.,Ltd.", "transport": "tcp", "_shodan": {"region": "eu", "ptr": true, "module": "http-simple-new", "id": "71ebcacf-1314-4e5c-88bd-aa4217abfe39", "options": {}, "crawler": "bf213bc419cc8491376c12af31e32623c1b6f467"}, "asn": "AS37963", "hostnames": [], "location": {"city": "Shenzhen", "region_code": "ZJ", "area_code": null, "longitude": 121.33971, "latitude": 29.41591, "country_code": "CN", "country_name": "China"}, "ip": 795506138, "domains": [], "org": "Aliyun Computing Co., LTD", "data": "HTTP/1.1 404 Not Found\r\nDate: Wed, 30 Aug 2023 01:38:59 GMT\r\nContent-Type: text/plain\r\nContent-Length: 0\r\n\r\n\nCobalt Strike Beacon:\n  x86:\n    beacon_type: HTTP\n    dns-beacon.strategy_fail_seconds: -1\n    dns-beacon.strategy_fail_x: -1\n    dns-beacon.strategy_rotate_seconds: -1\n    http-get.client:\n      Cookie\n    http-get.uri: 47.106.117.218,/cm\n    http-get.verb: GET\n    http-post.client:\n      Content-Type: application/octet-stream\n      id\n    http-post.uri: /submit.php\n    http-post.verb: POST\n    maxgetsize: 1048576\n    port: 60001\n    post-ex.spawnto_x64: %windir%\\sysnative\\rundll32.exe\n    post-ex.spawnto_x86: %windir%\\syswow64\\rundll32.exe\n    process-inject.execute:\n      CreateThread\n      SetThreadContext\n      CreateRemoteThread\n      RtlCreateUserThread\n    process-inject.startrwx: 64\n    process-inject.stub: 3168a134f2bc8f773f6274cb54f59efd\n    process-inject.userwx: 64\n    proxy.behavior: 2 (Use IE settings)\n    server.publickey_md5: b8bfe705f22fc00db6a79c02a12d0ed2\n    sleeptime: 60000\n    useragent_header: Mozilla/4.0 (compatible; MSIE 8.0; Windows NT 6.0; Trident/4.0)\n    uses_cookies: 1\n    watermark: 987654321\n  x64:\n    beacon_type: HTTP\n    dns-beacon.strategy_fail_seconds: -1\n    dns-beacon.strategy_fail_x: -1\n    dns-beacon.strategy_rotate_seconds: -1\n    http-get.client:\n      Cookie\n    http-get.uri: 47.106.117.218,/dot.gif\n    http-get.verb: GET\n    http-post.client:\n      Content-Type: application/octet-stream\n      id\n    http-post.uri: /submit.php\n    http-post.verb: POST\n    maxgetsize: 1048576\n    port: 60001\n    post-ex.spawnto_x64: %windir%\\sysnative\\rundll32.exe\n    post-ex.spawnto_x86: %windir%\\syswow64\\rundll32.exe\n    process-inject.execute:\n      CreateThread\n      SetThreadContext\n      CreateRemoteThread\n      RtlCreateUserThread\n    process-inject.startrwx: 64\n    process-inject.stub: 3168a134f2bc8f773f6274cb54f59efd\n    process-inject.userwx: 64\n    proxy.behavior: 2 (Use IE settings)\n    server.publickey_md5: b8bfe705f22fc00db6a79c02a12d0ed2\n    sleeptime: 60000\n    useragent_header: Mozilla/5.0 (compatible; MSIE 9.0; Windows NT 6.1; WOW64; Trident/5.0; Avant Browser)\n    uses_cookies: 1\n    watermark: 987654321\n", "port": 60001, "opts": {}, "ip_str": "47.106.117.218"}
{"cobalt_strike_beacon": {"x86": {"beacon_type": "HTTPS", "jitter": 37, "dns-beacon.strategy_rotate_seconds": -1, "useragent_header": "Mozilla/5.0 (X11; U; Linux x86_64; en-us) AppleWebKit/531.2+ (KHTML, like Gecko) Version/5.0 Safari/531.2+", "http-post.client": ["Accept: text/html,application/xhtml+xml,application/xml;", "Host: getbootstrap.com", "Accept-Encoding: gzip, deflate", "Accept-Language: zh-CN,zh;q=0.9", "serve"], "maxgetsize": 1403086, "process-inject.min_alloc": 16700, "post-ex.spawnto_x86": "%windir%\\syswow64\\svchost.exe -k netsvcs", "port": 443, "sleeptime": 10000, "uses_cookies": 1, "proxy.behavior": "2 (Use IE settings)", "process-inject.execute": ["ntdll:RtlUserThreadStart", "CreateThread", "NtQueueApcThread", "CreateRemoteThread", "RtlCreateUserThread"], "process-inject.startrwx": 64, "post-ex.spawnto_x64": "%windir%\\sysnative\\svchost.exe -k netsvcs", "process-inject.stub": "41e6db3cfcfa84be7cac6e42f21a22a8", "http-get.uri": "testwscdn.m.37.com,/dist/css/bootstrap.min.css", "watermark": 391144938, "dns-beacon.strategy_fail_seconds": -1, "host_header": "Host: weixin.zjstv.com\r\n", "process-inject.userwx": 32, "dns-beacon.strategy_fail_x": -1, "stage.cleanup": 1, "http-post.verb": "POST", "http-post.uri": "/dist/js/bootstrap.bundle.min.js", "server.publickey_md5": "cd69e2e76312f963b9a752f3da113883", "process-inject.allocator": 1, "cfg_caution": 1, "http-get.verb": "POST", "http-get.client": ["Accept: text/html,application/xhtml+xml,application/xml;", "Host: getbootstrap.com", "Accept-Encoding: gzip, deflate", "Accept-Language: zh-CN,zh;q=0.9", "__cfduid=", "Cookie"]}, "x64": {"beacon_type": "HTTPS", "jitter": 37, "dns-beacon.strategy_rotate_seconds": -1, "useragent_header": "Mozilla/5.0 (X11; U; Linux x86_64; en-us) AppleWebKit/531.2+ (KHTML, like Gecko) Version/5.0 Safari/531.2+", "http-post.client": ["Accept: text/html,application/xhtml+xml,application/xml;", "Host: getbootstrap.com", "Accept-Encoding: gzip, deflate", "Accept-Language: zh-CN,zh;q=0.9", "serve"], "maxgetsize": 1403086, "process-inject.min_alloc": 16700, "post-ex.spawnto_x86": "%windir%\\syswow64\\svchost.exe -k netsvcs", "port": 443, "sleeptime": 10000, "uses_cookies": 1, "proxy.behavior": "2 (Use IE settings)", "process-inject.execute": ["ntdll:RtlUserThreadStart", "CreateThread", "NtQueueApcThread", "CreateRemoteThread", "RtlCreateUserThread"], "process-inject.startrwx": 64, "post-ex.spawnto_x64": "%windir%\\sysnative\\svchost.exe -k netsvcs", "process-inject.stub": "41e6db3cfcfa84be7cac6e42f21a22a8", "http-get.uri": "testwscdn.m.37.com,/dist/css/bootstrap.min.css", "watermark": 391144938, "dns-beacon.strategy_fail_seconds": -1, "host_header": "Host: weixin.zjstv.com\r\n", "process-inject.userwx": 32, "dns-beacon.strategy_fail_x": -1, "stage.cleanup": 1, "http-post.verb": "POST", "http-post.uri": "/dist/js/bootstrap.bundle.min.js", "server.publickey_md5": "cd69e2e76312f963b9a752f3da113883", "process-inject.allocator": 1, "cfg_caution": 1, "http-get.verb": "POST", "http-get.client": ["Accept: text/html,application/xhtml+xml,application/xml;", "Host: getbootstrap.com", "Accept-Encoding: gzip, deflate", "Accept-Language: zh-CN,zh;q=0.9", "__cfduid=", "Cookie"]}}, "ip": 661350017, "http": {"status": 404, "robots_hash": null, "redirects": [], "securitytxt": null, "title": null, "sitemap_hash": null, "waf": "Cloudflare (Cloudflare Inc.)", "robots": null, "server": "cloudflare", "headers_hash": 91730385, "host": "39.107.102.129", "html": "", "location": "/", "html_hash": 0, "sitemap": null, "securitytxt_hash": null}, "port": 443, "transport": "tcp", "location": {"city": "Beijing", "region_code": "BJ", "area_code": null, "longitude": 116.39723, "latitude": 39.9075, "country_code": "CN", "country_name": "China"}, "product": "Cobalt Strike Beacon", "hash": 730596520, "tags": ["self-signed"], "timestamp": "2023-08-29T18:18:19.453996", "ssl": {"chain_sha256": ["8848f4cc93d21742dd71884c06aaa159bf143b186ab5e9ed1f822fdcd8f0d489"], "jarm": "2ad2ad16d2ad2ad00042d42d00042ddb04deffa1705e2edc44cae1ed24a4da", "chain": ["-----BEGIN CERTIFICATE-----\nMIIDxzCCAq+gAwIBAgIEKkbXQTANBgkqhkiG9w0BAQsFADCBkzEPMA0GA1UEBhMG\nTXVtYmFpMRQwEgYDVQQIEwtOYXZpIE11bWJhaTEOMAwGA1UEBxMFVmFzaGkxHjAc\nBgNVBAoTFUluZm93b3JsZCBDb3Jwb3JhdGlvbjEeMBwGA1UECxMVSW5mb3dvcmxk\nIENvcnBvcmF0aW9uMRowGAYDVQQDExF3d3cuaW5mb3dvcmxkLmNvbTAeFw0yMzAy\nMTQwNzM4NTRaFw0yMzA1MTUwNzM4NTRaMIGTMQ8wDQYDVQQGEwZNdW1iYWkxFDAS\nBgNVBAgTC05hdmkgTXVtYmFpMQ4wDAYDVQQHEwVWYXNoaTEeMBwGA1UEChMVSW5m\nb3dvcmxkIENvcnBvcmF0aW9uMR4wHAYDVQQLExVJbmZvd29ybGQgQ29ycG9yYXRp\nb24xGjAYBgNVBAMTEXd3dy5pbmZvd29ybGQuY29tMIIBIjANBgkqhkiG9w0BAQEF\nAAOCAQ8AMIIBCgKCAQEAk1Ashp7ZkKZSH9cXL3U6BwCfU5e4tjQQs5PI0Dkm0Tkj\nVG1H8MZp+xKdnaQXG2axk+mICYHEY63AQp656jl7xQMzKAJ7UqTysmqplUJZJMep\ne0Vploj50089aJwkwFbkJxRDOE0KEFRS4Qn7m6sbe4wdrEmEx2NRlr1ToR91JCMR\nogRrIRjx8mnCdFg9rUK0w39sAi7GSS+4RonuRZUhI8LGbcU1xbwdfjsKJBySR+qT\nncfIoiZI6ZNoiuxW/I7Nx3OMuaQ2l6L3Gg9OuHzw2ehGfzVmVkvXLEekpz107JVZ\nBJukhH0142NhowDJBgfWBYN2Hy16+A4XzmvbrLmurQIDAQABoyEwHzAdBgNVHQ4E\nFgQUCv4w2j7rEp37kRBMLLvUrRVg+KkwDQYJKoZIhvcNAQELBQADggEBAI1/pIzS\nqojPY8KAC9WH7Yt8EtiVuErdUVk4OTOPbt+HMUn8iigK1h/MPaw042Xg70cXxCe9\nWFUsLA4jTdZ6/iKHKN2zrtQb1YJ/CneW7Y82fEwgCKF1sLRZAOdHn1mSL1hgwfSe\nSsJ8EvC+XoO1ba3OxuyRglEHtb680dM4lA3Ycbq3BxX6zMKtSImy0Mhl07GM1wc0\nIJQY1TRpI74yXTVNb2Ue9Y7/rYzN+98ohOZ4KH1ha3CCRSb5q8mmho8lOkzD2r+E\nm+DUiwRaVAcxJVBUjxtm2MDeMn6dpazBlrljDvfdGpwDeuAcEqCmwJkjUUXuuJiM\n13iuX7q/m+9EapI=\n-----END CERTIFICATE-----\n"], "dhparams": {"prime": "ffffffffffffffffc90fdaa22168c234c4c6628b80dc1cd129024e088a67cc74020bbea63b139b22514a08798e3404ddef9519b3cd3a431b302b0a6df25f14374fe1356d6d51c245e485b576625e7ec6f44c42e9a637ed6b0bff5cb6f406b7edee386bfb5a899fa5ae9f24117c4b1fe649286651ece65381ffffffffffffffff", "public_key": "1d00e6afcc9da469c6157b294e05586f0d5582a008883ca059046aba29f2d89e8d91c7d0dbad3d2d3a47549145a595e540121ce7e6f34b419bf6d8d3cdab3a001a7b4bbb2e13008c16a86a682b5b1a8ee3bcf7e44726c753947a37b3885ee233800282cb26df84fd764f728234c16fc008c24fe3edd816cbef425ff282b5d218", "bits": 1024, "generator": 2, "fingerprint": "RFC2409/Oakley Group 2"}, "versions": ["-TLSv1", "-SSLv2", "-SSLv3", "-TLSv1.1", "TLSv1.2", "TLSv1.3"], "acceptable_cas": [], "tlsext": [{"id": 43, "name": "supported_versions"}, {"id": 51, "name": "key_share"}, {"id": 10, "name": "supported_groups"}], "ja3s": "f03a69cfa3944d6d51bc52febd87a1a8", "cert": {"sig_alg": "sha256WithRSAEncryption", "issued": "20230214073854Z", "expires": "20230515073854Z", "expired": true, "version": 2, "extensions": [{"data": "\\x04\\x14\\n\\xfe0\\xda>\\xeb\\x12\\x9d\\xfb\\x91\\x10L,\\xbb\\xd4\\xad\\x15`\\xf8\\xa9", "name": "subjectKeyIdentifier"}], "fingerprint": {"sha256": "8848f4cc93d21742dd71884c06aaa159bf143b186ab5e9ed1f822fdcd8f0d489", "sha1": "6a0b02ecfc4731f24fcf80ad84c779bb0ea56fbe"}, "serial": 709285697, "subject": {"C": "Mumbai", "CN": "www.infoworld.com", "L": "Vashi", "O": "Infoworld Corporation", "ST": "Navi Mumbai", "OU": "Infoworld Corporation"}, "pubkey": {"type": "rsa", "bits": 2048}, "issuer": {"C": "Mumbai", "CN": "www.infoworld.com", "L": "Vashi", "O": "Infoworld Corporation", "ST": "Navi Mumbai", "OU": "Infoworld Corporation"}}, "cipher": {"version": "TLSv1.3", "bits": 256, "name": "TLS_AES_256_GCM_SHA384"}, "trust": {"revoked": false, "browser": null}, "handshake_states": ["before SSL initialization", "SSLv3/TLS write client hello", "SSLv3/TLS read server hello", "TLSv1.3 read encrypted extensions", "SSLv3/TLS read server certificate", "TLSv1.3 read server certificate verify", "SSLv3/TLS read finished", "SSLv3/TLS write change cipher spec", "SSLv3/TLS write finished", "SSL negotiation finished successfully"], "alpn": [], "ocsp": {}}, "hostnames": [], "org": "Aliyun Computing Co., LTD", "data": "HTTP/1.1 404 Not Found\r\nDate: Tue, 29 Aug 2023 18:18:19 GMT\r\nContent-Type: text/plain\r\nServer: cloudflare\r\nCache-Control: max-age=2\r\nConnection: close\r\nContent-Length: 0\r\n\r\n\nCobalt Strike Beacon:\n  x86:\n    beacon_type: HTTPS\n    cfg_caution: 1\n    dns-beacon.strategy_fail_seconds: -1\n    dns-beacon.strategy_fail_x: -1\n    dns-beacon.strategy_rotate_seconds: -1\n    host_header: Host: weixin.zjstv.com\r\n\n    http-get.client:\n      Accept: text/html,application/xhtml+xml,application/xml;\n      Host: getbootstrap.com\n      Accept-Encoding: gzip, deflate\n      Accept-Language: zh-CN,zh;q=0.9\n      __cfduid=\n      Cookie\n    http-get.uri: testwscdn.m.37.com,/dist/css/bootstrap.min.css\n    http-get.verb: POST\n    http-post.client:\n      Accept: text/html,application/xhtml+xml,application/xml;\n      Host: getbootstrap.com\n      Accept-Encoding: gzip, deflate\n      Accept-Language: zh-CN,zh;q=0.9\n      serve\n    http-post.uri: /dist/js/bootstrap.bundle.min.js\n    http-post.verb: POST\n    jitter: 37\n    maxgetsize: 1403086\n    port: 443\n    post-ex.spawnto_x64: %windir%\\sysnative\\svchost.exe -k netsvcs\n    post-ex.spawnto_x86: %windir%\\syswow64\\svchost.exe -k netsvcs\n    process-inject.allocator: 1\n    process-inject.execute:\n      ntdll:RtlUserThreadStart\n      CreateThread\n      NtQueueApcThread\n      CreateRemoteThread\n      RtlCreateUserThread\n    process-inject.min_alloc: 16700\n    process-inject.startrwx: 64\n    process-inject.stub: 41e6db3cfcfa84be7cac6e42f21a22a8\n    process-inject.userwx: 32\n    proxy.behavior: 2 (Use IE settings)\n    server.publickey_md5: cd69e2e76312f963b9a752f3da113883\n    sleeptime: 10000\n    stage.cleanup: 1\n    useragent_header: Mozilla/5.0 (X11; U; Linux x86_64; en-us) AppleWebKit/531.2+ (KHTML, like Gecko) Version/5.0 Safari/531.2+\n    uses_cookies: 1\n    watermark: 391144938\n  x64:\n    beacon_type: HTTPS\n    cfg_caution: 1\n    dns-beacon.strategy_fail_seconds: -1\n    dns-beacon.strategy_fail_x: -1\n    dns-beacon.strategy_rotate_seconds: -1\n    host_header: Host: weixin.zjstv.com\r\n\n    http-get.client:\n      Accept: text/html,application/xhtml+xml,application/xml;\n      Host: getbootstrap.com\n      Accept-Encoding: gzip, deflate\n      Accept-Language: zh-CN,zh;q=0.9\n      __cfduid=\n      Cookie\n    http-get.uri: testwscdn.m.37.com,/dist/css/bootstrap.min.css\n    http-get.verb: POST\n    http-post.client:\n      Accept: text/html,application/xhtml+xml,application/xml;\n      Host: getbootstrap.com\n      Accept-Encoding: gzip, deflate\n      Accept-Language: zh-CN,zh;q=0.9\n      serve\n    http-post.uri: /dist/js/bootstrap.bundle.min.js\n    http-post.verb: POST\n    jitter: 37\n    maxgetsize: 1403086\n    port: 443\n    post-ex.spawnto_x64: %windir%\\sysnative\\svchost.exe -k netsvcs\n    post-ex.spawnto_x86: %windir%\\syswow64\\svchost.exe -k netsvcs\n    process-inject.allocator: 1\n    process-inject.execute:\n      ntdll:RtlUserThreadStart\n      CreateThread\n      NtQueueApcThread\n      CreateRemoteThread\n      RtlCreateUserThread\n    process-inject.min_alloc: 16700\n    process-inject.startrwx: 64\n    process-inject.stub: 41e6db3cfcfa84be7cac6e42f21a22a8\n    process-inject.userwx: 32\n    proxy.behavior: 2 (Use IE settings)\n    server.publickey_md5: cd69e2e76312f963b9a752f3da113883\n    sleeptime: 10000\n    stage.cleanup: 1\n    useragent_header: Mozilla/5.0 (X11; U; Linux x86_64; en-us) AppleWebKit/531.2+ (KHTML, like Gecko) Version/5.0 Safari/531.2+\n    uses_cookies: 1\n    watermark: 391144938\n", "asn": "AS37963", "cpe23": ["cpe:2.3:a:helpsystems:cobalt_strike"], "isp": "Hangzhou Alibaba Advertising Co.,Ltd.", "cpe": ["cpe:/a:helpsystems:cobalt_strike"], "domains": [], "ip_str": "39.107.102.129", "os": null, "_shodan": {"region": "na", "ptr": true, "module": "https", "id": "ece8123f-b20d-4d46-ab12-1a3636d8c05c", "options": {}, "crawler": "21255b11b05f5ce2a4cf82d3f9ebb017a5a1fdd1"}, "opts": {"vulns": [], "heartbleed": "2023/08/29 18:18:43 39.107.102.129:443 - SAFE\n"}}
{"cobalt_strike_beacon": {"x86": {"beacon_type": "HTTPS", "jitter": 41, "dns-beacon.strategy_rotate_seconds": -1, "useragent_header": "Mozilla/5.0 (Macintosh; Intel Mac OS X 10_11_2) AppleWebKit/601.3.9 (KHTML, like Gecko) Version/9.0.2 Safari/601.3.9", "http-post.client": ["Connection: close", "Content-Type: text/plain", "__session__id=", "Cookie"], "maxgetsize": 1864736, "process-inject.min_alloc": 16614, "post-ex.spawnto_x86": "%windir%\\syswow64\\svchost.exe", "port": 443, "sleeptime": 55788, "uses_cookies": 1, "proxy.behavior": "2 (Use IE settings)", "process-inject.execute": ["CreateThread", "RtlCreateUserThread", "CreateRemoteThread"], "process-inject.startrwx": 4, "post-ex.spawnto_x64": "%windir%\\sysnative\\svchost.exe", "process-inject.stub": "e43a1b63f09794f74d90a9889f7acb77", "http-get.uri": "hello-world-steep-glade-9514.ddosploit.workers.dev,/us", "watermark": 987654321, "dns-beacon.strategy_fail_seconds": -1, "server.publickey_md5": "cae0433ce8f1460f90c67c7312d21d06", "dns-beacon.strategy_fail_x": -1, "stage.cleanup": 1, "http-post.verb": "POST", "http-post.uri": "/btn_bg", "process-inject.userwx": 32, "http-get.verb": "GET", "http-get.client": ["Connection: close", "Accept-Language: en-US", "wordpress_ed1f617bbd6c004cc09e046f3c1b7148=", "Cookie", "replace=false"]}, "x64": {"beacon_type": "HTTPS", "jitter": 41, "dns-beacon.strategy_rotate_seconds": -1, "useragent_header": "Mozilla/5.0 (Macintosh; Intel Mac OS X 10_11_2) AppleWebKit/601.3.9 (KHTML, like Gecko) Version/9.0.2 Safari/601.3.9", "http-post.client": ["Connection: close", "Content-Type: text/plain", "__session__id=", "Cookie"], "maxgetsize": 1864736, "process-inject.min_alloc": 16614, "post-ex.spawnto_x86": "%windir%\\syswow64\\svchost.exe", "port": 443, "sleeptime": 55788, "uses_cookies": 1, "proxy.behavior": "2 (Use IE settings)", "process-inject.execute": ["CreateThread", "RtlCreateUserThread", "CreateRemoteThread"], "process-inject.startrwx": 4, "post-ex.spawnto_x64": "%windir%\\sysnative\\svchost.exe", "process-inject.stub": "e43a1b63f09794f74d90a9889f7acb77", "http-get.uri": "hello-world-steep-glade-9514.ddosploit.workers.dev,/us", "watermark": 987654321, "dns-beacon.strategy_fail_seconds": -1, "server.publickey_md5": "cae0433ce8f1460f90c67c7312d21d06", "dns-beacon.strategy_fail_x": -1, "stage.cleanup": 1, "http-post.verb": "POST", "http-post.uri": "/btn_bg", "process-inject.userwx": 32, "http-get.verb": "GET", "http-get.client": ["Connection: close", "Accept-Language: en-US", "wordpress_ed1f617bbd6c004cc09e046f3c1b7148=", "Cookie", "replace=false"]}}, "ip": 2523788998, "http": {"status": 404, "robots_hash": null, "redirects": [], "securitytxt": null, "title": null, "sitemap_hash": null, "robots": null, "server": "Apache", "headers_hash": 11853219, "host": "150.109.246.198", "html": "", "location": "/", "html_hash": 0, "sitemap": null, "securitytxt_hash": null}, "port": 443, "transport": "tcp", "location": {"city": "Seoul", "region_code": "11", "area_code": null, "longitude": 126.9777, "latitude": 37.5662, "country_code": "KR", "country_name": "Korea, Republic of"}, "product": "Cobalt Strike Beacon", "hash": 988661125, "timestamp": "2023-08-25T20:54:43.452078", "ssl": {"chain_sha256": ["62df94ec06bb41494b03983fcf89722ece6a3b40529036e2a41b4f6f045e204e"], "jarm": "2ad2ad16d2ad2ad00042d42d00042ddb04deffa1705e2edc44cae1ed24a4da", "chain": ["-----BEGIN CERTIFICATE-----\nMIIElzCCA3+gAwIBAgIUHakIX/rS7Qjd8Uex9exXMXSLuRowDQYJKoZIhvcNAQEL\nBQAwgYsxCzAJBgNVBAYTAlVTMRkwFwYDVQQKExBDbG91ZEZsYXJlLCBJbmMuMTQw\nMgYDVQQLEytDbG91ZEZsYXJlIE9yaWdpbiBTU0wgQ2VydGlmaWNhdGUgQXV0aG9y\naXR5MRYwFAYDVQQHEw1TYW4gRnJhbmNpc2NvMRMwEQYDVQQIEwpDYWxpZm9ybmlh\nMB4XDTIzMDgyMjA1MjQwMFoXDTM4MDgxODA1MjQwMFowYjEZMBcGA1UEChMQQ2xv\ndWRGbGFyZSwgSW5jLjEdMBsGA1UECxMUQ2xvdWRGbGFyZSBPcmlnaW4gQ0ExJjAk\nBgNVBAMTHUNsb3VkRmxhcmUgT3JpZ2luIENlcnRpZmljYXRlMIIBIjANBgkqhkiG\n9w0BAQEFAAOCAQ8AMIIBCgKCAQEArWBNleMyyU2l5fvRfL2y2zCxRoVgrmTsB8Ji\nj6pc6PMGkeXHFAHVuTrk4do0heZ7Lo/PTlDotlGv5bn4haaUBEWl4FYVC8gJucHz\n/9iTCwQj8khKZJuO7TZbSi9Xqknaa+Nyrp7E87TPxdephWBLe/+iX7UmNjo+JByl\no7hrYv6WMilIcE9JIPOElnbZgXABgzLzRw7V9cy5y4EVCCkgt4yuV0Obc9k9+ebF\nmb5q/s4yLk+0g5VLR0W8VYYlTQjWbTpeO9cvoc1N94zKuz3Bf2pOwpGkAou4o4mi\nJIIIxq3RbfrU2sfBMUjWnwEiegKrThqGnFkaWKcKfxeS1IWDgwIDAQABo4IBGTCC\nARUwDgYDVR0PAQH/BAQDAgWgMB0GA1UdJQQWMBQGCCsGAQUFBwMCBggrBgEFBQcD\nATAMBgNVHRMBAf8EAjAAMB0GA1UdDgQWBBQp4g0VJy0Flbs6XJ32iFAvZMg4qTAf\nBgNVHSMEGDAWgBQk6FNXXXw0QIep65TbuuEWePwppDBABggrBgEFBQcBAQQ0MDIw\nMAYIKwYBBQUHMAGGJGh0dHA6Ly9vY3NwLmNsb3VkZmxhcmUuY29tL29yaWdpbl9j\nYTAaBgNVHREEEzARgg9hcGkubmV4dGdwdC5mdW4wOAYDVR0fBDEwLzAtoCugKYYn\naHR0cDovL2NybC5jbG91ZGZsYXJlLmNvbS9vcmlnaW5fY2EuY3JsMA0GCSqGSIb3\nDQEBCwUAA4IBAQC1SbVPGETaoqF1wM81ODmsN4aLBVm6WzujErm4jV6N9dK8Vln5\n+AsrSfVJehk0gtEZxu2NEIqqm6HG7ox0NR0ze69V1xWdIlIeh4ZHox4xpA+AEfT4\nZnvy/jiE4eAbET9zuigIaz9ehSJu6DTg5Mg8Q8yTlZHfwS3arRL9jOkK3rBY3LWN\nPlhwYMoMC7m4BZg40nod9y2Lm1riwZkgw27pjUcbo47ppqZ6+Bu/nzPl1driv2p1\nGq+zryTR0VcluVmTNouPTq2wALkivtArk3saiWGif79Ac7k4rr6kop5xpn8aSU6e\nKVr2+8W/K2bZ/9WY2E2FZnSUggkCxZwddsi0\n-----END CERTIFICATE-----\n"], "dhparams": {"prime": "ffffffffffffffffc90fdaa22168c234c4c6628b80dc1cd129024e088a67cc74020bbea63b139b22514a08798e3404ddef9519b3cd3a431b302b0a6df25f14374fe1356d6d51c245e485b576625e7ec6f44c42e9a637ed6b0bff5cb6f406b7edee386bfb5a899fa5ae9f24117c4b1fe649286651ece65381ffffffffffffffff", "public_key": "b39fa857adc06ae67c4af6ea7621b7e60c4e3eddf4385777ac827b0fa743a8b501fb948f7bdee2af58ef7e9645c91e16d7c489b5d0123152375e28a8fc5fa4ab676fc9718c1a97c4b8c2f8573ff9fbbf52b535f56247a7328a7a2b9ea2213ef87d5751a9848c7af5cf9d9fbca0ff966c5a38484b9001e7987fcc26cd4848aedb", "bits": 1024, "generator": 2, "fingerprint": "RFC2409/Oakley Group 2"}, "versions": ["-TLSv1", "-SSLv2", "-SSLv3", "-TLSv1.1", "TLSv1.2", "TLSv1.3"], "acceptable_cas": [], "tlsext": [{"id": 43, "name": "supported_versions"}, {"id": 51, "name": "key_share"}, {"id": 10, "name": "supported_groups"}], "ja3s": "f03a69cfa3944d6d51bc52febd87a1a8", "cert": {"sig_alg": "sha256WithRSAEncryption", "issued": "20230822052400Z", "expires": "20380818052400Z", "expired": false, "version": 2, "extensions": [{"critical": true, "data": "\\x03\\x02\\x05\\xa0", "name": "keyUsage"}, {"data": "0\\x14\\x06\\x08+\\x06\\x01\\x05\\x05\\x07\\x03\\x02\\x06\\x08+\\x06\\x01\\x05\\x05\\x07\\x03\\x01", "name": "extendedKeyUsage"}, {"critical": true, "data": "0\\x00", "name": "basicConstraints"}, {"data": "\\x04\\x14)\\xe2\\r\\x15\\'-\\x05\\x95\\xbb:\\\\\\x9d\\xf6\\x88P/d\\xc88\\xa9", "name": "subjectKeyIdentifier"}, {"data": "0\\x16\\x80\\x14$\\xe8SW]|4@\\x87\\xa9\\xeb\\x94\\xdb\\xba\\xe1\\x16x\\xfc)\\xa4", "name": "authorityKeyIdentifier"}, {"data": "0200\\x06\\x08+\\x06\\x01\\x05\\x05\\x070\\x01\\x86$http://ocsp.cloudflare.com/origin_ca", "name": "authorityInfoAccess"}, {"data": "0\\x11\\x82\\x0fapi.nextgpt.fun", "name": "subjectAltName"}, {"data": "0/0-\\xa0+\\xa0)\\x86\\'http://crl.cloudflare.com/origin_ca.crl", "name": "crlDistributionPoints"}], "fingerprint": {"sha256": "62df94ec06bb41494b03983fcf89722ece6a3b40529036e2a41b4f6f045e204e", "sha1": "05740835b108454e26af87b428c0fccd9b48d964"}, "serial": 169330287850957522004918435307810085854713198874, "subject": {"OU": "CloudFlare Origin CA", "CN": "CloudFlare Origin Certificate", "O": "CloudFlare, Inc."}, "pubkey": {"type": "rsa", "bits": 2048}, "issuer": {"C": "US", "ST": "California", "L": "San Francisco", "O": "CloudFlare, Inc.", "OU": "CloudFlare Origin SSL Certificate Authority"}}, "cipher": {"version": "TLSv1.3", "bits": 256, "name": "TLS_AES_256_GCM_SHA384"}, "trust": {"revoked": false, "browser": null}, "handshake_states": ["before SSL initialization", "SSLv3/TLS write client hello", "SSLv3/TLS read server hello", "TLSv1.3 read encrypted extensions", "SSLv3/TLS read server certificate", "TLSv1.3 read server certificate verify", "SSLv3/TLS read finished", "SSLv3/TLS write change cipher spec", "SSLv3/TLS write finished", "SSL negotiation finished successfully"], "alpn": [], "ocsp": {}}, "hostnames": ["api.nextgpt.fun"], "org": null, "data": "HTTP/1.1 404 Not Found\r\nDate: Fri, 25 Aug 2023 20:54:43 GMT\r\nContent-Type: text/plain\r\nContent-Length: 0\r\nServer: Apache\r\n\r\n\nCobalt Strike Beacon:\n  x86:\n    beacon_type: HTTPS\n    dns-beacon.strategy_fail_seconds: -1\n    dns-beacon.strategy_fail_x: -1\n    dns-beacon.strategy_rotate_seconds: -1\n    http-get.client:\n      Connection: close\n      Accept-Language: en-US\n      wordpress_ed1f617bbd6c004cc09e046f3c1b7148=\n      Cookie\n      replace=false\n    http-get.uri: hello-world-steep-glade-9514.ddosploit.workers.dev,/us\n    http-get.verb: GET\n    http-post.client:\n      Connection: close\n      Content-Type: text/plain\n      __session__id=\n      Cookie\n    http-post.uri: /btn_bg\n    http-post.verb: POST\n    jitter: 41\n    maxgetsize: 1864736\n    port: 443\n    post-ex.spawnto_x64: %windir%\\sysnative\\svchost.exe\n    post-ex.spawnto_x86: %windir%\\syswow64\\svchost.exe\n    process-inject.execute:\n      CreateThread\n      RtlCreateUserThread\n      CreateRemoteThread\n    process-inject.min_alloc: 16614\n    process-inject.startrwx: 4\n    process-inject.stub: e43a1b63f09794f74d90a9889f7acb77\n    process-inject.userwx: 32\n    proxy.behavior: 2 (Use IE settings)\n    server.publickey_md5: cae0433ce8f1460f90c67c7312d21d06\n    sleeptime: 55788\n    stage.cleanup: 1\n    useragent_header: Mozilla/5.0 (Macintosh; Intel Mac OS X 10_11_2) AppleWebKit/601.3.9 (KHTML, like Gecko) Version/9.0.2 Safari/601.3.9\n    uses_cookies: 1\n    watermark: 987654321\n  x64:\n    beacon_type: HTTPS\n    dns-beacon.strategy_fail_seconds: -1\n    dns-beacon.strategy_fail_x: -1\n    dns-beacon.strategy_rotate_seconds: -1\n    http-get.client:\n      Connection: close\n      Accept-Language: en-US\n      wordpress_ed1f617bbd6c004cc09e046f3c1b7148=\n      Cookie\n      replace=false\n    http-get.uri: hello-world-steep-glade-9514.ddosploit.workers.dev,/us\n    http-get.verb: GET\n    http-post.client:\n      Connection: close\n      Content-Type: text/plain\n      __session__id=\n      Cookie\n    http-post.uri: /btn_bg\n    http-post.verb: POST\n    jitter: 41\n    maxgetsize: 1864736\n    port: 443\n    post-ex.spawnto_x64: %windir%\\sysnative\\svchost.exe\n    post-ex.spawnto_x86: %windir%\\syswow64\\svchost.exe\n    process-inject.execute:\n      CreateThread\n      RtlCreateUserThread\n      CreateRemoteThread\n    process-inject.min_alloc: 16614\n    process-inject.startrwx: 4\n    process-inject.stub: e43a1b63f09794f74d90a9889f7acb77\n    process-inject.userwx: 32\n    proxy.behavior: 2 (Use IE settings)\n    server.publickey_md5: cae0433ce8f1460f90c67c7312d21d06\n    sleeptime: 55788\n    stage.cleanup: 1\n    useragent_header: Mozilla/5.0 (Macintosh; Intel Mac OS X 10_11_2) AppleWebKit/601.3.9 (KHTML, like Gecko) Version/9.0.2 Safari/601.3.9\n    uses_cookies: 1\n    watermark: 987654321\n", "asn": "AS132203", "cpe23": ["cpe:2.3:a:helpsystems:cobalt_strike"], "isp": "Tencent Building, Kejizhongyi Avenue", "cpe": ["cpe:/a:helpsystems:cobalt_strike"], "domains": ["nextgpt.fun"], "ip_str": "150.109.246.198", "os": null, "_shodan": {"region": "na", "ptr": true, "module": "https", "id": "0ec02a27-004e-4de1-aeea-876015a5a92d", "options": {}, "crawler": "21255b11b05f5ce2a4cf82d3f9ebb017a5a1fdd1"}, "opts": {"vulns": [], "heartbleed": "2023/08/25 20:55:15 150.109.246.198:443 - SAFE\n"}}
{"hash": -64057514, "asn": "AS57678", "http": {"status": 404, "robots_hash": null, "redirects": [], "securitytxt": null, "title": null, "sitemap_hash": null, "robots": null, "server": null, "headers_hash": 2129120964, "host": "176.113.115.145", "html": "", "location": "/", "securitytxt_hash": null, "sitemap": null, "html_hash": 0}, "os": null, "timestamp": "2023-08-26T16:42:39.018692", "isp": "Cat Technologies Co. Limited", "transport": "tcp", "_shodan": {"region": "na", "crawler": "c64d77c38eb400e347e122d201f3e13c88526116", "options": {}, "module": "https", "id": "dd8e682d-eab4-490f-893b-fda025739708"}, "ssl": {"chain_sha256": ["87f2085c32b6a2cc709b365f55873e207a9caa10bffecf2fd16d3cf9d94d390c"], "jarm": "2ad2ad16d2ad2ad22c42d42d00042d58c7162162b6a603d3d90a2b76865b53", "chain": ["-----BEGIN CERTIFICATE-----\nMIIDIzCCAgugAwIBAgIECLsA7jANBgkqhkiG9w0BAQsFADBCMQkwBwYDVQQGEwAx\nCTAHBgNVBAgTADEJMAcGA1UEBxMAMQkwBwYDVQQKEwAxCTAHBgNVBAsTADEJMAcG\nA1UEAxMAMB4XDTE1MDUyMDE4MjYyNFoXDTI1MDUxNzE4MjYyNFowQjEJMAcGA1UE\nBhMAMQkwBwYDVQQIEwAxCTAHBgNVBAcTADEJMAcGA1UEChMAMQkwBwYDVQQLEwAx\nCTAHBgNVBAMTADCCASIwDQYJKoZIhvcNAQEBBQADggEPADCCAQoCggEBAJjXGpNx\njm97YowJUxMyM/QBjGTnyUqMXt1IsXArVdop3F/fGdhsmWkExTt8AfjWm9TL2I3K\nCVKqBhQ9U8+W+l3JAPNaqLnOqRSfeQ+SQ0tmLuVn1AVQt1RKYZGo+o70G/yAXBNw\nCQ3mUisLe6Ln926E3seZM6gb8HesF/w+2sCcQ2UaqLY3hKVIDYvlenNaNMxtaw+8\nA/3udT+pIX1JyrlIlt0SDg5Ya2opwYTFJM64KbuyDKkK213A5Sz00Rh13PVRKWlp\nfVtgoh9BNupzJOG/GE/x0XmXCYAOIGrm8uujAtUWJ5nkbaczf2ldnITJBw+3iQrt\nE1LEM8aUJeKRCVkCAwEAAaMhMB8wHQYDVR0OBBYEFHNrXtvPyRkdW9AfjOOrVjgY\nnwJPMA0GCSqGSIb3DQEBCwUAA4IBAQBU9S+o9YRFBTzcCeZ4phipmwJ9PsIFKoid\ngkTekbt3EzyL+Q+nySQ/Gn4ZXdliFYxKNcRmxbSWCa9jX6qJb6t7gcLBP8Hp7kWL\nsNdbk19+iSDphVfO6UdL6ZVIbIy0vNO0/LgEKVi7tzE84elcaS45ZSPY+HnySF2s\nP3SF0n9iF/bWdzYOjLcPpgavsT66KLrileXkYjCWFOXufnZgpf11pGd3wTJEIenS\nabc90LQ4rAvBJPicY/AfhIth/g4GiDG+M1DmzlV+1F0nNr3KuNGjeghLVegKoRq/\nb5PF+0kpSK7HUwIdrgZsqz1ORsMToEyv8LvxIyL0DTCLBJSHmgJy\n-----END CERTIFICATE-----\n"], "dhparams": {"prime": "ffffffffffffffffc90fdaa22168c234c4c6628b80dc1cd129024e088a67cc74020bbea63b139b22514a08798e3404ddef9519b3cd3a431b302b0a6df25f14374fe1356d6d51c245e485b576625e7ec6f44c42e9a637ed6b0bff5cb6f406b7edee386bfb5a899fa5ae9f24117c4b1fe649286651ece65381ffffffffffffffff", "public_key": "da799ff1fcc8ad8bd0fad502a5c803ea6c136e7dd13a89e9e395bc440d1b679f3d7b6f2f59a5b8eae69f453e35c2681a2998ba4f213631cc0434dae3b91f06f42fa11951a5fc1c4d90545f470f4ef0e4bfa82e3f421f1900bccc52371e9b9a8d6c3b4c4530ccfb7086e4cede81dc5a6741798b52acd01aceae304d19cb2d02c1", "bits": 1024, "generator": 2, "fingerprint": "RFC2409/Oakley Group 2"}, "versions": ["TLSv1", "-SSLv2", "-SSLv3", "TLSv1.1", "TLSv1.2", "TLSv1.3"], "acceptable_cas": [], "tlsext": [{"id": 43, "name": "supported_versions"}, {"id": 51, "name": "key_share"}, {"id": 10, "name": "supported_groups"}], "alpn": [], "cert": {"sig_alg": "sha256WithRSAEncryption", "issued": "20150520182624Z", "expires": "20250517182624Z", "pubkey": {"bits": 2048, "type": "rsa"}, "version": 2, "extensions": [{"data": "\\x04\\x14sk^\\xdb\\xcf\\xc9\\x19\\x1d[\\xd0\\x1f\\x8c\\xe3\\xabV8\\x18\\x9f\\x02O", "name": "subjectKeyIdentifier"}], "fingerprint": {"sha256": "87f2085c32b6a2cc709b365f55873e207a9caa10bffecf2fd16d3cf9d94d390c", "sha1": "6ece5ece4192683d2d84e25b0ba7e04f9cb7eb7c"}, "serial": 146473198, "issuer": {"C": "", "CN": "", "L": "", "O": "", "ST": "", "OU": ""}, "expired": false, "subject": {"C": "", "CN": "", "L": "", "O": "", "ST": "", "OU": ""}}, "cipher": {"version": "TLSv1.3", "bits": 256, "name": "TLS_AES_256_GCM_SHA384"}, "trust": {"revoked": false, "browser": null}, "handshake_states": ["before SSL initialization", "SSLv3/TLS write client hello", "SSLv3/TLS read server hello", "TLSv1.3 read encrypted extensions", "SSLv3/TLS read server certificate", "TLSv1.3 read server certificate verify", "SSLv3/TLS read finished", "SSLv3/TLS write change cipher spec", "SSLv3/TLS write finished", "SSL negotiation finished successfully"], "ja3s": "f03a69cfa3944d6d51bc52febd87a1a8", "ocsp": {}}, "hostnames": [], "location": {"city": "Moscow", "region_code": "MOW", "area_code": null, "longitude": 37.61556, "latitude": 55.75222, "country_code": "RU", "country_name": "Russian Federation"}, "ip": 2960225169, "domains": [], "org": "Cat Technologies Co. Limited", "data": "HTTP/1.1 404 Not Found\r\nDate: Sat, 26 Aug 2023 16:42:38 GMT\r\nContent-Type: text/plain\r\nContent-Length: 0\r\n\r\n", "port": 443, "opts": {"vulns": [], "heartbleed": "2023/08/26 16:42:54 176.113.115.145:443 - SAFE\n"}, "ip_str": "176.113.115.145"}
{"cobalt_strike_beacon": {"x86": {"beacon_type": "HTTPS", "dns-beacon.strategy_rotate_seconds": -1, "useragent_header": "Mozilla/5.0 (compatible; MSIE 9.0; Windows NT 6.1; WOW64; Trident/5.0; FunWebProducts)", "http-post.client": ["Content-Type: application/octet-stream", "id"], "maxgetsize": 1048576, "post-ex.spawnto_x86": "%windir%\\syswow64\\rundll32.exe", "port": 443, "sleeptime": 60000, "uses_cookies": 1, "proxy.behavior": "2 (Use IE settings)", "process-inject.execute": ["CreateThread", "SetThreadContext", "CreateRemoteThread", "RtlCreateUserThread"], "process-inject.startrwx": 64, "post-ex.spawnto_x64": "%windir%\\sysnative\\rundll32.exe", "process-inject.stub": "e43a1b63f09794f74d90a9889f7acb77", "http-get.uri": "123.253.227.74,/pixel.gif", "watermark": 987654321, "dns-beacon.strategy_fail_seconds": -1, "process-inject.userwx": 64, "dns-beacon.strategy_fail_x": -1, "http-post.verb": "POST", "http-post.uri": "/submit.php", "server.publickey_md5": "2c835b3a7d8541b35e9c2de9b2eb52ee", "http-get.verb": "GET", "http-get.client": ["Cookie"]}, "x64": {"beacon_type": "HTTPS", "dns-beacon.strategy_rotate_seconds": -1, "useragent_header": "Mozilla/5.0 (compatible; MSIE 9.0; Windows NT 6.1; WOW64; Trident/5.0; yie9)", "http-post.client": ["Content-Type: application/octet-stream", "id"], "maxgetsize": 1048576, "post-ex.spawnto_x86": "%windir%\\syswow64\\rundll32.exe", "port": 443, "sleeptime": 60000, "uses_cookies": 1, "proxy.behavior": "2 (Use IE settings)", "process-inject.execute": ["CreateThread", "SetThreadContext", "CreateRemoteThread", "RtlCreateUserThread"], "process-inject.startrwx": 64, "post-ex.spawnto_x64": "%windir%\\sysnative\\rundll32.exe", "process-inject.stub": "e43a1b63f09794f74d90a9889f7acb77", "http-get.uri": "123.253.227.74,/IE9CompatViewList.xml", "watermark": 987654321, "dns-beacon.strategy_fail_seconds": -1, "process-inject.userwx": 64, "dns-beacon.strategy_fail_x": -1, "http-post.verb": "POST", "http-post.uri": "/submit.php", "server.publickey_md5": "2c835b3a7d8541b35e9c2de9b2eb52ee", "http-get.verb": "GET", "http-get.client": ["Cookie"]}}, "ip": 1728996619, "http": {"status": 404, "robots_hash": null, "redirects": [], "securitytxt": null, "title": null, "sitemap_hash": null, "robots": null, "server": null, "headers_hash": 2129120964, "host": "103.14.101.11", "html": "", "location": "/", "html_hash": 0, "sitemap": null, "securitytxt_hash": null}, "port": 443, "transport": "tcp", "location": {"city": "Hong Kong", "region_code": "", "area_code": null, "longitude": 114.17469, "latitude": 22.27832, "country_code": "HK", "country_name": "Hong Kong"}, "product": "Cobalt Strike Beacon", "hash": -2080380603, "tags": ["self-signed"], "timestamp": "2023-08-21T22:48:20.991662", "ssl": {"chain_sha256": ["87f2085c32b6a2cc709b365f55873e207a9caa10bffecf2fd16d3cf9d94d390c"], "jarm": "2ad2ad16d2ad2ad00042d42d00042ddb04deffa1705e2edc44cae1ed24a4da", "chain": ["-----BEGIN CERTIFICATE-----\nMIIDIzCCAgugAwIBAgIECLsA7jANBgkqhkiG9w0BAQsFADBCMQkwBwYDVQQGEwAx\nCTAHBgNVBAgTADEJMAcGA1UEBxMAMQkwBwYDVQQKEwAxCTAHBgNVBAsTADEJMAcG\nA1UEAxMAMB4XDTE1MDUyMDE4MjYyNFoXDTI1MDUxNzE4MjYyNFowQjEJMAcGA1UE\nBhMAMQkwBwYDVQQIEwAxCTAHBgNVBAcTADEJMAcGA1UEChMAMQkwBwYDVQQLEwAx\nCTAHBgNVBAMTADCCASIwDQYJKoZIhvcNAQEBBQADggEPADCCAQoCggEBAJjXGpNx\njm97YowJUxMyM/QBjGTnyUqMXt1IsXArVdop3F/fGdhsmWkExTt8AfjWm9TL2I3K\nCVKqBhQ9U8+W+l3JAPNaqLnOqRSfeQ+SQ0tmLuVn1AVQt1RKYZGo+o70G/yAXBNw\nCQ3mUisLe6Ln926E3seZM6gb8HesF/w+2sCcQ2UaqLY3hKVIDYvlenNaNMxtaw+8\nA/3udT+pIX1JyrlIlt0SDg5Ya2opwYTFJM64KbuyDKkK213A5Sz00Rh13PVRKWlp\nfVtgoh9BNupzJOG/GE/x0XmXCYAOIGrm8uujAtUWJ5nkbaczf2ldnITJBw+3iQrt\nE1LEM8aUJeKRCVkCAwEAAaMhMB8wHQYDVR0OBBYEFHNrXtvPyRkdW9AfjOOrVjgY\nnwJPMA0GCSqGSIb3DQEBCwUAA4IBAQBU9S+o9YRFBTzcCeZ4phipmwJ9PsIFKoid\ngkTekbt3EzyL+Q+nySQ/Gn4ZXdliFYxKNcRmxbSWCa9jX6qJb6t7gcLBP8Hp7kWL\nsNdbk19+iSDphVfO6UdL6ZVIbIy0vNO0/LgEKVi7tzE84elcaS45ZSPY+HnySF2s\nP3SF0n9iF/bWdzYOjLcPpgavsT66KLrileXkYjCWFOXufnZgpf11pGd3wTJEIenS\nabc90LQ4rAvBJPicY/AfhIth/g4GiDG+M1DmzlV+1F0nNr3KuNGjeghLVegKoRq/\nb5PF+0kpSK7HUwIdrgZsqz1ORsMToEyv8LvxIyL0DTCLBJSHmgJy\n-----END CERTIFICATE-----\n"], "dhparams": {"prime": "ffffffffffffffffc90fdaa22168c234c4c6628b80dc1cd129024e088a67cc74020bbea63b139b22514a08798e3404ddef9519b3cd3a431b302b0a6df25f14374fe1356d6d51c245e485b576625e7ec6f44c42e9a637ed6b0bff5cb6f406b7edee386bfb5a899fa5ae9f24117c4b1fe649286651ece65381ffffffffffffffff", "public_key": "2d635503d3739ebf51da65c8513221cc1b57f0e62c13ff6f47bcbeb98b23bcf783fd5fc7d565a5ea5d8c6527adc8a9e76b8c5948f4e86814bedce11d85e408b194ba908e72b34a2159e5a3c041d17b55b9a94bdd7fb361762744089f390a3b1dcbf9b225658b92ae19e959ba9ed95c0d590e7d07419d957000aeeecc6e2fccbe", "bits": 1024, "generator": 2, "fingerprint": "RFC2409/Oakley Group 2"}, "versions": ["-TLSv1", "-SSLv2", "-SSLv3", "-TLSv1.1", "TLSv1.2", "TLSv1.3"], "acceptable_cas": [], "tlsext": [{"id": 43, "name": "supported_versions"}, {"id": 51, "name": "key_share"}, {"id": 10, "name": "supported_groups"}], "ja3s": "f03a69cfa3944d6d51bc52febd87a1a8", "cert": {"sig_alg": "sha256WithRSAEncryption", "issued": "20150520182624Z", "expires": "20250517182624Z", "expired": false, "version": 2, "extensions": [{"data": "\\x04\\x14sk^\\xdb\\xcf\\xc9\\x19\\x1d[\\xd0\\x1f\\x8c\\xe3\\xabV8\\x18\\x9f\\x02O", "name": "subjectKeyIdentifier"}], "fingerprint": {"sha256": "87f2085c32b6a2cc709b365f55873e207a9caa10bffecf2fd16d3cf9d94d390c", "sha1": "6ece5ece4192683d2d84e25b0ba7e04f9cb7eb7c"}, "serial": 146473198, "subject": {"C": "", "CN": "", "L": "", "O": "", "ST": "", "OU": ""}, "pubkey": {"type": "rsa", "bits": 2048}, "issuer": {"C": "", "CN": "", "L": "", "O": "", "ST": "", "OU": ""}}, "cipher": {"version": "TLSv1.3", "bits": 256, "name": "TLS_AES_256_GCM_SHA384"}, "trust": {"revoked": false, "browser": null}, "handshake_states": ["before SSL initialization", "SSLv3/TLS write client hello", "SSLv3/TLS read server hello", "TLSv1.3 read encrypted extensions", "SSLv3/TLS read server certificate", "TLSv1.3 read server certificate verify", "SSLv3/TLS read finished", "SSLv3/TLS write change cipher spec", "SSLv3/TLS write finished", "SSL negotiation finished successfully"], "alpn": [], "ocsp": {}}, "hostnames": [], "org": "Asia Pacific Network Information Centre", "data": "HTTP/1.1 404 Not Found\r\nDate: Mon, 21 Aug 2023 22:48:20 GMT\r\nContent-Type: text/plain\r\nContent-Length: 0\r\n\r\n\nCobalt Strike Beacon:\n  x86:\n    beacon_type: HTTPS\n    dns-beacon.strategy_fail_seconds: -1\n    dns-beacon.strategy_fail_x: -1\n    dns-beacon.strategy_rotate_seconds: -1\n    http-get.client:\n      Cookie\n    http-get.uri: 123.253.227.74,/pixel.gif\n    http-get.verb: GET\n    http-post.client:\n      Content-Type: application/octet-stream\n      id\n    http-post.uri: /submit.php\n    http-post.verb: POST\n    maxgetsize: 1048576\n    port: 443\n    post-ex.spawnto_x64: %windir%\\sysnative\\rundll32.exe\n    post-ex.spawnto_x86: %windir%\\syswow64\\rundll32.exe\n    process-inject.execute:\n      CreateThread\n      SetThreadContext\n      CreateRemoteThread\n      RtlCreateUserThread\n    process-inject.startrwx: 64\n    process-inject.stub: e43a1b63f09794f74d90a9889f7acb77\n    process-inject.userwx: 64\n    proxy.behavior: 2 (Use IE settings)\n    server.publickey_md5: 2c835b3a7d8541b35e9c2de9b2eb52ee\n    sleeptime: 60000\n    useragent_header: Mozilla/5.0 (compatible; MSIE 9.0; Windows NT 6.1; WOW64; Trident/5.0; FunWebProducts)\n    uses_cookies: 1\n    watermark: 987654321\n  x64:\n    beacon_type: HTTPS\n    dns-beacon.strategy_fail_seconds: -1\n    dns-beacon.strategy_fail_x: -1\n    dns-beacon.strategy_rotate_seconds: -1\n    http-get.client:\n      Cookie\n    http-get.uri: 123.253.227.74,/IE9CompatViewList.xml\n    http-get.verb: GET\n    http-post.client:\n      Content-Type: application/octet-stream\n      id\n    http-post.uri: /submit.php\n    http-post.verb: POST\n    maxgetsize: 1048576\n    port: 443\n    post-ex.spawnto_x64: %windir%\\sysnative\\rundll32.exe\n    post-ex.spawnto_x86: %windir%\\syswow64\\rundll32.exe\n    process-inject.execute:\n      CreateThread\n      SetThreadContext\n      CreateRemoteThread\n      RtlCreateUserThread\n    process-inject.startrwx: 64\n    process-inject.stub: e43a1b63f09794f74d90a9889f7acb77\n    process-inject.userwx: 64\n    proxy.behavior: 2 (Use IE settings)\n    server.publickey_md5: 2c835b3a7d8541b35e9c2de9b2eb52ee\n    sleeptime: 60000\n    useragent_header: Mozilla/5.0 (compatible; MSIE 9.0; Windows NT 6.1; WOW64; Trident/5.0; yie9)\n    uses_cookies: 1\n    watermark: 987654321\n", "asn": "AS133178", "cpe23": ["cpe:2.3:a:helpsystems:cobalt_strike"], "isp": "SAITEIDC Limited", "cpe": ["cpe:/a:helpsystems:cobalt_strike"], "domains": [], "ip_str": "103.14.101.11", "os": null, "_shodan": {"region": "na", "ptr": true, "module": "https", "id": "0d80038b-a142-4b81-98c4-ed0e0168e194", "options": {}, "crawler": "21255b11b05f5ce2a4cf82d3f9ebb017a5a1fdd1"}, "opts": {"vulns": [], "heartbleed": "2023/08/21 22:48:44 103.14.101.11:443 - SAFE\n"}}
{"cobalt_strike_beacon": {"x86": {"beacon_type": "HTTPS", "dns-beacon.strategy_rotate_seconds": -1, "useragent_header": "Mozilla/5.0 (compatible; MSIE 10.0; Windows NT 6.1; WOW64; Trident/6.0)", "http-post.client": ["Content-Type: application/octet-stream", "id"], "maxgetsize": 1048576, "post-ex.spawnto_x86": "%windir%\\syswow64\\rundll32.exe", "port": 8443, "sleeptime": 60000, "uses_cookies": 1, "proxy.behavior": "2 (Use IE settings)", "process-inject.execute": ["CreateThread", "SetThreadContext", "CreateRemoteThread", "RtlCreateUserThread"], "process-inject.startrwx": 64, "post-ex.spawnto_x64": "%windir%\\sysnative\\rundll32.exe", "process-inject.stub": "30c0eee4f63e95d41b02a2c1da5d509c", "http-get.uri": "cs.125nmlx-op125.top,/pixel.gif", "watermark": 1234567890, "dns-beacon.strategy_fail_seconds": -1, "process-inject.userwx": 64, "dns-beacon.strategy_fail_x": -1, "http-post.verb": "POST", "http-post.uri": "/submit.php", "server.publickey_md5": "47de5bc067e7f9528907a2c8feacc4e4", "http-get.verb": "GET", "http-get.client": ["Cookie"]}, "x64": {"beacon_type": "HTTPS", "dns-beacon.strategy_rotate_seconds": -1, "useragent_header": "Mozilla/5.0 (compatible; MSIE 10.0; Windows NT 6.2; WOW64; Trident/6.0; Touch; MASPJS)", "http-post.client": ["Content-Type: application/octet-stream", "id"], "maxgetsize": 1048576, "post-ex.spawnto_x86": "%windir%\\syswow64\\rundll32.exe", "port": 8443, "sleeptime": 60000, "uses_cookies": 1, "proxy.behavior": "2 (Use IE settings)", "process-inject.execute": ["CreateThread", "SetThreadContext", "CreateRemoteThread", "RtlCreateUserThread"], "process-inject.startrwx": 64, "post-ex.spawnto_x64": "%windir%\\sysnative\\rundll32.exe", "process-inject.stub": "30c0eee4f63e95d41b02a2c1da5d509c", "http-get.uri": "cs.125nmlx-op125.top,/updates.rss", "watermark": 1234567890, "dns-beacon.strategy_fail_seconds": -1, "process-inject.userwx": 64, "dns-beacon.strategy_fail_x": -1, "http-post.verb": "POST", "http-post.uri": "/submit.php", "server.publickey_md5": "47de5bc067e7f9528907a2c8feacc4e4", "http-get.verb": "GET", "http-get.client": ["Cookie"]}}, "ip": 576507519, "http": {"status": 404, "robots_hash": null, "redirects": [], "securitytxt": null, "title": null, "sitemap_hash": null, "robots": null, "server": null, "headers_hash": 2129120964, "host": "34.92.206.127", "html": "", "location": "/", "html_hash": 0, "sitemap": null, "securitytxt_hash": null}, "port": 8443, "transport": "tcp", "cloud": {"region": "asia-east2", "service": null, "provider": "Google"}, "location": {"city": "Hong Kong", "region_code": "", "area_code": null, "longitude": 114.17469, "latitude": 22.27832, "country_code": "HK", "country_name": "Hong Kong"}, "product": "Cobalt Strike Beacon", "hash": -223033893, "tags": ["cloud", "self-signed"], "timestamp": "2023-08-19T12:34:12.556929", "ssl": {"chain_sha256": ["87f2085c32b6a2cc709b365f55873e207a9caa10bffecf2fd16d3cf9d94d390c"], "jarm": "07d14d16d21d21d00042d41d00041d47e4e0ae17960b2a5b4fd6107fbb0926", "chain": ["-----BEGIN CERTIFICATE-----\nMIIDIzCCAgugAwIBAgIECLsA7jANBgkqhkiG9w0BAQsFADBCMQkwBwYDVQQGEwAx\nCTAHBgNVBAgTADEJMAcGA1UEBxMAMQkwBwYDVQQKEwAxCTAHBgNVBAsTADEJMAcG\nA1UEAxMAMB4XDTE1MDUyMDE4MjYyNFoXDTI1MDUxNzE4MjYyNFowQjEJMAcGA1UE\nBhMAMQkwBwYDVQQIEwAxCTAHBgNVBAcTADEJMAcGA1UEChMAMQkwBwYDVQQLEwAx\nCTAHBgNVBAMTADCCASIwDQYJKoZIhvcNAQEBBQADggEPADCCAQoCggEBAJjXGpNx\njm97YowJUxMyM/QBjGTnyUqMXt1IsXArVdop3F/fGdhsmWkExTt8AfjWm9TL2I3K\nCVKqBhQ9U8+W+l3JAPNaqLnOqRSfeQ+SQ0tmLuVn1AVQt1RKYZGo+o70G/yAXBNw\nCQ3mUisLe6Ln926E3seZM6gb8HesF/w+2sCcQ2UaqLY3hKVIDYvlenNaNMxtaw+8\nA/3udT+pIX1JyrlIlt0SDg5Ya2opwYTFJM64KbuyDKkK213A5Sz00Rh13PVRKWlp\nfVtgoh9BNupzJOG/GE/x0XmXCYAOIGrm8uujAtUWJ5nkbaczf2ldnITJBw+3iQrt\nE1LEM8aUJeKRCVkCAwEAAaMhMB8wHQYDVR0OBBYEFHNrXtvPyRkdW9AfjOOrVjgY\nnwJPMA0GCSqGSIb3DQEBCwUAA4IBAQBU9S+o9YRFBTzcCeZ4phipmwJ9PsIFKoid\ngkTekbt3EzyL+Q+nySQ/Gn4ZXdliFYxKNcRmxbSWCa9jX6qJb6t7gcLBP8Hp7kWL\nsNdbk19+iSDphVfO6UdL6ZVIbIy0vNO0/LgEKVi7tzE84elcaS45ZSPY+HnySF2s\nP3SF0n9iF/bWdzYOjLcPpgavsT66KLrileXkYjCWFOXufnZgpf11pGd3wTJEIenS\nabc90LQ4rAvBJPicY/AfhIth/g4GiDG+M1DmzlV+1F0nNr3KuNGjeghLVegKoRq/\nb5PF+0kpSK7HUwIdrgZsqz1ORsMToEyv8LvxIyL0DTCLBJSHmgJy\n-----END CERTIFICATE-----\n"], "dhparams": {"prime": "ffffffffffffffffc90fdaa22168c234c4c6628b80dc1cd129024e088a67cc74020bbea63b139b22514a08798e3404ddef9519b3cd3a431b302b0a6df25f14374fe1356d6d51c245e485b576625e7ec6f44c42e9a637ed6b0bff5cb6f406b7edee386bfb5a899fa5ae9f24117c4b1fe649286651ece65381ffffffffffffffff", "public_key": "6a9922314c5ce8b3a430ed3a677fda95c77f2b1106caa85f7fb8139335b03322129a5881c137bb3e6c3b88d9d5b331b7ff5692efe1e26fad9b0ca1cf8aa396f6d8d1fddca04fa976852e265668afa47ae53fa186ae0d6d9aec3afe61c2d3a08209e940adcd19ed87686fa0dc9f05f8f33acf38ee713fe795ed1bf60f1958f27e", "bits": 1024, "generator": 2, "fingerprint": "RFC2409/Oakley Group 2"}, "versions": ["-TLSv1", "-SSLv2", "-SSLv3", "-TLSv1.1", "TLSv1.2"], "acceptable_cas": [], "tlsext": [{"id": 43, "name": "supported_versions"}, {"id": 44, "name": "unknown"}, {"id": 51, "name": "key_share"}, {"id": 43, "name": "supported_versions"}, {"id": 51, "name": "key_share"}, {"id": 10, "name": "supported_groups"}], "ja3s": "fef5599f0a3662839aeb1f3c854eba06", "cert": {"sig_alg": "sha256WithRSAEncryption", "issued": "20150520182624Z", "expires": "20250517182624Z", "expired": false, "version": 2, "extensions": [{"data": "\\x04\\x14sk^\\xdb\\xcf\\xc9\\x19\\x1d[\\xd0\\x1f\\x8c\\xe3\\xabV8\\x18\\x9f\\x02O", "name": "subjectKeyIdentifier"}], "fingerprint": {"sha256": "87f2085c32b6a2cc709b365f55873e207a9caa10bffecf2fd16d3cf9d94d390c", "sha1": "6ece5ece4192683d2d84e25b0ba7e04f9cb7eb7c"}, "serial": 146473198, "subject": {"C": "", "CN": "", "L": "", "O": "", "ST": "", "OU": ""}, "pubkey": {"type": "rsa", "bits": 2048}, "issuer": {"C": "", "CN": "", "L": "", "O": "", "ST": "", "OU": ""}}, "cipher": {"version": "TLSv1.3", "bits": 256, "name": "TLS_AES_256_GCM_SHA384"}, "trust": {"revoked": false, "browser": null}, "handshake_states": ["before SSL initialization", "SSLv3/TLS write client hello", "SSLv3/TLS read server hello", "SSLv3/TLS write change cipher spec", "SSLv3/TLS write client hello", "SSLv3/TLS read server hello", "TLSv1.3 read encrypted extensions", "SSLv3/TLS read server certificate", "TLSv1.3 read server certificate verify", "SSLv3/TLS read finished", "SSLv3/TLS write finished", "SSL negotiation finished successfully"], "alpn": [], "ocsp": {}}, "hostnames": ["127.206.92.34.bc.googleusercontent.com"], "org": "Google LLC", "data": "HTTP/1.1 404 Not Found\r\nDate: Sat, 19 Aug 2023 12:34:12 GMT\r\nContent-Type: text/plain\r\nContent-Length: 0\r\n\r\n\nCobalt Strike Beacon:\n  x86:\n    beacon_type: HTTPS\n    dns-beacon.strategy_fail_seconds: -1\n    dns-beacon.strategy_fail_x: -1\n    dns-beacon.strategy_rotate_seconds: -1\n    http-get.client:\n      Cookie\n    http-get.uri: cs.125nmlx-op125.top,/pixel.gif\n    http-get.verb: GET\n    http-post.client:\n      Content-Type: application/octet-stream\n      id\n    http-post.uri: /submit.php\n    http-post.verb: POST\n    maxgetsize: 1048576\n    port: 8443\n    post-ex.spawnto_x64: %windir%\\sysnative\\rundll32.exe\n    post-ex.spawnto_x86: %windir%\\syswow64\\rundll32.exe\n    process-inject.execute:\n      CreateThread\n      SetThreadContext\n      CreateRemoteThread\n      RtlCreateUserThread\n    process-inject.startrwx: 64\n    process-inject.stub: 30c0eee4f63e95d41b02a2c1da5d509c\n    process-inject.userwx: 64\n    proxy.behavior: 2 (Use IE settings)\n    server.publickey_md5: 47de5bc067e7f9528907a2c8feacc4e4\n    sleeptime: 60000\n    useragent_header: Mozilla/5.0 (compatible; MSIE 10.0; Windows NT 6.1; WOW64; Trident/6.0)\n    uses_cookies: 1\n    watermark: 1234567890\n  x64:\n    beacon_type: HTTPS\n    dns-beacon.strategy_fail_seconds: -1\n    dns-beacon.strategy_fail_x: -1\n    dns-beacon.strategy_rotate_seconds: -1\n    http-get.client:\n      Cookie\n    http-get.uri: cs.125nmlx-op125.top,/updates.rss\n    http-get.verb: GET\n    http-post.client:\n      Content-Type: application/octet-stream\n      id\n    http-post.uri: /submit.php\n    http-post.verb: POST\n    maxgetsize: 1048576\n    port: 8443\n    post-ex.spawnto_x64: %windir%\\sysnative\\rundll32.exe\n    post-ex.spawnto_x86: %windir%\\syswow64\\rundll32.exe\n    process-inject.execute:\n      CreateThread\n      SetThreadContext\n      CreateRemoteThread\n      RtlCreateUserThread\n    process-inject.startrwx: 64\n    process-inject.stub: 30c0eee4f63e95d41b02a2c1da5d509c\n    process-inject.userwx: 64\n    proxy.behavior: 2 (Use IE settings)\n    server.publickey_md5: 47de5bc067e7f9528907a2c8feacc4e4\n    sleeptime: 60000\n    useragent_header: Mozilla/5.0 (compatible; MSIE 10.0; Windows NT 6.2; WOW64; Trident/6.0; Touch; MASPJS)\n    uses_cookies: 1\n    watermark: 1234567890\n", "asn": "AS396982", "isp": "Google LLC", "domains": ["googleusercontent.com"], "ip_str": "34.92.206.127", "os": null, "_shodan": {"region": "eu", "ptr": true, "module": "https", "id": "4dd72ee3-a2db-42c4-a14f-335c9bc08e97", "options": {}, "crawler": "487814a778c983e2dcef234806292d88c5cbf3ec"}, "opts": {"vulns": [], "heartbleed": "2023/08/19 12:34:29 34.92.206.127:8443 - SAFE\n"}}
{"hash": 1504212646, "cobalt_strike_beacon": {"x86": {"beacon_type": "HTTP", "dns-beacon.strategy_rotate_seconds": -1, "useragent_header": "Mozilla/4.0 (compatible; MSIE 8.0; Windows NT 5.1; Trident/4.0; BTRS125526)", "http-post.client": ["Content-Type: application/octet-stream", "id"], "maxgetsize": 1048576, "post-ex.spawnto_x86": "%windir%\\syswow64\\rundll32.exe", "port": 6666, "sleeptime": 60000, "uses_cookies": 1, "proxy.behavior": "2 (Use IE settings)", "process-inject.execute": ["CreateThread", "SetThreadContext", "CreateRemoteThread", "RtlCreateUserThread"], "process-inject.startrwx": 64, "post-ex.spawnto_x64": "%windir%\\sysnative\\rundll32.exe", "process-inject.stub": "b50b86d735412685eb6044ad8d01781c", "http-get.uri": "23.224.61.90,/dpixel", "watermark": 391144938, "dns-beacon.strategy_fail_seconds": -1, "process-inject.userwx": 64, "dns-beacon.strategy_fail_x": -1, "http-post.verb": "POST", "http-post.uri": "/submit.php", "server.publickey_md5": "4d0d8d7b4fa0ab6cdb68e740633948de", "http-get.verb": "GET", "http-get.client": ["Cookie"]}, "x64": {"beacon_type": "HTTP", "dns-beacon.strategy_rotate_seconds": -1, "useragent_header": "Mozilla/5.0 (compatible; MSIE 9.0; Windows NT 6.1; WOW64; Trident/5.0; MALCJS)", "http-post.client": ["Content-Type: application/octet-stream", "id"], "maxgetsize": 1048576, "post-ex.spawnto_x86": "%windir%\\syswow64\\rundll32.exe", "port": 6666, "sleeptime": 60000, "uses_cookies": 1, "proxy.behavior": "2 (Use IE settings)", "process-inject.execute": ["CreateThread", "SetThreadContext", "CreateRemoteThread", "RtlCreateUserThread"], "process-inject.startrwx": 64, "post-ex.spawnto_x64": "%windir%\\sysnative\\rundll32.exe", "process-inject.stub": "b50b86d735412685eb6044ad8d01781c", "http-get.uri": "23.224.61.90,/cm", "watermark": 391144938, "dns-beacon.strategy_fail_seconds": -1, "process-inject.userwx": 64, "dns-beacon.strategy_fail_x": -1, "http-post.verb": "POST", "http-post.uri": "/submit.php", "server.publickey_md5": "4d0d8d7b4fa0ab6cdb68e740633948de", "http-get.verb": "GET", "http-get.client": ["Cookie"]}}, "product": "Cobalt Strike Beacon", "http": {"status": 404, "robots_hash": null, "redirects": [], "securitytxt": null, "title": null, "sitemap_hash": null, "robots": null, "server": null, "headers_hash": 2129120964, "host": "23.224.61.90", "html": "", "location": "/", "html_hash": 0, "sitemap": null, "securitytxt_hash": null}, "os": null, "timestamp": "2023-08-16T05:03:58.663212", "isp": "CNSERVERS LLC", "transport": "tcp", "_shodan": {"region": "eu", "ptr": true, "module": "auto", "id": "8743a047-af65-4c86-a6ba-0ecc78a7afe4", "options": {}, "crawler": "487814a778c983e2dcef234806292d88c5cbf3ec"}, "asn": "AS40065", "hostnames": [], "location": {"city": "Los Angeles", "region_code": "CA", "area_code": null, "longitude": -118.24368, "latitude": 34.05223, "country_code": "US", "country_name": "United States"}, "ip": 400571738, "domains": [], "org": "CloudRadium L.L.C", "data": "HTTP/1.1 404 Not Found\r\nDate: Wed, 16 Aug 2023 05:03:58 GMT\r\nContent-Type: text/plain\r\nContent-Length: 0\r\n\r\n\nCobalt Strike Beacon:\n  x86:\n    beacon_type: HTTP\n    dns-beacon.strategy_fail_seconds: -1\n    dns-beacon.strategy_fail_x: -1\n    dns-beacon.strategy_rotate_seconds: -1\n    http-get.client:\n      Cookie\n    http-get.uri: 23.224.61.90,/dpixel\n    http-get.verb: GET\n    http-post.client:\n      Content-Type: application/octet-stream\n      id\n    http-post.uri: /submit.php\n    http-post.verb: POST\n    maxgetsize: 1048576\n    port: 6666\n    post-ex.spawnto_x64: %windir%\\sysnative\\rundll32.exe\n    post-ex.spawnto_x86: %windir%\\syswow64\\rundll32.exe\n    process-inject.execute:\n      CreateThread\n      SetThreadContext\n      CreateRemoteThread\n      RtlCreateUserThread\n    process-inject.startrwx: 64\n    process-inject.stub: b50b86d735412685eb6044ad8d01781c\n    process-inject.userwx: 64\n    proxy.behavior: 2 (Use IE settings)\n    server.publickey_md5: 4d0d8d7b4fa0ab6cdb68e740633948de\n    sleeptime: 60000\n    useragent_header: Mozilla/4.0 (compatible; MSIE 8.0; Windows NT 5.1; Trident/4.0; BTRS125526)\n    uses_cookies: 1\n    watermark: 391144938\n  x64:\n    beacon_type: HTTP\n    dns-beacon.strategy_fail_seconds: -1\n    dns-beacon.strategy_fail_x: -1\n    dns-beacon.strategy_rotate_seconds: -1\n    http-get.client:\n      Cookie\n    http-get.uri: 23.224.61.90,/cm\n    http-get.verb: GET\n    http-post.client:\n      Content-Type: application/octet-stream\n      id\n    http-post.uri: /submit.php\n    http-post.verb: POST\n    maxgetsize: 1048576\n    port: 6666\n    post-ex.spawnto_x64: %windir%\\sysnative\\rundll32.exe\n    post-ex.spawnto_x86: %windir%\\syswow64\\rundll32.exe\n    process-inject.execute:\n      CreateThread\n      SetThreadContext\n      CreateRemoteThread\n      RtlCreateUserThread\n    process-inject.startrwx: 64\n    process-inject.stub: b50b86d735412685eb6044ad8d01781c\n    process-inject.userwx: 64\n    proxy.behavior: 2 (Use IE settings)\n    server.publickey_md5: 4d0d8d7b4fa0ab6cdb68e740633948de\n    sleeptime: 60000\n    useragent_header: Mozilla/5.0 (compatible; MSIE 9.0; Windows NT 6.1; WOW64; Trident/5.0; MALCJS)\n    uses_cookies: 1\n    watermark: 391144938\n", "port": 6666, "opts": {}, "ip_str": "23.224.61.90"}
{"hash": 526238911, "cobalt_strike_beacon": {"x86": {"beacon_type": "HTTP", "jitter": 39, "dns-beacon.strategy_rotate_seconds": -1, "useragent_header": "Mozilla/5.0 (Windows NT 6.1; WOW64) AppleWebKit/537.36 (KHTML, like Gecko) Chrome/47.0.2526.111 Safari/537.36", "http-post.client": ["Host: eapdns.com", "Connection: close", "Content-Type: text/plain", "__session__id=", "Cookie"], "maxgetsize": 1864474, "process-inject.min_alloc": 18250, "post-ex.spawnto_x86": "%windir%\\syswow64\\WUAUCLT.exe", "port": 80, "sleeptime": 64919, "uses_cookies": 1, "proxy.behavior": "2 (Use IE settings)", "process-inject.execute": ["CreateThread", "RtlCreateUserThread", "CreateRemoteThread"], "process-inject.startrwx": 4, "post-ex.spawnto_x64": "%windir%\\sysnative\\WUAUCLT.exe", "process-inject.stub": "c54eed2fbdc9655c0c13550f04c72c28", "http-get.uri": "eapdns.com,/zh", "watermark": 674054486, "dns-beacon.strategy_fail_seconds": -1, "server.publickey_md5": "5b00c1cc8bd0b57f9d42e22bf7571b6b", "dns-beacon.strategy_fail_x": -1, "stage.cleanup": 1, "http-post.verb": "POST", "http-post.uri": "/ba", "process-inject.userwx": 32, "http-get.verb": "GET", "http-get.client": ["Host: eapdns.com", "Connection: close", "Accept: image/jpeg", "Accept-Language: fr-CH, fr;q=0.9, en;q=0.8, de;q=0.7, *;q=0.5", "HSID=", "Cookie", "phpThumbDebug=true"]}, "x64": {"beacon_type": "HTTP", "jitter": 39, "dns-beacon.strategy_rotate_seconds": -1, "useragent_header": "Mozilla/5.0 (Windows NT 6.1; WOW64) AppleWebKit/537.36 (KHTML, like Gecko) Chrome/47.0.2526.111 Safari/537.36", "http-post.client": ["Host: eapdns.com", "Connection: close", "Content-Type: text/plain", "__session__id=", "Cookie"], "maxgetsize": 1864474, "process-inject.min_alloc": 18250, "post-ex.spawnto_x86": "%windir%\\syswow64\\WUAUCLT.exe", "port": 80, "sleeptime": 64919, "uses_cookies": 1, "proxy.behavior": "2 (Use IE settings)", "process-inject.execute": ["CreateThread", "RtlCreateUserThread", "CreateRemoteThread"], "process-inject.startrwx": 4, "post-ex.spawnto_x64": "%windir%\\sysnative\\WUAUCLT.exe", "process-inject.stub": "c54eed2fbdc9655c0c13550f04c72c28", "http-get.uri": "eapdns.com,/mk", "watermark": 674054486, "dns-beacon.strategy_fail_seconds": -1, "server.publickey_md5": "5b00c1cc8bd0b57f9d42e22bf7571b6b", "dns-beacon.strategy_fail_x": -1, "stage.cleanup": 1, "http-post.verb": "POST", "http-post.uri": "/ba", "process-inject.userwx": 32, "http-get.verb": "GET", "http-get.client": ["Host: eapdns.com", "Connection: close", "Accept: image/jpeg", "Accept-Language: fr-CH, fr;q=0.9, en;q=0.8, de;q=0.7, *;q=0.5", "HSID=", "Cookie", "phpThumbDebug=true"]}}, "product": "Cobalt Strike Beacon", "http": {"status": 404, "robots_hash": null, "redirects": [], "securitytxt": null, "title": null, "sitemap_hash": null, "robots": null, "server": "apache", "headers_hash": 11853219, "host": "91.103.253.45", "html": "", "location": "/", "html_hash": 0, "sitemap": null, "securitytxt_hash": null}, "os": null, "timestamp": "2023-08-15T21:19:40.586260", "isp": "Shelter LLC", "transport": "tcp", "_shodan": {"region": "eu", "ptr": true, "module": "http", "id": "8f73ca08-6234-4246-953a-00c06c90bc88", "options": {}, "crawler": "bf213bc419cc8491376c12af31e32623c1b6f467"}, "asn": "AS198556", "hostnames": [], "location": {"city": "Bern", "region_code": "BE", "area_code": null, "longitude": 7.44744, "latitude": 46.94809, "country_code": "CH", "country_name": "Switzerland"}, "ip": 1533541677, "domains": [], "org": "Shelter LLC", "data": "HTTP/1.1 404 Not Found\r\nDate: Tue, 15 Aug 2023 21:19:40 GMT\r\nContent-Type: text/plain\r\nContent-Length: 0\r\nServer: apache\r\n\r\n\nCobalt Strike Beacon:\n  x86:\n    beacon_type: HTTP\n    dns-beacon.strategy_fail_seconds: -1\n    dns-beacon.strategy_fail_x: -1\n    dns-beacon.strategy_rotate_seconds: -1\n    http-get.client:\n      Host: eapdns.com\n      Connection: close\n      Accept: image/jpeg\n      Accept-Language: fr-CH, fr;q=0.9, en;q=0.8, de;q=0.7, *;q=0.5\n      HSID=\n      Cookie\n      phpThumbDebug=true\n    http-get.uri: eapdns.com,/zh\n    http-get.verb: GET\n    http-post.client:\n      Host: eapdns.com\n      Connection: close\n      Content-Type: text/plain\n      __session__id=\n      Cookie\n    http-post.uri: /ba\n    http-post.verb: POST\n    jitter: 39\n    maxgetsize: 1864474\n    port: 80\n    post-ex.spawnto_x64: %windir%\\sysnative\\WUAUCLT.exe\n    post-ex.spawnto_x86: %windir%\\syswow64\\WUAUCLT.exe\n    process-inject.execute:\n      CreateThread\n      RtlCreateUserThread\n      CreateRemoteThread\n    process-inject.min_alloc: 18250\n    process-inject.startrwx: 4\n    process-inject.stub: c54eed2fbdc9655c0c13550f04c72c28\n    process-inject.userwx: 32\n    proxy.behavior: 2 (Use IE settings)\n    server.publickey_md5: 5b00c1cc8bd0b57f9d42e22bf7571b6b\n    sleeptime: 64919\n    stage.cleanup: 1\n    useragent_header: Mozilla/5.0 (Windows NT 6.1; WOW64) AppleWebKit/537.36 (KHTML, like Gecko) Chrome/47.0.2526.111 Safari/537.36\n    uses_cookies: 1\n    watermark: 674054486\n  x64:\n    beacon_type: HTTP\n    dns-beacon.strategy_fail_seconds: -1\n    dns-beacon.strategy_fail_x: -1\n    dns-beacon.strategy_rotate_seconds: -1\n    http-get.client:\n      Host: eapdns.com\n      Connection: close\n      Accept: image/jpeg\n      Accept-Language: fr-CH, fr;q=0.9, en;q=0.8, de;q=0.7, *;q=0.5\n      HSID=\n      Cookie\n      phpThumbDebug=true\n    http-get.uri: eapdns.com,/mk\n    http-get.verb: GET\n    http-post.client:\n      Host: eapdns.com\n      Connection: close\n      Content-Type: text/plain\n      __session__id=\n      Cookie\n    http-post.uri: /ba\n    http-post.verb: POST\n    jitter: 39\n    maxgetsize: 1864474\n    port: 80\n    post-ex.spawnto_x64: %windir%\\sysnative\\WUAUCLT.exe\n    post-ex.spawnto_x86: %windir%\\syswow64\\WUAUCLT.exe\n    process-inject.execute:\n      CreateThread\n      RtlCreateUserThread\n      CreateRemoteThread\n    process-inject.min_alloc: 18250\n    process-inject.startrwx: 4\n    process-inject.stub: c54eed2fbdc9655c0c13550f04c72c28\n    process-inject.userwx: 32\n    proxy.behavior: 2 (Use IE settings)\n    server.publickey_md5: 5b00c1cc8bd0b57f9d42e22bf7571b6b\n    sleeptime: 64919\n    stage.cleanup: 1\n    useragent_header: Mozilla/5.0 (Windows NT 6.1; WOW64) AppleWebKit/537.36 (KHTML, like Gecko) Chrome/47.0.2526.111 Safari/537.36\n    uses_cookies: 1\n    watermark: 674054486\n", "port": 80, "opts": {}, "ip_str": "91.103.253.45"}
{"hash": 1166369814, "cobalt_strike_beacon": {"x86": {"beacon_type": "HTTP", "dns-beacon.strategy_rotate_seconds": -1, "useragent_header": "Mozilla/5.0 (compatible; MSIE 10.0; Windows NT 6.1; WOW64; Trident/6.0)", "http-post.client": ["Content-Type: application/octet-stream", "id"], "maxgetsize": 1048576, "post-ex.spawnto_x86": "%windir%\\syswow64\\rundll32.exe", "port": 81, "sleeptime": 60000, "uses_cookies": 1, "proxy.behavior": "2 (Use IE settings)", "process-inject.execute": ["CreateThread", "SetThreadContext", "CreateRemoteThread", "RtlCreateUserThread"], "process-inject.startrwx": 64, "post-ex.spawnto_x64": "%windir%\\sysnative\\rundll32.exe", "process-inject.stub": "e43a1b63f09794f74d90a9889f7acb77", "http-get.uri": "43.133.75.73,/IE9CompatViewList.xml", "watermark": 987654321, "dns-beacon.strategy_fail_seconds": -1, "process-inject.userwx": 64, "dns-beacon.strategy_fail_x": -1, "http-post.verb": "POST", "http-post.uri": "/submit.php", "server.publickey_md5": "5a89b37dfaadf7f0d1291d90b291d046", "http-get.verb": "GET", "http-get.client": ["Cookie"]}, "x64": {"beacon_type": "HTTP", "dns-beacon.strategy_rotate_seconds": -1, "useragent_header": "Mozilla/5.0 (compatible; MSIE 9.0; Windows NT 6.0; Trident/5.0)", "http-post.client": ["Content-Type: application/octet-stream", "id"], "maxgetsize": 1048576, "post-ex.spawnto_x86": "%windir%\\syswow64\\rundll32.exe", "port": 81, "sleeptime": 60000, "uses_cookies": 1, "proxy.behavior": "2 (Use IE settings)", "process-inject.execute": ["CreateThread", "SetThreadContext", "CreateRemoteThread", "RtlCreateUserThread"], "process-inject.startrwx": 64, "post-ex.spawnto_x64": "%windir%\\sysnative\\rundll32.exe", "process-inject.stub": "e43a1b63f09794f74d90a9889f7acb77", "http-get.uri": "43.133.75.73,/pixel.gif", "watermark": 987654321, "dns-beacon.strategy_fail_seconds": -1, "process-inject.userwx": 64, "dns-beacon.strategy_fail_x": -1, "http-post.verb": "POST", "http-post.uri": "/submit.php", "server.publickey_md5": "5a89b37dfaadf7f0d1291d90b291d046", "http-get.verb": "GET", "http-get.client": ["Cookie"]}}, "product": "Cobalt Strike Beacon", "http": {"status": 404, "robots_hash": null, "redirects": [], "securitytxt": null, "title": null, "sitemap_hash": null, "robots": null, "server": null, "headers_hash": 2129120964, "host": "43.133.75.73", "html": "", "location": "/", "html_hash": 0, "sitemap": null, "securitytxt_hash": null}, "os": null, "timestamp": "2023-08-14T07:41:40.690493", "isp": "Tencent Building, Kejizhongyi Avenue", "transport": "tcp", "_shodan": {"region": "eu", "ptr": true, "module": "http-simple-new", "id": "62964754-81c0-4dd3-9554-c0e576d75a68", "options": {}, "crawler": "487814a778c983e2dcef234806292d88c5cbf3ec"}, "asn": "AS132203", "hostnames": [], "location": {"city": "Seoul", "region_code": "11", "area_code": null, "longitude": 126.9784, "latitude": 37.566, "country_code": "KR", "country_name": "Korea, Republic of"}, "ip": 730155849, "domains": [], "org": "Asia Pacific Network Information Center, Pty. Ltd.", "data": "HTTP/1.1 404 Not Found\r\nDate: Mon, 14 Aug 2023 07:41:40 GMT\r\nContent-Type: text/plain\r\nContent-Length: 0\r\n\r\n\nCobalt Strike Beacon:\n  x86:\n    beacon_type: HTTP\n    dns-beacon.strategy_fail_seconds: -1\n    dns-beacon.strategy_fail_x: -1\n    dns-beacon.strategy_rotate_seconds: -1\n    http-get.client:\n      Cookie\n    http-get.uri: 43.133.75.73,/IE9CompatViewList.xml\n    http-get.verb: GET\n    http-post.client:\n      Content-Type: application/octet-stream\n      id\n    http-post.uri: /submit.php\n    http-post.verb: POST\n    maxgetsize: 1048576\n    port: 81\n    post-ex.spawnto_x64: %windir%\\sysnative\\rundll32.exe\n    post-ex.spawnto_x86: %windir%\\syswow64\\rundll32.exe\n    process-inject.execute:\n      CreateThread\n      SetThreadContext\n      CreateRemoteThread\n      RtlCreateUserThread\n    process-inject.startrwx: 64\n    process-inject.stub: e43a1b63f09794f74d90a9889f7acb77\n    process-inject.userwx: 64\n    proxy.behavior: 2 (Use IE settings)\n    server.publickey_md5: 5a89b37dfaadf7f0d1291d90b291d046\n    sleeptime: 60000\n    useragent_header: Mozilla/5.0 (compatible; MSIE 10.0; Windows NT 6.1; WOW64; Trident/6.0)\n    uses_cookies: 1\n    watermark: 987654321\n  x64:\n    beacon_type: HTTP\n    dns-beacon.strategy_fail_seconds: -1\n    dns-beacon.strategy_fail_x: -1\n    dns-beacon.strategy_rotate_seconds: -1\n    http-get.client:\n      Cookie\n    http-get.uri: 43.133.75.73,/pixel.gif\n    http-get.verb: GET\n    http-post.client:\n      Content-Type: application/octet-stream\n      id\n    http-post.uri: /submit.php\n    http-post.verb: POST\n    maxgetsize: 1048576\n    port: 81\n    post-ex.spawnto_x64: %windir%\\sysnative\\rundll32.exe\n    post-ex.spawnto_x86: %windir%\\syswow64\\rundll32.exe\n    process-inject.execute:\n      CreateThread\n      SetThreadContext\n      CreateRemoteThread\n      RtlCreateUserThread\n    process-inject.startrwx: 64\n    process-inject.stub: e43a1b63f09794f74d90a9889f7acb77\n    process-inject.userwx: 64\n    proxy.behavior: 2 (Use IE settings)\n    server.publickey_md5: 5a89b37dfaadf7f0d1291d90b291d046\n    sleeptime: 60000\n    useragent_header: Mozilla/5.0 (compatible; MSIE 9.0; Windows NT 6.0; Trident/5.0)\n    uses_cookies: 1\n    watermark: 987654321\n", "port": 81, "opts": {}, "ip_str": "43.133.75.73"}
{"hash": -1351187727, "cobalt_strike_beacon": {"x86": {"beacon_type": "HTTP", "http-post.uri": "/submit.php", "dns-beacon.maxdns": 255, "sleeptime": 60000, "useragent_header": "Mozilla/5.0 (compatible; MSIE 9.0; Windows NT 6.0; Trident/5.0; BO1IE8_v1;ENUS)", "proxy.behavior": "2 (Use IE settings)", "maxgetsize": 1048576, "process-inject.userwx": 64, "process-inject.execute": ["CreateThread", "SetThreadContext", "CreateRemoteThread", "RtlCreateUserThread"], "process-inject.startrwx": 64, "port": 8080, "uses_cookies": 1, "server.publickey_md5": "a16fd0c930c4b0c491babab9f56c7f47", "post-ex.spawnto_x64": "%windir%\\sysnative\\rundll32.exe", "http-get.verb": "GET", "http-get.client": ["Cookie"], "post-ex.spawnto_x86": "%windir%\\syswow64\\rundll32.exe", "process-inject.stub": "187ab8f98098de95714613f8544c9613", "http-get.uri": "45.85.77.189,/fwlink", "http-post.client": ["Content-Type: application/octet-stream", "id"], "http-post.verb": "POST"}, "x64": {"beacon_type": "HTTP", "http-post.uri": "/submit.php", "dns-beacon.maxdns": 255, "sleeptime": 60000, "useragent_header": "Mozilla/5.0 (compatible; MSIE 9.0; Windows NT 6.1; WOW64; Trident/5.0; yie9)", "proxy.behavior": "2 (Use IE settings)", "maxgetsize": 1048576, "process-inject.userwx": 64, "process-inject.execute": ["CreateThread", "SetThreadContext", "CreateRemoteThread", "RtlCreateUserThread"], "process-inject.startrwx": 64, "port": 8080, "uses_cookies": 1, "server.publickey_md5": "a16fd0c930c4b0c491babab9f56c7f47", "post-ex.spawnto_x64": "%windir%\\sysnative\\rundll32.exe", "http-get.verb": "GET", "http-get.client": ["Cookie"], "post-ex.spawnto_x86": "%windir%\\syswow64\\rundll32.exe", "process-inject.stub": "187ab8f98098de95714613f8544c9613", "http-get.uri": "45.85.77.189,/visit.js", "http-post.client": ["Content-Type: application/octet-stream", "id"], "http-post.verb": "POST"}}, "product": "Cobalt Strike Beacon", "http": {"status": 404, "robots_hash": null, "redirects": [], "securitytxt": null, "title": null, "sitemap_hash": null, "robots": null, "server": null, "headers_hash": 2129120964, "host": "45.85.77.189", "html": "", "location": "/", "html_hash": 0, "sitemap": null, "securitytxt_hash": null}, "os": null, "timestamp": "2023-08-13T20:06:13.103952", "isp": "Cloudie Limited", "transport": "tcp", "_shodan": {"region": "eu", "ptr": true, "module": "http-simple-new", "id": "b68a0cdb-76a1-482b-b257-069f668aeb8f", "options": {}, "crawler": "bf213bc419cc8491376c12af31e32623c1b6f467"}, "asn": "AS55933", "hostnames": [], "location": {"city": "Hong Kong", "region_code": "", "area_code": null, "longitude": 114.17469, "latitude": 22.27832, "country_code": "HK", "country_name": "Hong Kong"}, "ip": 760565181, "domains": [], "org": "Tiger Network Limited", "data": "HTTP/1.1 404 Not Found\r\nDate: Sun, 13 Aug 2023 20:06:13 GMT\r\nContent-Type: text/plain\r\nContent-Length: 0\r\n\r\n\nCobalt Strike Beacon:\n  x86:\n    beacon_type: HTTP\n    dns-beacon.maxdns: 255\n    http-get.client:\n      Cookie\n    http-get.uri: 45.85.77.189,/fwlink\n    http-get.verb: GET\n    http-post.client:\n      Content-Type: application/octet-stream\n      id\n    http-post.uri: /submit.php\n    http-post.verb: POST\n    maxgetsize: 1048576\n    port: 8080\n    post-ex.spawnto_x64: %windir%\\sysnative\\rundll32.exe\n    post-ex.spawnto_x86: %windir%\\syswow64\\rundll32.exe\n    process-inject.execute:\n      CreateThread\n      SetThreadContext\n      CreateRemoteThread\n      RtlCreateUserThread\n    process-inject.startrwx: 64\n    process-inject.stub: 187ab8f98098de95714613f8544c9613\n    process-inject.userwx: 64\n    proxy.behavior: 2 (Use IE settings)\n    server.publickey_md5: a16fd0c930c4b0c491babab9f56c7f47\n    sleeptime: 60000\n    useragent_header: Mozilla/5.0 (compatible; MSIE 9.0; Windows NT 6.0; Trident/5.0; BO1IE8_v1;ENUS)\n    uses_cookies: 1\n  x64:\n    beacon_type: HTTP\n    dns-beacon.maxdns: 255\n    http-get.client:\n      Cookie\n    http-get.uri: 45.85.77.189,/visit.js\n    http-get.verb: GET\n    http-post.client:\n      Content-Type: application/octet-stream\n      id\n    http-post.uri: /submit.php\n    http-post.verb: POST\n    maxgetsize: 1048576\n    port: 8080\n    post-ex.spawnto_x64: %windir%\\sysnative\\rundll32.exe\n    post-ex.spawnto_x86: %windir%\\syswow64\\rundll32.exe\n    process-inject.execute:\n      CreateThread\n      SetThreadContext\n      CreateRemoteThread\n      RtlCreateUserThread\n    process-inject.startrwx: 64\n    process-inject.stub: 187ab8f98098de95714613f8544c9613\n    process-inject.userwx: 64\n    proxy.behavior: 2 (Use IE settings)\n    server.publickey_md5: a16fd0c930c4b0c491babab9f56c7f47\n    sleeptime: 60000\n    useragent_header: Mozilla/5.0 (compatible; MSIE 9.0; Windows NT 6.1; WOW64; Trident/5.0; yie9)\n    uses_cookies: 1\n", "port": 8080, "opts": {}, "ip_str": "45.85.77.189"}
{"cobalt_strike_beacon": {"x86": {"beacon_type": "HTTPS", "jitter": 39, "dns-beacon.strategy_rotate_seconds": -1, "useragent_header": "Mozilla/5.0 (Windows NT 6.1; WOW64) AppleWebKit/537.36 (KHTML, like Gecko) Chrome/47.0.2526.111 Safari/537.36", "http-post.client": ["Host: eapdns.com", "Connection: close", "Content-Type: application/x-www-form-urlencoded", "logopng=", "__session__id=", "Cookie"], "maxgetsize": 1864740, "process-inject.min_alloc": 18250, "post-ex.spawnto_x86": "%windir%\\syswow64\\WUAUCLT.exe", "port": 443, "sleeptime": 64919, "uses_cookies": 1, "proxy.behavior": "2 (Use IE settings)", "process-inject.execute": ["CreateThread", "RtlCreateUserThread", "CreateRemoteThread"], "process-inject.startrwx": 4, "post-ex.spawnto_x64": "%windir%\\sysnative\\WUAUCLT.exe", "process-inject.stub": "c54eed2fbdc9655c0c13550f04c72c28", "http-get.uri": "eapdns.com,/da.html", "watermark": 674054486, "dns-beacon.strategy_fail_seconds": -1, "server.publickey_md5": "5b00c1cc8bd0b57f9d42e22bf7571b6b", "dns-beacon.strategy_fail_x": -1, "stage.cleanup": 1, "http-post.verb": "POST", "http-post.uri": "/modcp", "process-inject.userwx": 32, "http-get.verb": "GET", "http-get.client": ["Host: eapdns.com", "Connection: close", "wordpress_logged_in=", "Cookie", "letter=false"]}, "x64": {"beacon_type": "HTTPS", "jitter": 39, "dns-beacon.strategy_rotate_seconds": -1, "useragent_header": "Mozilla/5.0 (Windows NT 6.1; WOW64) AppleWebKit/537.36 (KHTML, like Gecko) Chrome/47.0.2526.111 Safari/537.36", "http-post.client": ["Host: eapdns.com", "Connection: close", "Content-Type: application/x-www-form-urlencoded", "logopng=", "__session__id=", "Cookie"], "maxgetsize": 1864740, "process-inject.min_alloc": 18250, "post-ex.spawnto_x86": "%windir%\\syswow64\\WUAUCLT.exe", "port": 443, "sleeptime": 64919, "uses_cookies": 1, "proxy.behavior": "2 (Use IE settings)", "process-inject.execute": ["CreateThread", "RtlCreateUserThread", "CreateRemoteThread"], "process-inject.startrwx": 4, "post-ex.spawnto_x64": "%windir%\\sysnative\\WUAUCLT.exe", "process-inject.stub": "c54eed2fbdc9655c0c13550f04c72c28", "http-get.uri": "eapdns.com,/ba.html", "watermark": 674054486, "dns-beacon.strategy_fail_seconds": -1, "server.publickey_md5": "5b00c1cc8bd0b57f9d42e22bf7571b6b", "dns-beacon.strategy_fail_x": -1, "stage.cleanup": 1, "http-post.verb": "POST", "http-post.uri": "/modcp", "process-inject.userwx": 32, "http-get.verb": "GET", "http-get.client": ["Host: eapdns.com", "Connection: close", "wordpress_logged_in=", "Cookie", "letter=false"]}}, "ip": 1533541677, "http": {"status": 404, "robots_hash": null, "redirects": [], "securitytxt": null, "title": null, "sitemap_hash": null, "robots": null, "server": "apache", "headers_hash": 11853219, "host": "91.103.253.45", "html": "", "location": "/", "html_hash": 0, "sitemap": null, "securitytxt_hash": null}, "port": 443, "transport": "tcp", "location": {"city": "Bern", "region_code": "BE", "area_code": null, "longitude": 7.44744, "latitude": 46.94809, "country_code": "CH", "country_name": "Switzerland"}, "product": "Cobalt Strike Beacon", "hash": -868413027, "timestamp": "2023-08-13T16:41:40.914625", "ssl": {"chain_sha256": ["4d546415bdf893bcdea61236447c63d44a9aed774af3b8d1216950c1ecf6a732"], "jarm": "2ad2ad16d2ad2ad00042d42d00042ddb04deffa1705e2edc44cae1ed24a4da", "chain": ["-----BEGIN CERTIFICATE-----\nMIIE4DCCA8igAwIBAgISBEu+6jj6g9vFvf9DC5p7XK95MA0GCSqGSIb3DQEBCwUA\nMDIxCzAJBgNVBAYTAlVTMRYwFAYDVQQKEw1MZXQncyBFbmNyeXB0MQswCQYDVQQD\nEwJSMzAeFw0yMzA3MTgyMjA3MzRaFw0yMzEwMTYyMjA3MzNaMBUxEzARBgNVBAMT\nCmVhcGRucy5jb20wggEiMA0GCSqGSIb3DQEBAQUAA4IBDwAwggEKAoIBAQDPfu6v\nPg++4MNmKe25tz0apFGU0FjF4/DlmE+MBdwtf9N0+Rhk4nHT+jR/d2C0I4QweRN4\niwnpAgI8MtgJvApHfnvRu7UnuPIvmfe/965BQt9/HkQKib3tJvzJuNBtJqFT+gsK\nNXGUZ6fJ8XM4F15wyFtd/PP9QPA+p9FBzwHnB4MMKlwpIdS8KpIyYu9146kM3mSY\n8KPT13kpswbaTkYRXNfHYq5Fpw82AjtlwQx9v+CpUp1UK1YElqStFhV3zp1LzGox\neuPu/PpGbNCKuN10gAc5i0lN8xKiir4AyVbJLxghOnKafCsrV4oGClzq8LMrIo2O\n/MGeaRVf3jXuGXaZAgMBAAGjggILMIICBzAOBgNVHQ8BAf8EBAMCBaAwHQYDVR0l\nBBYwFAYIKwYBBQUHAwEGCCsGAQUFBwMCMAwGA1UdEwEB/wQCMAAwHQYDVR0OBBYE\nFJz2JglZVXWmXLHp8yWqexXH5u9dMB8GA1UdIwQYMBaAFBQusxe3WFbLrlAJQOYf\nr52LFMLGMFUGCCsGAQUFBwEBBEkwRzAhBggrBgEFBQcwAYYVaHR0cDovL3IzLm8u\nbGVuY3Iub3JnMCIGCCsGAQUFBzAChhZodHRwOi8vcjMuaS5sZW5jci5vcmcvMBUG\nA1UdEQQOMAyCCmVhcGRucy5jb20wEwYDVR0gBAwwCjAIBgZngQwBAgEwggEDBgor\nBgEEAdZ5AgQCBIH0BIHxAO8AdgC3Pvsk35xNunXyOcW6WPRsXfxCz3qfNcSeHQmB\nJe20mQAAAYlrQk89AAAEAwBHMEUCIHHas5PA+IDkXwl7QuLBHOrcha8SaZvmrdek\nnsWGWU4iAiEA61tIiZ8MM9h4wwc83e5nyskxeL0jgH7o2c9XaJgrrJ0AdQCt9776\nfP8QyIudPZwePhhqtGcpXc+xDCTKhYY069yCigAAAYlrQk+PAAAEAwBGMEQCIEKX\nh/lAoN47Sgv+E4N33exCHlCjeVstgX5924QHjuJVAiAnJOIgXD4Lj5L+Tr4BAf8D\n+9k+13XF6ltHU6Pbf+O+vzANBgkqhkiG9w0BAQsFAAOCAQEAfB9LeyyebYsUulj0\nqWSi349v7YUDDhkQxr5c7jMnRFmT7WhtWhmA1Ve5SxJG6cwfFHjKqptwhp7PCE3Q\nUvP6vSiQE7wshCN3Lhmb3r3HtxPrfQKTPCNUNt/iObAOkY6IzxOM7y7PNTXm7QWz\nBuRj28F8Y0PGBwldXR0unLyH2qocPqpHFTN5r7BT51hajJeepcBjncEb2neTlL1T\ncGcgw9WIWW7JabQvKn7drjXejkImZcH1LOUQcZHUfDdK75sVmArvh8HfW0dt+ms6\nDHkWGOAy6gJbmq2KjMQI3Lo6P4jn5FiBCMWLk+m1GzqEwzWInAAsDBIbQdMM+rxk\nYXZ86w==\n-----END CERTIFICATE-----\n"], "dhparams": {"prime": "ffffffffffffffffc90fdaa22168c234c4c6628b80dc1cd129024e088a67cc74020bbea63b139b22514a08798e3404ddef9519b3cd3a431b302b0a6df25f14374fe1356d6d51c245e485b576625e7ec6f44c42e9a637ed6b0bff5cb6f406b7edee386bfb5a899fa5ae9f24117c4b1fe649286651ece65381ffffffffffffffff", "public_key": "37328bb4871de88ad07951d53f8643df9b2dfe38d153df94aab81a3c3525bfbfea71c348b7e775ce7ea2dbd275b60cd51896e7dfd5c38c544df97f75e8e0d587aa7c69bc2de04d032e14f85c6ec2b039c3cb66d2d7ee8ea1eafd1129d7f474ea8854b88a507de164442ef44e432498259a104911926825223231e1d61d91c35a", "bits": 1024, "generator": 2, "fingerprint": "RFC2409/Oakley Group 2"}, "versions": ["-TLSv1", "-SSLv2", "-SSLv3", "-TLSv1.1", "TLSv1.2", "TLSv1.3"], "acceptable_cas": [], "tlsext": [{"id": 43, "name": "supported_versions"}, {"id": 51, "name": "key_share"}, {"id": 10, "name": "supported_groups"}], "ja3s": "f03a69cfa3944d6d51bc52febd87a1a8", "cert": {"sig_alg": "sha256WithRSAEncryption", "issued": "20230718220734Z", "expires": "20231016220733Z", "expired": false, "version": 2, "extensions": [{"critical": true, "data": "\\x03\\x02\\x05\\xa0", "name": "keyUsage"}, {"data": "0\\x14\\x06\\x08+\\x06\\x01\\x05\\x05\\x07\\x03\\x01\\x06\\x08+\\x06\\x01\\x05\\x05\\x07\\x03\\x02", "name": "extendedKeyUsage"}, {"critical": true, "data": "0\\x00", "name": "basicConstraints"}, {"data": "\\x04\\x14\\x9c\\xf6&\\tYUu\\xa6\\\\\\xb1\\xe9\\xf3%\\xaa{\\x15\\xc7\\xe6\\xef]", "name": "subjectKeyIdentifier"}, {"data": "0\\x16\\x80\\x14\\x14.\\xb3\\x17\\xb7XV\\xcb\\xaeP\\t@\\xe6\\x1f\\xaf\\x9d\\x8b\\x14\\xc2\\xc6", "name": "authorityKeyIdentifier"}, {"data": "0G0!\\x06\\x08+\\x06\\x01\\x05\\x05\\x070\\x01\\x86\\x15http://r3.o.lencr.org0\"\\x06\\x08+\\x06\\x01\\x05\\x05\\x070\\x02\\x86\\x16http://r3.i.lencr.org/", "name": "authorityInfoAccess"}, {"data": "0\\x0c\\x82\\neapdns.com", "name": "subjectAltName"}, {"data": "0\\n0\\x08\\x06\\x06g\\x81\\x0c\\x01\\x02\\x01", "name": "certificatePolicies"}, {"data": "\\x04\\x81\\xf1\\x00\\xef\\x00v\\x00\\xb7>\\xfb$\\xdf\\x9cM\\xbau\\xf29\\xc5\\xbaX\\xf4l]\\xfcB\\xcfz\\x9f5\\xc4\\x9e\\x1d\\t\\x81%\\xed\\xb4\\x99\\x00\\x00\\x01\\x89kBO=\\x00\\x00\\x04\\x03\\x00G0E\\x02 q\\xda\\xb3\\x93\\xc0\\xf8\\x80\\xe4_\\t{B\\xe2\\xc1\\x1c\\xea\\xdc\\x85\\xaf\\x12i\\x9b\\xe6\\xad\\xd7\\xa4\\x9e\\xc5\\x86YN\"\\x02!\\x00\\xeb[H\\x89\\x9f\\x0c3\\xd8x\\xc3\\x07<\\xdd\\xeeg\\xca\\xc91x\\xbd#\\x80~\\xe8\\xd9\\xcfWh\\x98+\\xac\\x9d\\x00u\\x00\\xad\\xf7\\xbe\\xfa|\\xff\\x10\\xc8\\x8b\\x9d=\\x9c\\x1e>\\x18j\\xb4g)]\\xcf\\xb1\\x0c$\\xca\\x85\\x864\\xeb\\xdc\\x82\\x8a\\x00\\x00\\x01\\x89kBO\\x8f\\x00\\x00\\x04\\x03\\x00F0D\\x02 B\\x97\\x87\\xf9@\\xa0\\xde;J\\x0b\\xfe\\x13\\x83w\\xdd\\xecB\\x1eP\\xa3y[-\\x81~}\\xdb\\x84\\x07\\x8e\\xe2U\\x02 \\'$\\xe2 \\\\>\\x0b\\x8f\\x92\\xfeN\\xbe\\x01\\x01\\xff\\x03\\xfb\\xd9>\\xd7u\\xc5\\xea[GS\\xa3\\xdb\\x7f\\xe3\\xbe\\xbf", "name": "ct_precert_scts"}], "fingerprint": {"sha256": "4d546415bdf893bcdea61236447c63d44a9aed774af3b8d1216950c1ecf6a732", "sha1": "4477f9b8711c9fa8ab8ab09d0ea1af050894753f"}, "serial": 374224090718438189169677238305644280065913, "subject": {"CN": "eapdns.com"}, "pubkey": {"type": "rsa", "bits": 2048}, "issuer": {"C": "US", "CN": "R3", "O": "Let's Encrypt"}}, "cipher": {"version": "TLSv1.3", "bits": 256, "name": "TLS_AES_256_GCM_SHA384"}, "trust": {"revoked": false, "browser": null}, "handshake_states": ["before SSL initialization", "SSLv3/TLS write client hello", "SSLv3/TLS read server hello", "TLSv1.3 read encrypted extensions", "SSLv3/TLS read server certificate", "TLSv1.3 read server certificate verify", "SSLv3/TLS read finished", "SSLv3/TLS write change cipher spec", "SSLv3/TLS write finished", "SSL negotiation finished successfully"], "alpn": [], "ocsp": {}}, "hostnames": ["eapdns.com"], "org": "Shelter LLC", "data": "HTTP/1.1 404 Not Found\r\nDate: Sun, 13 Aug 2023 16:41:40 GMT\r\nContent-Type: text/plain\r\nContent-Length: 0\r\nServer: apache\r\n\r\n\nCobalt Strike Beacon:\n  x86:\n    beacon_type: HTTPS\n    dns-beacon.strategy_fail_seconds: -1\n    dns-beacon.strategy_fail_x: -1\n    dns-beacon.strategy_rotate_seconds: -1\n    http-get.client:\n      Host: eapdns.com\n      Connection: close\n      wordpress_logged_in=\n      Cookie\n      letter=false\n    http-get.uri: eapdns.com,/da.html\n    http-get.verb: GET\n    http-post.client:\n      Host: eapdns.com\n      Connection: close\n      Content-Type: application/x-www-form-urlencoded\n      logopng=\n      __session__id=\n      Cookie\n    http-post.uri: /modcp\n    http-post.verb: POST\n    jitter: 39\n    maxgetsize: 1864740\n    port: 443\n    post-ex.spawnto_x64: %windir%\\sysnative\\WUAUCLT.exe\n    post-ex.spawnto_x86: %windir%\\syswow64\\WUAUCLT.exe\n    process-inject.execute:\n      CreateThread\n      RtlCreateUserThread\n      CreateRemoteThread\n    process-inject.min_alloc: 18250\n    process-inject.startrwx: 4\n    process-inject.stub: c54eed2fbdc9655c0c13550f04c72c28\n    process-inject.userwx: 32\n    proxy.behavior: 2 (Use IE settings)\n    server.publickey_md5: 5b00c1cc8bd0b57f9d42e22bf7571b6b\n    sleeptime: 64919\n    stage.cleanup: 1\n    useragent_header: Mozilla/5.0 (Windows NT 6.1; WOW64) AppleWebKit/537.36 (KHTML, like Gecko) Chrome/47.0.2526.111 Safari/537.36\n    uses_cookies: 1\n    watermark: 674054486\n  x64:\n    beacon_type: HTTPS\n    dns-beacon.strategy_fail_seconds: -1\n    dns-beacon.strategy_fail_x: -1\n    dns-beacon.strategy_rotate_seconds: -1\n    http-get.client:\n      Host: eapdns.com\n      Connection: close\n      wordpress_logged_in=\n      Cookie\n      letter=false\n    http-get.uri: eapdns.com,/ba.html\n    http-get.verb: GET\n    http-post.client:\n      Host: eapdns.com\n      Connection: close\n      Content-Type: application/x-www-form-urlencoded\n      logopng=\n      __session__id=\n      Cookie\n    http-post.uri: /modcp\n    http-post.verb: POST\n    jitter: 39\n    maxgetsize: 1864740\n    port: 443\n    post-ex.spawnto_x64: %windir%\\sysnative\\WUAUCLT.exe\n    post-ex.spawnto_x86: %windir%\\syswow64\\WUAUCLT.exe\n    process-inject.execute:\n      CreateThread\n      RtlCreateUserThread\n      CreateRemoteThread\n    process-inject.min_alloc: 18250\n    process-inject.startrwx: 4\n    process-inject.stub: c54eed2fbdc9655c0c13550f04c72c28\n    process-inject.userwx: 32\n    proxy.behavior: 2 (Use IE settings)\n    server.publickey_md5: 5b00c1cc8bd0b57f9d42e22bf7571b6b\n    sleeptime: 64919\n    stage.cleanup: 1\n    useragent_header: Mozilla/5.0 (Windows NT 6.1; WOW64) AppleWebKit/537.36 (KHTML, like Gecko) Chrome/47.0.2526.111 Safari/537.36\n    uses_cookies: 1\n    watermark: 674054486\n", "asn": "AS198556", "cpe23": ["cpe:2.3:a:helpsystems:cobalt_strike"], "isp": "Shelter LLC", "cpe": ["cpe:/a:helpsystems:cobalt_strike"], "domains": ["eapdns.com"], "ip_str": "91.103.253.45", "os": null, "_shodan": {"region": "na", "ptr": true, "module": "https", "id": "c9049b2c-5893-45b0-9872-b2448b084e98", "options": {}, "crawler": "21255b11b05f5ce2a4cf82d3f9ebb017a5a1fdd1"}, "opts": {"vulns": [], "heartbleed": "2023/08/13 16:42:08 91.103.253.45:443 - SAFE\n"}}
{"hash": 1610408113, "cobalt_strike_beacon": {"x86": {"beacon_type": "HTTP", "dns-beacon.strategy_rotate_seconds": -1, "useragent_header": "Mozilla/5.0 (compatible; MSIE 9.0; Windows NT 6.0; Trident/5.0; BO1IE8_v1;ENUS)", "http-post.client": ["Content-Type: application/octet-stream", "id"], "maxgetsize": 1048576, "post-ex.spawnto_x86": "%windir%\\syswow64\\rundll32.exe", "port": 80, "sleeptime": 60000, "uses_cookies": 1, "proxy.behavior": "2 (Use IE settings)", "process-inject.execute": ["CreateThread", "SetThreadContext", "CreateRemoteThread", "RtlCreateUserThread"], "process-inject.startrwx": 64, "post-ex.spawnto_x64": "%windir%\\sysnative\\rundll32.exe", "process-inject.stub": "b2736f1cbba90d42286fc42bfba74f4d", "http-get.uri": "8.129.237.254,/activity", "dns-beacon.strategy_fail_seconds": -1, "process-inject.userwx": 64, "dns-beacon.strategy_fail_x": -1, "http-post.verb": "POST", "http-post.uri": "/submit.php", "server.publickey_md5": "e9ae865f5ce035176457188409f6020a", "http-get.verb": "GET", "http-get.client": ["Cookie"]}, "x64": {"beacon_type": "HTTP", "dns-beacon.strategy_rotate_seconds": -1, "useragent_header": "Mozilla/5.0 (compatible; MSIE 9.0; Windows NT 6.1; Win64; x64; Trident/5.0; BOIE9;ENUS)", "http-post.client": ["Content-Type: application/octet-stream", "id"], "maxgetsize": 1048576, "post-ex.spawnto_x86": "%windir%\\syswow64\\rundll32.exe", "port": 80, "sleeptime": 60000, "uses_cookies": 1, "proxy.behavior": "2 (Use IE settings)", "process-inject.execute": ["CreateThread", "SetThreadContext", "CreateRemoteThread", "RtlCreateUserThread"], "process-inject.startrwx": 64, "post-ex.spawnto_x64": "%windir%\\sysnative\\rundll32.exe", "process-inject.stub": "b2736f1cbba90d42286fc42bfba74f4d", "http-get.uri": "8.129.237.254,/ca", "dns-beacon.strategy_fail_seconds": -1, "process-inject.userwx": 64, "dns-beacon.strategy_fail_x": -1, "http-post.verb": "POST", "http-post.uri": "/submit.php", "server.publickey_md5": "e9ae865f5ce035176457188409f6020a", "http-get.verb": "GET", "http-get.client": ["Cookie"]}}, "product": "Cobalt Strike Beacon", "http": {"status": 404, "robots_hash": null, "redirects": [], "securitytxt": null, "title": null, "sitemap_hash": null, "robots": null, "server": null, "headers_hash": 2129120964, "host": "8.129.237.254", "html": "", "location": "/", "html_hash": 0, "sitemap": null, "securitytxt_hash": null}, "os": null, "tags": ["cloud"], "timestamp": "2023-08-11T12:06:45.014317", "isp": "Hangzhou Alibaba Advertising Co.,Ltd.", "transport": "tcp", "_shodan": {"region": "eu", "ptr": true, "module": "http", "id": "2c5fdea5-9ee0-4bbe-8440-c03f81178e73", "options": {}, "crawler": "bf213bc419cc8491376c12af31e32623c1b6f467"}, "asn": "AS37963", "cloud": {"region": null, "service": null, "provider": "Alibaba Cloud"}, "hostnames": [], "location": {"city": "Shenzhen", "region_code": "ZJ", "area_code": null, "longitude": 121.33971, "latitude": 29.41591, "country_code": "CN", "country_name": "China"}, "ip": 142732798, "domains": [], "org": "Aliyun Computing Co.LTD", "data": "HTTP/1.1 404 Not Found\r\nDate: Fri, 11 Aug 2023 12:06:44 GMT\r\nContent-Type: text/plain\r\nContent-Length: 0\r\n\r\n\nCobalt Strike Beacon:\n  x86:\n    beacon_type: HTTP\n    dns-beacon.strategy_fail_seconds: -1\n    dns-beacon.strategy_fail_x: -1\n    dns-beacon.strategy_rotate_seconds: -1\n    http-get.client:\n      Cookie\n    http-get.uri: 8.129.237.254,/activity\n    http-get.verb: GET\n    http-post.client:\n      Content-Type: application/octet-stream\n      id\n    http-post.uri: /submit.php\n    http-post.verb: POST\n    maxgetsize: 1048576\n    port: 80\n    post-ex.spawnto_x64: %windir%\\sysnative\\rundll32.exe\n    post-ex.spawnto_x86: %windir%\\syswow64\\rundll32.exe\n    process-inject.execute:\n      CreateThread\n      SetThreadContext\n      CreateRemoteThread\n      RtlCreateUserThread\n    process-inject.startrwx: 64\n    process-inject.stub: b2736f1cbba90d42286fc42bfba74f4d\n    process-inject.userwx: 64\n    proxy.behavior: 2 (Use IE settings)\n    server.publickey_md5: e9ae865f5ce035176457188409f6020a\n    sleeptime: 60000\n    useragent_header: Mozilla/5.0 (compatible; MSIE 9.0; Windows NT 6.0; Trident/5.0; BO1IE8_v1;ENUS)\n    uses_cookies: 1\n  x64:\n    beacon_type: HTTP\n    dns-beacon.strategy_fail_seconds: -1\n    dns-beacon.strategy_fail_x: -1\n    dns-beacon.strategy_rotate_seconds: -1\n    http-get.client:\n      Cookie\n    http-get.uri: 8.129.237.254,/ca\n    http-get.verb: GET\n    http-post.client:\n      Content-Type: application/octet-stream\n      id\n    http-post.uri: /submit.php\n    http-post.verb: POST\n    maxgetsize: 1048576\n    port: 80\n    post-ex.spawnto_x64: %windir%\\sysnative\\rundll32.exe\n    post-ex.spawnto_x86: %windir%\\syswow64\\rundll32.exe\n    process-inject.execute:\n      CreateThread\n      SetThreadContext\n      CreateRemoteThread\n      RtlCreateUserThread\n    process-inject.startrwx: 64\n    process-inject.stub: b2736f1cbba90d42286fc42bfba74f4d\n    process-inject.userwx: 64\n    proxy.behavior: 2 (Use IE settings)\n    server.publickey_md5: e9ae865f5ce035176457188409f6020a\n    sleeptime: 60000\n    useragent_header: Mozilla/5.0 (compatible; MSIE 9.0; Windows NT 6.1; Win64; x64; Trident/5.0; BOIE9;ENUS)\n    uses_cookies: 1\n", "port": 80, "opts": {}, "ip_str": "8.129.237.254"}
{"hash": 2097240456, "cobalt_strike_beacon": {"x86": {"beacon_type": "HTTPS", "dns-beacon.strategy_rotate_seconds": -1, "useragent_header": "Mozilla/5.0 (compatible; MSIE 9.0; Windows NT 6.1; Trident/5.0)", "http-post.client": ["Content-Type: application/octet-stream", "id"], "maxgetsize": 1048576, "post-ex.spawnto_x86": "%windir%\\syswow64\\rundll32.exe", "port": 443, "sleeptime": 60000, "uses_cookies": 1, "proxy.behavior": "2 (Use IE settings)", "process-inject.execute": ["CreateThread", "SetThreadContext", "CreateRemoteThread", "RtlCreateUserThread"], "process-inject.startrwx": 64, "post-ex.spawnto_x64": "%windir%\\sysnative\\rundll32.exe", "process-inject.stub": "b50b86d735412685eb6044ad8d01781c", "http-get.uri": "198.46.226.96,/IE9CompatViewList.xml", "watermark": 391144938, "dns-beacon.strategy_fail_seconds": -1, "process-inject.userwx": 64, "dns-beacon.strategy_fail_x": -1, "http-post.verb": "POST", "http-post.uri": "/submit.php", "server.publickey_md5": "759fb6c6d88124e2faee54c40bcac1f2", "http-get.verb": "GET", "http-get.client": ["Cookie"]}, "x64": {"beacon_type": "HTTPS", "dns-beacon.strategy_rotate_seconds": -1, "useragent_header": "Mozilla/5.0 (compatible; MSIE 9.0; Windows NT 6.0; Trident/5.0; BOIE9;ENUS)", "http-post.client": ["Content-Type: application/octet-stream", "id"], "maxgetsize": 1048576, "post-ex.spawnto_x86": "%windir%\\syswow64\\rundll32.exe", "port": 443, "sleeptime": 60000, "uses_cookies": 1, "proxy.behavior": "2 (Use IE settings)", "process-inject.execute": ["CreateThread", "SetThreadContext", "CreateRemoteThread", "RtlCreateUserThread"], "process-inject.startrwx": 64, "post-ex.spawnto_x64": "%windir%\\sysnative\\rundll32.exe", "process-inject.stub": "b50b86d735412685eb6044ad8d01781c", "http-get.uri": "198.46.226.96,/j.ad", "watermark": 391144938, "dns-beacon.strategy_fail_seconds": -1, "process-inject.userwx": 64, "dns-beacon.strategy_fail_x": -1, "http-post.verb": "POST", "http-post.uri": "/submit.php", "server.publickey_md5": "759fb6c6d88124e2faee54c40bcac1f2", "http-get.verb": "GET", "http-get.client": ["Cookie"]}}, "product": "Cobalt Strike Beacon", "http": {"status": 404, "robots_hash": null, "redirects": [], "securitytxt": null, "title": null, "sitemap_hash": null, "robots": null, "server": null, "headers_hash": 2129120964, "host": "198.46.226.97", "html": "", "location": "/", "html_hash": 0, "sitemap": null, "securitytxt_hash": null}, "os": null, "asn": "AS36352", "tags": ["self-signed"], "timestamp": "2023-08-11T02:02:51.439029", "isp": "ColoCrossing", "transport": "tcp", "_shodan": {"region": "eu", "ptr": true, "module": "https", "id": "b4ef136d-0400-4fcf-8c8a-67922793252b", "options": {}, "crawler": "bf213bc419cc8491376c12af31e32623c1b6f467"}, "ssl": {"chain_sha256": ["87f2085c32b6a2cc709b365f55873e207a9caa10bffecf2fd16d3cf9d94d390c"], "jarm": "2ad2ad16d2ad2ad00042d42d00042ddb04deffa1705e2edc44cae1ed24a4da", "chain": ["-----BEGIN CERTIFICATE-----\nMIIDIzCCAgugAwIBAgIECLsA7jANBgkqhkiG9w0BAQsFADBCMQkwBwYDVQQGEwAx\nCTAHBgNVBAgTADEJMAcGA1UEBxMAMQkwBwYDVQQKEwAxCTAHBgNVBAsTADEJMAcG\nA1UEAxMAMB4XDTE1MDUyMDE4MjYyNFoXDTI1MDUxNzE4MjYyNFowQjEJMAcGA1UE\nBhMAMQkwBwYDVQQIEwAxCTAHBgNVBAcTADEJMAcGA1UEChMAMQkwBwYDVQQLEwAx\nCTAHBgNVBAMTADCCASIwDQYJKoZIhvcNAQEBBQADggEPADCCAQoCggEBAJjXGpNx\njm97YowJUxMyM/QBjGTnyUqMXt1IsXArVdop3F/fGdhsmWkExTt8AfjWm9TL2I3K\nCVKqBhQ9U8+W+l3JAPNaqLnOqRSfeQ+SQ0tmLuVn1AVQt1RKYZGo+o70G/yAXBNw\nCQ3mUisLe6Ln926E3seZM6gb8HesF/w+2sCcQ2UaqLY3hKVIDYvlenNaNMxtaw+8\nA/3udT+pIX1JyrlIlt0SDg5Ya2opwYTFJM64KbuyDKkK213A5Sz00Rh13PVRKWlp\nfVtgoh9BNupzJOG/GE/x0XmXCYAOIGrm8uujAtUWJ5nkbaczf2ldnITJBw+3iQrt\nE1LEM8aUJeKRCVkCAwEAAaMhMB8wHQYDVR0OBBYEFHNrXtvPyRkdW9AfjOOrVjgY\nnwJPMA0GCSqGSIb3DQEBCwUAA4IBAQBU9S+o9YRFBTzcCeZ4phipmwJ9PsIFKoid\ngkTekbt3EzyL+Q+nySQ/Gn4ZXdliFYxKNcRmxbSWCa9jX6qJb6t7gcLBP8Hp7kWL\nsNdbk19+iSDphVfO6UdL6ZVIbIy0vNO0/LgEKVi7tzE84elcaS45ZSPY+HnySF2s\nP3SF0n9iF/bWdzYOjLcPpgavsT66KLrileXkYjCWFOXufnZgpf11pGd3wTJEIenS\nabc90LQ4rAvBJPicY/AfhIth/g4GiDG+M1DmzlV+1F0nNr3KuNGjeghLVegKoRq/\nb5PF+0kpSK7HUwIdrgZsqz1ORsMToEyv8LvxIyL0DTCLBJSHmgJy\n-----END CERTIFICATE-----\n"], "dhparams": {"prime": "ffffffffffffffffc90fdaa22168c234c4c6628b80dc1cd129024e088a67cc74020bbea63b139b22514a08798e3404ddef9519b3cd3a431b302b0a6df25f14374fe1356d6d51c245e485b576625e7ec6f44c42e9a637ed6b0bff5cb6f406b7edee386bfb5a899fa5ae9f24117c4b1fe649286651ece65381ffffffffffffffff", "public_key": "28d7ff543580cc65b944723470eff2b01636a14701c985baa4ee125776b4792fc5d0e8b4a2455724f448caae713d2905b12f077a7bcb7c44671ec7cba86e7e4ddeea6aac49104794187eb281075a0fd427d98f15b7271ec46a6017784f85b0bf31fea32fcc9f6eba83244730aa2f8b6517c5b149f61d70c832571e099aa37968", "bits": 1024, "generator": 2, "fingerprint": "RFC2409/Oakley Group 2"}, "versions": ["-TLSv1", "-SSLv2", "-SSLv3", "-TLSv1.1", "TLSv1.2", "TLSv1.3"], "acceptable_cas": [], "tlsext": [{"id": 43, "name": "supported_versions"}, {"id": 51, "name": "key_share"}, {"id": 10, "name": "supported_groups"}], "ja3s": "f03a69cfa3944d6d51bc52febd87a1a8", "cert": {"sig_alg": "sha256WithRSAEncryption", "issued": "20150520182624Z", "expires": "20250517182624Z", "expired": false, "version": 2, "extensions": [{"data": "\\x04\\x14sk^\\xdb\\xcf\\xc9\\x19\\x1d[\\xd0\\x1f\\x8c\\xe3\\xabV8\\x18\\x9f\\x02O", "name": "subjectKeyIdentifier"}], "fingerprint": {"sha256": "87f2085c32b6a2cc709b365f55873e207a9caa10bffecf2fd16d3cf9d94d390c", "sha1": "6ece5ece4192683d2d84e25b0ba7e04f9cb7eb7c"}, "serial": 146473198, "subject": {"C": "", "CN": "", "L": "", "O": "", "ST": "", "OU": ""}, "pubkey": {"type": "rsa", "bits": 2048}, "issuer": {"C": "", "CN": "", "L": "", "O": "", "ST": "", "OU": ""}}, "cipher": {"version": "TLSv1.3", "bits": 256, "name": "TLS_AES_256_GCM_SHA384"}, "trust": {"revoked": false, "browser": null}, "handshake_states": ["before SSL initialization", "SSLv3/TLS write client hello", "SSLv3/TLS read server hello", "TLSv1.3 read encrypted extensions", "SSLv3/TLS read server certificate", "TLSv1.3 read server certificate verify", "SSLv3/TLS read finished", "SSLv3/TLS write change cipher spec", "SSLv3/TLS write finished", "SSL negotiation finished successfully"], "alpn": [], "ocsp": {}}, "hostnames": ["198-46-226-97-host.colocrossing.com"], "location": {"city": "Arlington", "region_code": "TX", "area_code": null, "longitude": -97.10807, "latitude": 32.73569, "country_code": "US", "country_name": "United States"}, "ip": 3324961377, "domains": ["colocrossing.com"], "org": "ColoCrossing", "data": "HTTP/1.1 404 Not Found\r\nDate: Fri, 11 Aug 2023 02:02:51 GMT\r\nContent-Type: text/plain\r\nContent-Length: 0\r\n\r\n\nCobalt Strike Beacon:\n  x86:\n    beacon_type: HTTPS\n    dns-beacon.strategy_fail_seconds: -1\n    dns-beacon.strategy_fail_x: -1\n    dns-beacon.strategy_rotate_seconds: -1\n    http-get.client:\n      Cookie\n    http-get.uri: 198.46.226.96,/IE9CompatViewList.xml\n    http-get.verb: GET\n    http-post.client:\n      Content-Type: application/octet-stream\n      id\n    http-post.uri: /submit.php\n    http-post.verb: POST\n    maxgetsize: 1048576\n    port: 443\n    post-ex.spawnto_x64: %windir%\\sysnative\\rundll32.exe\n    post-ex.spawnto_x86: %windir%\\syswow64\\rundll32.exe\n    process-inject.execute:\n      CreateThread\n      SetThreadContext\n      CreateRemoteThread\n      RtlCreateUserThread\n    process-inject.startrwx: 64\n    process-inject.stub: b50b86d735412685eb6044ad8d01781c\n    process-inject.userwx: 64\n    proxy.behavior: 2 (Use IE settings)\n    server.publickey_md5: 759fb6c6d88124e2faee54c40bcac1f2\n    sleeptime: 60000\n    useragent_header: Mozilla/5.0 (compatible; MSIE 9.0; Windows NT 6.1; Trident/5.0)\n    uses_cookies: 1\n    watermark: 391144938\n  x64:\n    beacon_type: HTTPS\n    dns-beacon.strategy_fail_seconds: -1\n    dns-beacon.strategy_fail_x: -1\n    dns-beacon.strategy_rotate_seconds: -1\n    http-get.client:\n      Cookie\n    http-get.uri: 198.46.226.96,/j.ad\n    http-get.verb: GET\n    http-post.client:\n      Content-Type: application/octet-stream\n      id\n    http-post.uri: /submit.php\n    http-post.verb: POST\n    maxgetsize: 1048576\n    port: 443\n    post-ex.spawnto_x64: %windir%\\sysnative\\rundll32.exe\n    post-ex.spawnto_x86: %windir%\\syswow64\\rundll32.exe\n    process-inject.execute:\n      CreateThread\n      SetThreadContext\n      CreateRemoteThread\n      RtlCreateUserThread\n    process-inject.startrwx: 64\n    process-inject.stub: b50b86d735412685eb6044ad8d01781c\n    process-inject.userwx: 64\n    proxy.behavior: 2 (Use IE settings)\n    server.publickey_md5: 759fb6c6d88124e2faee54c40bcac1f2\n    sleeptime: 60000\n    useragent_header: Mozilla/5.0 (compatible; MSIE 9.0; Windows NT 6.0; Trident/5.0; BOIE9;ENUS)\n    uses_cookies: 1\n    watermark: 391144938\n", "port": 443, "opts": {"vulns": [], "heartbleed": "2023/08/11 02:03:03 198.46.226.97:443 - SAFE\n"}, "ip_str": "198.46.226.97"}
{"hash": -1226588213, "cobalt_strike_beacon": {"x86": {"beacon_type": "HTTP", "jitter": 7, "dns-beacon.strategy_rotate_seconds": -1, "useragent_header": "Mozilla/4.0 (compatible; MSIE 7.0b; Windows NT 6.0)", "http-post.client": ["user=", "%%", "User", "data=", "%%"], "maxgetsize": 2097167, "post-ex.spawnto_x86": "c:\\windows\\syswow64\\rundll32.exe", "port": 80, "sleeptime": 3000, "uses_cookies": 1, "proxy.behavior": "2 (Use IE settings)", "process-inject.execute": ["CreateThread", "SetThreadContext", "CreateRemoteThread", "RtlCreateUserThread"], "process-inject.startrwx": 64, "post-ex.spawnto_x64": "c:\\windows\\system32\\rundll32.exe", "process-inject.stub": "b50b86d735412685eb6044ad8d01781c", "http-get.uri": "121.36.203.14,/www/handle/doc", "watermark": 391144938, "dns-beacon.strategy_fail_seconds": -1, "server.publickey_md5": "9bc063be811430279dfaa4340697e43c", "dns-beacon.strategy_fail_x": -1, "http-post.verb": "POST", "http-post.uri": "/IMXo", "process-inject.userwx": 64, "http-get.verb": "GET", "http-get.client": ["SESSIONID=", "Cookie"]}, "x64": {"beacon_type": "HTTP", "jitter": 7, "dns-beacon.strategy_rotate_seconds": -1, "useragent_header": "Mozilla/5.0 (compatible; MSIE 9.0; Windows NT 6.1; Trident/5.0; BOIE9;ENUS)", "http-post.client": ["user=", "%%", "User", "data=", "%%"], "maxgetsize": 2097167, "post-ex.spawnto_x86": "c:\\windows\\syswow64\\rundll32.exe", "port": 80, "sleeptime": 3000, "uses_cookies": 1, "proxy.behavior": "2 (Use IE settings)", "process-inject.execute": ["CreateThread", "SetThreadContext", "CreateRemoteThread", "RtlCreateUserThread"], "process-inject.startrwx": 64, "post-ex.spawnto_x64": "c:\\windows\\system32\\rundll32.exe", "process-inject.stub": "b50b86d735412685eb6044ad8d01781c", "http-get.uri": "121.36.203.14,/www/handle/doc", "watermark": 391144938, "dns-beacon.strategy_fail_seconds": -1, "server.publickey_md5": "9bc063be811430279dfaa4340697e43c", "dns-beacon.strategy_fail_x": -1, "http-post.verb": "POST", "http-post.uri": "/IMXo", "process-inject.userwx": 64, "http-get.verb": "GET", "http-get.client": ["SESSIONID=", "Cookie"]}}, "product": "Cobalt Strike Beacon", "http": {"status": 404, "robots_hash": null, "redirects": [], "securitytxt": null, "title": null, "sitemap_hash": null, "robots": null, "server": null, "headers_hash": 2129120964, "host": "121.36.203.14", "html": "", "location": "/", "html_hash": 0, "sitemap": null, "securitytxt_hash": null}, "os": null, "timestamp": "2023-08-09T07:32:31.312561", "isp": "Huawei Cloud Service data center", "transport": "tcp", "_shodan": {"region": "eu", "ptr": true, "module": "http", "id": "93096b1c-d093-4a6e-938b-3c561cc7f2ea", "options": {}, "crawler": "487814a778c983e2dcef234806292d88c5cbf3ec"}, "asn": "AS55990", "hostnames": ["ecs-121-36-203-14.compute.hwclouds-dns.com"], "location": {"city": "Shanghai", "region_code": "SH", "area_code": null, "longitude": 121.45806, "latitude": 31.22222, "country_code": "CN", "country_name": "China"}, "ip": 2032454414, "domains": ["hwclouds-dns.com"], "org": "Huawei Public Cloud Service (Huawei Software Technologies Ltd.Co)", "data": "HTTP/1.1 404 Not Found\r\nDate: Wed, 9 Aug 2023 07:32:31 GMT\r\nContent-Type: text/plain\r\nContent-Length: 0\r\n\r\n\nCobalt Strike Beacon:\n  x86:\n    beacon_type: HTTP\n    dns-beacon.strategy_fail_seconds: -1\n    dns-beacon.strategy_fail_x: -1\n    dns-beacon.strategy_rotate_seconds: -1\n    http-get.client:\n      SESSIONID=\n      Cookie\n    http-get.uri: 121.36.203.14,/www/handle/doc\n    http-get.verb: GET\n    http-post.client:\n      user=\n      %%\n      User\n      data=\n      %%\n    http-post.uri: /IMXo\n    http-post.verb: POST\n    jitter: 7\n    maxgetsize: 2097167\n    port: 80\n    post-ex.spawnto_x64: c:\\windows\\system32\\rundll32.exe\n    post-ex.spawnto_x86: c:\\windows\\syswow64\\rundll32.exe\n    process-inject.execute:\n      CreateThread\n      SetThreadContext\n      CreateRemoteThread\n      RtlCreateUserThread\n    process-inject.startrwx: 64\n    process-inject.stub: b50b86d735412685eb6044ad8d01781c\n    process-inject.userwx: 64\n    proxy.behavior: 2 (Use IE settings)\n    server.publickey_md5: 9bc063be811430279dfaa4340697e43c\n    sleeptime: 3000\n    useragent_header: Mozilla/4.0 (compatible; MSIE 7.0b; Windows NT 6.0)\n    uses_cookies: 1\n    watermark: 391144938\n  x64:\n    beacon_type: HTTP\n    dns-beacon.strategy_fail_seconds: -1\n    dns-beacon.strategy_fail_x: -1\n    dns-beacon.strategy_rotate_seconds: -1\n    http-get.client:\n      SESSIONID=\n      Cookie\n    http-get.uri: 121.36.203.14,/www/handle/doc\n    http-get.verb: GET\n    http-post.client:\n      user=\n      %%\n      User\n      data=\n      %%\n    http-post.uri: /IMXo\n    http-post.verb: POST\n    jitter: 7\n    maxgetsize: 2097167\n    port: 80\n    post-ex.spawnto_x64: c:\\windows\\system32\\rundll32.exe\n    post-ex.spawnto_x86: c:\\windows\\syswow64\\rundll32.exe\n    process-inject.execute:\n      CreateThread\n      SetThreadContext\n      CreateRemoteThread\n      RtlCreateUserThread\n    process-inject.startrwx: 64\n    process-inject.stub: b50b86d735412685eb6044ad8d01781c\n    process-inject.userwx: 64\n    proxy.behavior: 2 (Use IE settings)\n    server.publickey_md5: 9bc063be811430279dfaa4340697e43c\n    sleeptime: 3000\n    useragent_header: Mozilla/5.0 (compatible; MSIE 9.0; Windows NT 6.1; Trident/5.0; BOIE9;ENUS)\n    uses_cookies: 1\n    watermark: 391144938\n", "port": 80, "opts": {}, "ip_str": "121.36.203.14"}
{"cobalt_strike_beacon": {"x86": {"beacon_type": "HTTPS", "dns-beacon.strategy_rotate_seconds": -1, "useragent_header": "Mozilla/5.0 (Windows NT 6.1; WOW64; Trident/7.0; rv:11.0) like Gecko", "http-post.client": ["Accept: */*", "Content-Type: text/xml", "X-Requested-With: XMLHttpRequest", "Host: https://d11xzcebh7lvkz.cloudfront.net", "sz=160x600", "oe=oe=ISO-8859-1;", "sn", "s=3717", "dc_ref=http%3A%2F%2Fwww.amazon.com"], "maxgetsize": 1048576, "post-ex.spawnto_x86": "%windir%\\syswow64\\rundll32.exe", "port": 443, "sleeptime": 5000, "uses_cookies": 1, "proxy.behavior": "2 (Use IE settings)", "process-inject.execute": ["CreateThread", "SetThreadContext", "CreateRemoteThread", "RtlCreateUserThread"], "process-inject.startrwx": 64, "post-ex.spawnto_x64": "%windir%\\sysnative\\rundll32.exe", "process-inject.stub": "6eebe6e473d3503233aa56f2ce51f5b1", "http-get.uri": "d11xzcebh7lvkz.cloudfront.net,/s/ref=nb_sb_noss_1/167-3294888-0262949/field-keywords=books,50.17.149.220,/s/ref=nb_sb_noss_1/167-3294888-0262949/field-keywords=books", "kill_date": 20230930, "watermark": 144392904, "dns-beacon.strategy_fail_seconds": -1, "process-inject.userwx": 64, "dns-beacon.strategy_fail_x": -1, "http-post.verb": "POST", "http-post.uri": "/N4215/adj/amzn.us.sr.aps", "server.publickey_md5": "de85dae85c9c3049716d1e752dda33ef", "http-get.verb": "GET", "http-get.client": ["Accept: */*", "Host: https://d11xzcebh7lvkz.cloudfront.net", "session-token=", "skin=noskin;", "csm-hit=s-24KU11BB82RZSYGJ3BDK|1419899012996", "Cookie"]}, "x64": {"beacon_type": "HTTPS", "dns-beacon.strategy_rotate_seconds": -1, "useragent_header": "Mozilla/5.0 (Windows NT 6.1; WOW64; Trident/7.0; rv:11.0) like Gecko", "http-post.client": ["Accept: */*", "Content-Type: text/xml", "X-Requested-With: XMLHttpRequest", "Host: https://d11xzcebh7lvkz.cloudfront.net", "sz=160x600", "oe=oe=ISO-8859-1;", "sn", "s=3717", "dc_ref=http%3A%2F%2Fwww.amazon.com"], "maxgetsize": 1048576, "post-ex.spawnto_x86": "%windir%\\syswow64\\rundll32.exe", "port": 443, "sleeptime": 5000, "uses_cookies": 1, "proxy.behavior": "2 (Use IE settings)", "process-inject.execute": ["CreateThread", "SetThreadContext", "CreateRemoteThread", "RtlCreateUserThread"], "process-inject.startrwx": 64, "post-ex.spawnto_x64": "%windir%\\sysnative\\rundll32.exe", "process-inject.stub": "6eebe6e473d3503233aa56f2ce51f5b1", "http-get.uri": "d11xzcebh7lvkz.cloudfront.net,/s/ref=nb_sb_noss_1/167-3294888-0262949/field-keywords=books,50.17.149.220,/s/ref=nb_sb_noss_1/167-3294888-0262949/field-keywords=books", "kill_date": 20230930, "watermark": 144392904, "dns-beacon.strategy_fail_seconds": -1, "process-inject.userwx": 64, "dns-beacon.strategy_fail_x": -1, "http-post.verb": "POST", "http-post.uri": "/N4215/adj/amzn.us.sr.aps", "server.publickey_md5": "de85dae85c9c3049716d1e752dda33ef", "http-get.verb": "GET", "http-get.client": ["Accept: */*", "Host: https://d11xzcebh7lvkz.cloudfront.net", "session-token=", "skin=noskin;", "csm-hit=s-24KU11BB82RZSYGJ3BDK|1419899012996", "Cookie"]}}, "ip": 840013276, "http": {"status": 404, "robots_hash": null, "redirects": [], "securitytxt": null, "title": null, "sitemap_hash": null, "robots": null, "server": null, "headers_hash": 2129120964, "host": "50.17.149.220", "html": "", "location": "/", "html_hash": 0, "sitemap": null, "securitytxt_hash": null}, "port": 443, "transport": "tcp", "cloud": {"region": "us-east-1", "service": "EC2", "provider": "Amazon"}, "location": {"city": "Ashburn", "region_code": "VA", "area_code": null, "longitude": -77.48749, "latitude": 39.04372, "country_code": "US", "country_name": "United States"}, "product": "Cobalt Strike Beacon", "hash": 1156767419, "tags": ["cloud"], "timestamp": "2023-08-08T15:24:35.952747", "ssl": {"chain_sha256": ["046ce3d821d0a7989252c4bbb3d4c7c987aea61e99ee589deb84ab6d5e129938", "67add1166b020ae61b8f5fc96813c04c2aa589960796865572a3c7e737613dfd", "6d99fb265eb1c5b3744765fcbc648f3cd8e1bffafdc4c2f99b9d47cf7ff1c24f"], "jarm": "2ad2ad16d2ad2ad00042d42d00042ddb04deffa1705e2edc44cae1ed24a4da", "chain": ["-----BEGIN CERTIFICATE-----\nMIIE8jCCA9qgAwIBAgISA2PG7GgybiGgelX8m50bZoh1MA0GCSqGSIb3DQEBCwUA\nMDIxCzAJBgNVBAYTAlVTMRYwFAYDVQQKEw1MZXQncyBFbmNyeXB0MQswCQYDVQQD\nEwJSMzAeFw0yMzA3MTAxMzA3MDRaFw0yMzEwMDgxMzA3MDNaMBYxFDASBgNVBAMT\nC25vbmFsb20uY29tMIIBIjANBgkqhkiG9w0BAQEFAAOCAQ8AMIIBCgKCAQEAsCqe\ndKEJKaYwBaI3zd3MpajjJsi4M8vo5F8TA6eV2aU1/QSTfxd2i1LLjrE0IjI7yyFS\nVesQqNOygE17wPvAfKYwhZBjuOe/hGjbTteewJpkEV3rUtq++V3IUmMFtJ4vkKi1\nWuvCAueieQPHHGgCtWmA/dswYH6iHI2YwEEg5B1XfqplgAI9Fq/fX1mmn3+S4rVA\nR+4cPBJXFx9NHs6ArtxUgrev+BeNfc3BlBn4TqRZpbHJxgWOtoisfi7IATA6r0Sy\n4HRmOM8bbsbw5Lrtjo8gHTgg8Bx3eWAiTs8bFfVHzs1lcF9TtxDYDUk6gf8ZRt+U\nK1MunmvV3oFgIYCPkwIDAQABo4ICHDCCAhgwDgYDVR0PAQH/BAQDAgWgMB0GA1Ud\nJQQWMBQGCCsGAQUFBwMBBggrBgEFBQcDAjAMBgNVHRMBAf8EAjAAMB0GA1UdDgQW\nBBQFSzoV/04jTNDAgFEYisQ9cAaZMTAfBgNVHSMEGDAWgBQULrMXt1hWy65QCUDm\nH6+dixTCxjBVBggrBgEFBQcBAQRJMEcwIQYIKwYBBQUHMAGGFWh0dHA6Ly9yMy5v\nLmxlbmNyLm9yZzAiBggrBgEFBQcwAoYWaHR0cDovL3IzLmkubGVuY3Iub3JnLzAl\nBgNVHREEHjAcgg0qLm5vbmFsb20uY29tggtub25hbG9tLmNvbTATBgNVHSAEDDAK\nMAgGBmeBDAECATCCAQQGCisGAQQB1nkCBAIEgfUEgfIA8AB2AHoyjFTYty22IOo4\n4FIe6YQWcDIThU070ivBOlejUutSAAABiUAglREAAAQDAEcwRQIhAIBP2p5uA8gp\nSqEWl/XMmTuCWAlS9wKfBt1WFwN6MMhwAiAyIUGM0aMJ6EclpP0yDZq4/gnwpUGj\na+q0yq4Q5eD5bwB2AK33vvp8/xDIi509nB4+GGq0Zyldz7EMJMqFhjTr3IKKAAAB\niUAglS4AAAQDAEcwRQIgUMHfshKnSGI8SkGhTF+1xMwosPDWvfG2xdszv3Z+H/8C\nIQCB9/ttuy3Aub2p6rYhpvehmD2579IF7Zpy+kul2ZyR3TANBgkqhkiG9w0BAQsF\nAAOCAQEAQQlaqDoqgTk+5tQ8+FZZUQOFeHJU88vN05rBM5Tv9uxI8uJf14U5aHDb\n7Q8G3VIghlxJUOAVq5TBOwO6MQUKEAgyT02RuQXc9p0zySd29cvadR777p8d45TU\nYNmVOrhLFQNP5uIlqwJJsXPnYhySPv0LT6gIp1TgqOCl4RYHSXaYPWi7N0FnoA69\nSNS9yaoATFBHdhv3XZp4nrO6ga+g0mmS91FPB/UABMXnOQo3NK+w+vAcqwlhJoBG\n6Y/1oDUYwmvj1OfmbN54cQkxLBFkp574Q+Tj/KyrlhgDRtTxcR+A0bo7D5eFEIGm\nIxGg+3Wsr0Xet4PFvO0RMYiFY8ngwg==\n-----END CERTIFICATE-----\n", "-----BEGIN CERTIFICATE-----\nMIIFFjCCAv6gAwIBAgIRAJErCErPDBinU/bWLiWnX1owDQYJKoZIhvcNAQELBQAw\nTzELMAkGA1UEBhMCVVMxKTAnBgNVBAoTIEludGVybmV0IFNlY3VyaXR5IFJlc2Vh\ncmNoIEdyb3VwMRUwEwYDVQQDEwxJU1JHIFJvb3QgWDEwHhcNMjAwOTA0MDAwMDAw\nWhcNMjUwOTE1MTYwMDAwWjAyMQswCQYDVQQGEwJVUzEWMBQGA1UEChMNTGV0J3Mg\nRW5jcnlwdDELMAkGA1UEAxMCUjMwggEiMA0GCSqGSIb3DQEBAQUAA4IBDwAwggEK\nAoIBAQC7AhUozPaglNMPEuyNVZLD+ILxmaZ6QoinXSaqtSu5xUyxr45r+XXIo9cP\nR5QUVTVXjJ6oojkZ9YI8QqlObvU7wy7bjcCwXPNZOOftz2nwWgsbvsCUJCWH+jdx\nsxPnHKzhm+/b5DtFUkWWqcFTzjTIUu61ru2P3mBw4qVUq7ZtDpelQDRrK9O8Zutm\nNHz6a4uPVymZ+DAXXbpyb/uBxa3Shlg9F8fnCbvxK/eG3MHacV3URuPMrSXBiLxg\nZ3Vms/EY96Jc5lP/Ooi2R6X/ExjqmAl3P51T+c8B5fWmcBcUr2Ok/5mzk53cU6cG\n/kiFHaFpriV1uxPMUgP17VGhi9sVAgMBAAGjggEIMIIBBDAOBgNVHQ8BAf8EBAMC\nAYYwHQYDVR0lBBYwFAYIKwYBBQUHAwIGCCsGAQUFBwMBMBIGA1UdEwEB/wQIMAYB\nAf8CAQAwHQYDVR0OBBYEFBQusxe3WFbLrlAJQOYfr52LFMLGMB8GA1UdIwQYMBaA\nFHm0WeZ7tuXkAXOACIjIGlj26ZtuMDIGCCsGAQUFBwEBBCYwJDAiBggrBgEFBQcw\nAoYWaHR0cDovL3gxLmkubGVuY3Iub3JnLzAnBgNVHR8EIDAeMBygGqAYhhZodHRw\nOi8veDEuYy5sZW5jci5vcmcvMCIGA1UdIAQbMBkwCAYGZ4EMAQIBMA0GCysGAQQB\ngt8TAQEBMA0GCSqGSIb3DQEBCwUAA4ICAQCFyk5HPqP3hUSFvNVneLKYY611TR6W\nPTNlclQtgaDqw+34IL9fzLdwALduO/ZelN7kIJ+m74uyA+eitRY8kc607TkC53wl\nikfmZW4/RvTZ8M6UK+5UzhK8jCdLuMGYL6KvzXGRSgi3yLgjewQtCPkIVz6D2QQz\nCkcheAmCJ8MqyJu5zlzyZMjAvnnAT45tRAxekrsu94sQ4egdRCnbWSDtY7kh+BIm\nlJNXoB1lBMEKIq4QDUOXoRgffuDghje1WrG9ML+Hbisq/yFOGwXD9RiX8F6sw6W4\navAuvDszue5L3sz85K+EC4Y/wFVDNvZo4TYXao6Z0f+lQKc0t8DQYzk1OXVu8rp2\nyJMC6alLbBfODALZvYH7n7do1AZls4I9d1P4jnkDrQoxB3UqQ9hVl3LEKQ73xF1O\nyK5GhDDX8oVfGKF5u+decIsH4YaTw7mP3GFxJSqv3+0lUFJoi5Lc5da149p90Ids\nhCExroL1+7mryIkXPeFM5TgO9r0rvZaBFOvV2z0gp35Z0+L4WPlbuEjN/lxPFin+\nHlUjr8gRsI3qfJOQFy/9rKIJR0Y/8Omwt/8oTWgy1mdeHmmjk7j1nYsvC9JSQ6Zv\nMldlTTKB3zhThV1+XWYp6rjd5JW1zbVWEkLNxE7GJThEUG3szgBVGP7pSWTUTsqX\nnLRbwHOoq7hHwg==\n-----END CERTIFICATE-----\n", "-----BEGIN CERTIFICATE-----\nMIIFYDCCBEigAwIBAgIQQAF3ITfU6UK47naqPGQKtzANBgkqhkiG9w0BAQsFADA/\nMSQwIgYDVQQKExtEaWdpdGFsIFNpZ25hdHVyZSBUcnVzdCBDby4xFzAVBgNVBAMT\nDkRTVCBSb290IENBIFgzMB4XDTIxMDEyMDE5MTQwM1oXDTI0MDkzMDE4MTQwM1ow\nTzELMAkGA1UEBhMCVVMxKTAnBgNVBAoTIEludGVybmV0IFNlY3VyaXR5IFJlc2Vh\ncmNoIEdyb3VwMRUwEwYDVQQDEwxJU1JHIFJvb3QgWDEwggIiMA0GCSqGSIb3DQEB\nAQUAA4ICDwAwggIKAoICAQCt6CRz9BQ385ueK1coHIe+3LffOJCMbjzmV6B493XC\nov71am72AE8o295ohmxEk7axY/0UEmu/H9LqMZshftEzPLpI9d1537O4/xLxIZpL\nwYqGcWlKZmZsj348cL+tKSIG8+TA5oCu4kuPt5l+lAOf00eXfJlII1PoOK5PCm+D\nLtFJV4yAdLbaL9A4jXsDcCEbdfIwPPqPrt3aY6vrFk/CjhFLfs8L6P+1dy70sntK\n4EwSJQxwjQMpoOFTJOwT2e4ZvxCzSow/iaNhUd6shweU9GNx7C7ib1uYgeGJXDR5\nbHbvO5BieebbpJovJsXQEOEO3tkQjhb7t/eo98flAgeYjzYIlefiN5YNNnWe+w5y\nsR2bvAP5SQXYgd0FtCrWQemsAXaVCg/Y39W9Eh81LygXbNKYwagJZHduRze6zqxZ\nXmidf3LWicUGQSk+WT7dJvUkyRGnWqNMQB9GoZm1pzpRboY7nn1ypxIFeFntPlF4\nFQsDj43QLwWyPntKHEtzBRL8xurgUBN8Q5N0s8p0544fAQjQMNRbcTa0B7rBMDBc\nSLeCO5imfWCKoqMpgsy6vYMEG6KDA0Gh1gXxG8K28Kh8hjtGqEgqiNx2mna/H2ql\nPRmP6zjzZN7IKw0KKP/32+IVQtQi0Cdd4Xn+GOdwiK1O5tmLOsbdJ1Fu/7xk9TND\nTwIDAQABo4IBRjCCAUIwDwYDVR0TAQH/BAUwAwEB/zAOBgNVHQ8BAf8EBAMCAQYw\nSwYIKwYBBQUHAQEEPzA9MDsGCCsGAQUFBzAChi9odHRwOi8vYXBwcy5pZGVudHJ1\nc3QuY29tL3Jvb3RzL2RzdHJvb3RjYXgzLnA3YzAfBgNVHSMEGDAWgBTEp7Gkeyxx\n+tvhS5B1/8QVYIWJEDBUBgNVHSAETTBLMAgGBmeBDAECATA/BgsrBgEEAYLfEwEB\nATAwMC4GCCsGAQUFBwIBFiJodHRwOi8vY3BzLnJvb3QteDEubGV0c2VuY3J5cHQu\nb3JnMDwGA1UdHwQ1MDMwMaAvoC2GK2h0dHA6Ly9jcmwuaWRlbnRydXN0LmNvbS9E\nU1RST09UQ0FYM0NSTC5jcmwwHQYDVR0OBBYEFHm0WeZ7tuXkAXOACIjIGlj26Ztu\nMA0GCSqGSIb3DQEBCwUAA4IBAQAKcwBslm7/DlLQrt2M51oGrS+o44+/yQoDFVDC\n5WxCu2+b9LRPwkSICHXM6webFGJueN7sJ7o5XPWioW5WlHAQU7G75K/QosMrAdSW\n9MUgNTP52GE24HGNtLi1qoJFlcDyqSMo59ahy2cI2qBDLKobkx/J3vWraV0T9VuG\nWCLKTVXkcGdtwlfFRjlBz4pYg1htmf5X6DYO8A4jqv2Il9DjXA6USbW1FzXSLr9O\nhe8Y4IWS6wY7bCkjCWDcRQJMEhg76fsO3txE+FiYruq9RUWhiF1myv4Q6W+CyBFC\nDfvp7OOGAN6dEOM4+qR9sdjoSYKEBpsr6GtPAQw4dy753ec5\n-----END CERTIFICATE-----\n"], "dhparams": {"prime": "ffffffffffffffffc90fdaa22168c234c4c6628b80dc1cd129024e088a67cc74020bbea63b139b22514a08798e3404ddef9519b3cd3a431b302b0a6df25f14374fe1356d6d51c245e485b576625e7ec6f44c42e9a637ed6b0bff5cb6f406b7edee386bfb5a899fa5ae9f24117c4b1fe649286651ece65381ffffffffffffffff", "public_key": "f781bdb4c2c63f03b70ebbbadd551511c1d535e2064da30df70ef6b7834d131db44e71e20b736061e6d2d633c4cdb59506d8a1b1ccb8563825eca010c9c0a79d4987446e15c5a1f97a94e1f0a01eff70a46a49d668547f72e5c94bb2995b4aecf54c6efc33c015edf487dbd0ca012decd6ff98b02240d52cd508565016faf59b", "bits": 1024, "generator": 2, "fingerprint": "RFC2409/Oakley Group 2"}, "versions": ["-TLSv1", "-SSLv2", "-SSLv3", "-TLSv1.1", "TLSv1.2", "TLSv1.3"], "acceptable_cas": [], "tlsext": [{"id": 43, "name": "supported_versions"}, {"id": 51, "name": "key_share"}, {"id": 10, "name": "supported_groups"}], "ja3s": "f03a69cfa3944d6d51bc52febd87a1a8", "cert": {"sig_alg": "sha256WithRSAEncryption", "issued": "20230710130704Z", "expires": "20231008130703Z", "expired": false, "version": 2, "extensions": [{"critical": true, "data": "\\x03\\x02\\x05\\xa0", "name": "keyUsage"}, {"data": "0\\x14\\x06\\x08+\\x06\\x01\\x05\\x05\\x07\\x03\\x01\\x06\\x08+\\x06\\x01\\x05\\x05\\x07\\x03\\x02", "name": "extendedKeyUsage"}, {"critical": true, "data": "0\\x00", "name": "basicConstraints"}, {"data": "\\x04\\x14\\x05K:\\x15\\xffN#L\\xd0\\xc0\\x80Q\\x18\\x8a\\xc4=p\\x06\\x991", "name": "subjectKeyIdentifier"}, {"data": "0\\x16\\x80\\x14\\x14.\\xb3\\x17\\xb7XV\\xcb\\xaeP\\t@\\xe6\\x1f\\xaf\\x9d\\x8b\\x14\\xc2\\xc6", "name": "authorityKeyIdentifier"}, {"data": "0G0!\\x06\\x08+\\x06\\x01\\x05\\x05\\x070\\x01\\x86\\x15http://r3.o.lencr.org0\"\\x06\\x08+\\x06\\x01\\x05\\x05\\x070\\x02\\x86\\x16http://r3.i.lencr.org/", "name": "authorityInfoAccess"}, {"data": "0\\x1c\\x82\\r*.nonalom.com\\x82\\x0bnonalom.com", "name": "subjectAltName"}, {"data": "0\\n0\\x08\\x06\\x06g\\x81\\x0c\\x01\\x02\\x01", "name": "certificatePolicies"}, {"data": "\\x04\\x81\\xf2\\x00\\xf0\\x00v\\x00z2\\x8cT\\xd8\\xb7-\\xb6 \\xea8\\xe0R\\x1e\\xe9\\x84\\x16p2\\x13\\x85M;\\xd2+\\xc1:W\\xa3R\\xebR\\x00\\x00\\x01\\x89@ \\x95\\x11\\x00\\x00\\x04\\x03\\x00G0E\\x02!\\x00\\x80O\\xda\\x9en\\x03\\xc8)J\\xa1\\x16\\x97\\xf5\\xcc\\x99;\\x82X\\tR\\xf7\\x02\\x9f\\x06\\xddV\\x17\\x03z0\\xc8p\\x02 2!A\\x8c\\xd1\\xa3\\t\\xe8G%\\xa4\\xfd2\\r\\x9a\\xb8\\xfe\\t\\xf0\\xa5A\\xa3k\\xea\\xb4\\xca\\xae\\x10\\xe5\\xe0\\xf9o\\x00v\\x00\\xad\\xf7\\xbe\\xfa|\\xff\\x10\\xc8\\x8b\\x9d=\\x9c\\x1e>\\x18j\\xb4g)]\\xcf\\xb1\\x0c$\\xca\\x85\\x864\\xeb\\xdc\\x82\\x8a\\x00\\x00\\x01\\x89@ \\x95.\\x00\\x00\\x04\\x03\\x00G0E\\x02 P\\xc1\\xdf\\xb2\\x12\\xa7Hb<JA\\xa1L_\\xb5\\xc4\\xcc(\\xb0\\xf0\\xd6\\xbd\\xf1\\xb6\\xc5\\xdb3\\xbfv~\\x1f\\xff\\x02!\\x00\\x81\\xf7\\xfbm\\xbb-\\xc0\\xb9\\xbd\\xa9\\xea\\xb6!\\xa6\\xf7\\xa1\\x98=\\xb9\\xef\\xd2\\x05\\xed\\x9ar\\xfaK\\xa5\\xd9\\x9c\\x91\\xdd", "name": "ct_precert_scts"}], "fingerprint": {"sha256": "046ce3d821d0a7989252c4bbb3d4c7c987aea61e99ee589deb84ab6d5e129938", "sha1": "d2d6b7062e05e1033e417d0d55c28337dc452f1c"}, "serial": 295289226759043766293855743883348292307061, "subject": {"CN": "nonalom.com"}, "pubkey": {"type": "rsa", "bits": 2048}, "issuer": {"C": "US", "CN": "R3", "O": "Let's Encrypt"}}, "cipher": {"version": "TLSv1.3", "bits": 256, "name": "TLS_AES_256_GCM_SHA384"}, "trust": {"revoked": false, "browser": null}, "handshake_states": ["before SSL initialization", "SSLv3/TLS write client hello", "SSLv3/TLS read server hello", "TLSv1.3 read encrypted extensions", "SSLv3/TLS read server certificate", "TLSv1.3 read server certificate verify", "SSLv3/TLS read finished", "SSLv3/TLS write change cipher spec", "SSLv3/TLS write finished", "SSL negotiation finished successfully"], "alpn": [], "ocsp": {}}, "hostnames": ["nonalom.com", "ec2-50-17-149-220.compute-1.amazonaws.com"], "org": "Amazon Data Services NoVa", "data": "HTTP/1.1 404 Not Found\r\nDate: Tue, 8 Aug 2023 15:24:35 GMT\r\nContent-Type: text/plain\r\nContent-Length: 0\r\n\r\n\nCobalt Strike Beacon:\n  x86:\n    beacon_type: HTTPS\n    dns-beacon.strategy_fail_seconds: -1\n    dns-beacon.strategy_fail_x: -1\n    dns-beacon.strategy_rotate_seconds: -1\n    http-get.client:\n      Accept: */*\n      Host: https://d11xzcebh7lvkz.cloudfront.net\n      session-token=\n      skin=noskin;\n      csm-hit=s-24KU11BB82RZSYGJ3BDK|1419899012996\n      Cookie\n    http-get.uri: d11xzcebh7lvkz.cloudfront.net,/s/ref=nb_sb_noss_1/167-3294888-0262949/field-keywords=books,50.17.149.220,/s/ref=nb_sb_noss_1/167-3294888-0262949/field-keywords=books\n    http-get.verb: GET\n    http-post.client:\n      Accept: */*\n      Content-Type: text/xml\n      X-Requested-With: XMLHttpRequest\n      Host: https://d11xzcebh7lvkz.cloudfront.net\n      sz=160x600\n      oe=oe=ISO-8859-1;\n      sn\n      s=3717\n      dc_ref=http%3A%2F%2Fwww.amazon.com\n    http-post.uri: /N4215/adj/amzn.us.sr.aps\n    http-post.verb: POST\n    kill_date: 20230930\n    maxgetsize: 1048576\n    port: 443\n    post-ex.spawnto_x64: %windir%\\sysnative\\rundll32.exe\n    post-ex.spawnto_x86: %windir%\\syswow64\\rundll32.exe\n    process-inject.execute:\n      CreateThread\n      SetThreadContext\n      CreateRemoteThread\n      RtlCreateUserThread\n    process-inject.startrwx: 64\n    process-inject.stub: 6eebe6e473d3503233aa56f2ce51f5b1\n    process-inject.userwx: 64\n    proxy.behavior: 2 (Use IE settings)\n    server.publickey_md5: de85dae85c9c3049716d1e752dda33ef\n    sleeptime: 5000\n    useragent_header: Mozilla/5.0 (Windows NT 6.1; WOW64; Trident/7.0; rv:11.0) like Gecko\n    uses_cookies: 1\n    watermark: 144392904\n  x64:\n    beacon_type: HTTPS\n    dns-beacon.strategy_fail_seconds: -1\n    dns-beacon.strategy_fail_x: -1\n    dns-beacon.strategy_rotate_seconds: -1\n    http-get.client:\n      Accept: */*\n      Host: https://d11xzcebh7lvkz.cloudfront.net\n      session-token=\n      skin=noskin;\n      csm-hit=s-24KU11BB82RZSYGJ3BDK|1419899012996\n      Cookie\n    http-get.uri: d11xzcebh7lvkz.cloudfront.net,/s/ref=nb_sb_noss_1/167-3294888-0262949/field-keywords=books,50.17.149.220,/s/ref=nb_sb_noss_1/167-3294888-0262949/field-keywords=books\n    http-get.verb: GET\n    http-post.client:\n      Accept: */*\n      Content-Type: text/xml\n      X-Requested-With: XMLHttpRequest\n      Host: https://d11xzcebh7lvkz.cloudfront.net\n      sz=160x600\n      oe=oe=ISO-8859-1;\n      sn\n      s=3717\n      dc_ref=http%3A%2F%2Fwww.amazon.com\n    http-post.uri: /N4215/adj/amzn.us.sr.aps\n    http-post.verb: POST\n    kill_date: 20230930\n    maxgetsize: 1048576\n    port: 443\n    post-ex.spawnto_x64: %windir%\\sysnative\\rundll32.exe\n    post-ex.spawnto_x86: %windir%\\syswow64\\rundll32.exe\n    process-inject.execute:\n      CreateThread\n      SetThreadContext\n      CreateRemoteThread\n      RtlCreateUserThread\n    process-inject.startrwx: 64\n    process-inject.stub: 6eebe6e473d3503233aa56f2ce51f5b1\n    process-inject.userwx: 64\n    proxy.behavior: 2 (Use IE settings)\n    server.publickey_md5: de85dae85c9c3049716d1e752dda33ef\n    sleeptime: 5000\n    useragent_header: Mozilla/5.0 (Windows NT 6.1; WOW64; Trident/7.0; rv:11.0) like Gecko\n    uses_cookies: 1\n    watermark: 144392904\n", "asn": "AS14618", "isp": "Amazon.com, Inc.", "domains": ["nonalom.com", "amazonaws.com"], "ip_str": "50.17.149.220", "os": null, "_shodan": {"region": "eu", "ptr": true, "module": "https", "id": "96334436-1700-4585-88d5-010c6c27be79", "options": {}, "crawler": "487814a778c983e2dcef234806292d88c5cbf3ec"}, "opts": {"vulns": [], "heartbleed": "2023/08/08 15:24:46 50.17.149.220:443 - SAFE\n"}}
{"hash": 759352291, "cobalt_strike_beacon": {"x86": {"beacon_type": "HTTP", "dns-beacon.strategy_rotate_seconds": -1, "useragent_header": "Mozilla/5.0 (compatible; MSIE 8.0; Windows NT 6.1; Trident/5.0)", "http-post.client": ["Accept: */*", "JSESSION=", "Cookie"], "maxgetsize": 1398104, "post-ex.spawnto_x86": "%windir%\\syswow64\\rundll32.exe", "port": 80, "sleeptime": 3000, "uses_cookies": 1, "proxy.behavior": "2 (Use IE settings)", "process-inject.execute": ["CreateThread", "SetThreadContext", "CreateRemoteThread", "RtlCreateUserThread"], "process-inject.startrwx": 64, "post-ex.spawnto_x64": "%windir%\\sysnative\\rundll32.exe", "process-inject.stub": "222b8f27dbdfba8ddd559eeca27ea648", "http-get.uri": "82.157.57.149,/api/getit", "watermark": 1234567890, "dns-beacon.strategy_fail_seconds": -1, "process-inject.userwx": 64, "dns-beacon.strategy_fail_x": -1, "http-post.verb": "POST", "http-post.uri": "/api/postit", "server.publickey_md5": "a02898e6ab3a4dc0b1925a551e6b895c", "http-get.verb": "GET", "http-get.client": ["Accept: */*", "SESSIONID=", "Cookie"]}, "x64": {"beacon_type": "HTTP", "dns-beacon.strategy_rotate_seconds": -1, "useragent_header": "Mozilla/5.0 (compatible; MSIE 8.0; Windows NT 6.1; Trident/5.0)", "http-post.client": ["Accept: */*", "JSESSION=", "Cookie"], "maxgetsize": 1398104, "post-ex.spawnto_x86": "%windir%\\syswow64\\rundll32.exe", "port": 80, "sleeptime": 3000, "uses_cookies": 1, "proxy.behavior": "2 (Use IE settings)", "process-inject.execute": ["CreateThread", "SetThreadContext", "CreateRemoteThread", "RtlCreateUserThread"], "process-inject.startrwx": 64, "post-ex.spawnto_x64": "%windir%\\sysnative\\rundll32.exe", "process-inject.stub": "222b8f27dbdfba8ddd559eeca27ea648", "http-get.uri": "82.157.57.149,/api/getit", "watermark": 1234567890, "dns-beacon.strategy_fail_seconds": -1, "process-inject.userwx": 64, "dns-beacon.strategy_fail_x": -1, "http-post.verb": "POST", "http-post.uri": "/api/postit", "server.publickey_md5": "a02898e6ab3a4dc0b1925a551e6b895c", "http-get.verb": "GET", "http-get.client": ["Accept: */*", "SESSIONID=", "Cookie"]}}, "product": "Cobalt Strike Beacon", "http": {"status": 404, "robots_hash": null, "redirects": [], "securitytxt": null, "title": null, "sitemap_hash": null, "robots": null, "server": null, "headers_hash": 2129120964, "host": "82.157.57.149", "html": "", "location": "/", "html_hash": 0, "sitemap": null, "securitytxt_hash": null}, "os": null, "tags": ["cloud"], "timestamp": "2023-08-07T19:35:36.951065", "isp": "Shenzhen Tencent Computer Systems Company Limited", "transport": "tcp", "_shodan": {"region": "eu", "ptr": true, "module": "http", "id": "1b82499a-28b7-4e70-ac97-ae2b6f1b9c9f", "options": {}, "crawler": "487814a778c983e2dcef234806292d88c5cbf3ec"}, "asn": "AS45090", "cloud": {"region": null, "service": null, "provider": "Tencent Cloud"}, "hostnames": [], "location": {"city": "Beijing", "region_code": "BJ", "area_code": null, "longitude": 116.39723, "latitude": 39.9075, "country_code": "CN", "country_name": "China"}, "ip": 1386035605, "domains": [], "org": "Tencent Cloud Computing (Beijing) Co., Ltd", "data": "HTTP/1.1 404 Not Found\r\nDate: Mon, 7 Aug 2023 19:35:36 GMT\r\nContent-Type: text/plain\r\nContent-Length: 0\r\n\r\n\nCobalt Strike Beacon:\n  x86:\n    beacon_type: HTTP\n    dns-beacon.strategy_fail_seconds: -1\n    dns-beacon.strategy_fail_x: -1\n    dns-beacon.strategy_rotate_seconds: -1\n    http-get.client:\n      Accept: */*\n      SESSIONID=\n      Cookie\n    http-get.uri: 82.157.57.149,/api/getit\n    http-get.verb: GET\n    http-post.client:\n      Accept: */*\n      JSESSION=\n      Cookie\n    http-post.uri: /api/postit\n    http-post.verb: POST\n    maxgetsize: 1398104\n    port: 80\n    post-ex.spawnto_x64: %windir%\\sysnative\\rundll32.exe\n    post-ex.spawnto_x86: %windir%\\syswow64\\rundll32.exe\n    process-inject.execute:\n      CreateThread\n      SetThreadContext\n      CreateRemoteThread\n      RtlCreateUserThread\n    process-inject.startrwx: 64\n    process-inject.stub: 222b8f27dbdfba8ddd559eeca27ea648\n    process-inject.userwx: 64\n    proxy.behavior: 2 (Use IE settings)\n    server.publickey_md5: a02898e6ab3a4dc0b1925a551e6b895c\n    sleeptime: 3000\n    useragent_header: Mozilla/5.0 (compatible; MSIE 8.0; Windows NT 6.1; Trident/5.0)\n    uses_cookies: 1\n    watermark: 1234567890\n  x64:\n    beacon_type: HTTP\n    dns-beacon.strategy_fail_seconds: -1\n    dns-beacon.strategy_fail_x: -1\n    dns-beacon.strategy_rotate_seconds: -1\n    http-get.client:\n      Accept: */*\n      SESSIONID=\n      Cookie\n    http-get.uri: 82.157.57.149,/api/getit\n    http-get.verb: GET\n    http-post.client:\n      Accept: */*\n      JSESSION=\n      Cookie\n    http-post.uri: /api/postit\n    http-post.verb: POST\n    maxgetsize: 1398104\n    port: 80\n    post-ex.spawnto_x64: %windir%\\sysnative\\rundll32.exe\n    post-ex.spawnto_x86: %windir%\\syswow64\\rundll32.exe\n    process-inject.execute:\n      CreateThread\n      SetThreadContext\n      CreateRemoteThread\n      RtlCreateUserThread\n    process-inject.startrwx: 64\n    process-inject.stub: 222b8f27dbdfba8ddd559eeca27ea648\n    process-inject.userwx: 64\n    proxy.behavior: 2 (Use IE settings)\n    server.publickey_md5: a02898e6ab3a4dc0b1925a551e6b895c\n    sleeptime: 3000\n    useragent_header: Mozilla/5.0 (compatible; MSIE 8.0; Windows NT 6.1; Trident/5.0)\n    uses_cookies: 1\n    watermark: 1234567890\n", "port": 80, "opts": {}, "ip_str": "82.157.57.149"}
